"","TOPIC","AUTHOR","UID","TITLE","ABSTRACT","NOTES"
"17","Climate_Change","TEDONE L, 2018, J CLEAN PROD","ISI000423002200068","NITROGEN MANAGEMENT STRATEGY FOR OPTIMIZING AGRONOMIC AND ENVIRONMENTAL PERFORMANCE OF RAINFED DURUM WHEAT UNDER MEDITERRANEAN CLIMATE","EFFICIENT NITROGEN (N) FERTILIZER MANAGEMENT IS CRITICAL FOR WHEAT PRODUCTION AND THE LONG-TERM PROTECTION OF THE ENVIRONMENT. GIVEN THE IMPORTANCE OF DURUM WHEAT FOR THE ITALIAN ECONOMY, ITS ENVIRONMENTAL IMPLICATIONS NEED TO BE INVESTIGATED FOR DESIGNING SUSTAINABLE PRODUCTION SYSTEM. THREE CONCURRENT EXPERIMENTS WERE CARRIED OUT IN GRAVINA IN PUGLIA (APULIA, SOUTHERN ITALY) TO INVESTIGATE THE AGRONOMIC AND ENVIRONMENTAL RESPONSE OF RAINFED DURUM WHEAT (TRITICUM TURGIDUM L., VAR. DURUM) TO DIFFERENT N RATES, N SOURCE AND APPLICATION TIME OVER THREE YEARS (2010-2012). IN THE THREE EXPERIMENTS, THE FOLLOWING PARAMETERS WERE ANALYZED: GRAIN YIELD, YIELD COMPONENTS (I.E. HARVEST INDEX, SPIKES M(-2)), QUALITY TRAITS (I.E. HECTOLITER WEIGHT, PROTEIN CONTENT), ENERGY INPUT/OUTPUT ANALYSIS INCLUDING THE CALCULATION OF ENERGY INDEXES AND GREENHOUSE GAS (GHG) EMISSIONS. THE N RATE EXPERIMENT INCLUDED RATES OF 45, 90 AND 135 KG N HA(-1). EACH RATE WAS SPLIT IN VARIOUS PROPORTIONS BETWEEN SOWING, TILLERING AND STEM ELONGATION. FOR THE EXPERIMENT ON N TIMING AND SPLITTING, A SINGLE DOSE OF 90 KG N HA(-1) WAS SPLIT BETWEEN SOWING, TILLERING AND STEM ELONGATION AT DIFFERENT FRACTIONS (0-90-0; 40-50-0; 10-40-40). THE N FERTILIZER SOURCE EXPERIMENT TESTED THE EFFECT OF THE APPLICATION OF 90 KG N HA(-1) OF UREA SPLIT AT SOWING AND TILLERING (12-78-0) ON THE INVESTIGATED PARAMETERS, AND COMPARED TO ENTEC (R) 26 AND SULFAMMO 23 WITH THE SAME DOES AND APPLICATION TIME. NITROGEN AGRONOMIC EFFICIENCY (NAE) WAS ALSO CALCULATED TO ASSESS THE POTENTIAL YIELD INCREASE IN RESPONSE TO DIFFERENT N FERTILIZER RATES AND TYPES. THE RESULTS SHOWED THAT N RATE, N SOURCE AND THE APPLICATION TIME HAD A SIGNIFICANT IMPACT ON GRAIN YIELD, GRAIN PROTEIN CONTENT, ENERGY OUTPUT AND GHG EMISSIONS UNDER NORMAL WEATHER CONDITIONS. CONSIDERING THE SITE-SPECIFIC CONDITION, THE OVERALL RESULTS REVEALED THAT THE SPLIT APPLICATION OF 90 KG N HA(-1) DURING THREE GROWTH STAGES GAVE FAVORABLE RESULTS IN TERMS OF GRAIN YIELD AND QUALITY, AND OPTIMIZES NAE WITH LESS ENVIRONMENTAL IMPACT. THE EFFECTIVENESS AND EFFICIENCY OF THIS STRATEGY WAS MORE PRONOUNCED WHEN TWO-THIRD OF THE FULL N DOSE WAS APPLIED AT LATER STAGES (TILLERING AND STEM ELONGATION). THIS STRATEGY FOUND TO BE MORE EFFECTIVE IN IMPROVING WHEAT YIELD AND QUALITY THAN THE INCREASE IN THE N RATE, WHICH COULD OFFER THE POTENTIAL TO DECREASE N FERTILIZATION RATE IN WHEAT PRODUCTION. THIS STUDY PROVIDES USEFUL INFORMATION FOR FARMERS ON HOW TO MANAGE THE N FERTILIZATION OF WHEAT FOR SUSTAINABLE PRODUCTION SYSTEM. (C) 2017 ELSEVIER LTD. ALL RIGHTS RESERVED.",""
"18","Climate_Change","BJELLE EL, 2018, J CLEAN PROD","ISI000423001900019","CLIMATE CHANGE MITIGATION POTENTIAL OF NORWEGIAN HOUSEHOLDS AND THE REBOUND EFFECT","AN INCREASING NUMBER OF STUDIES SHOW THAT EFFICIENCY IMPROVEMENTS ALONE WILL NOT BE SUFFICIENT TO ATTAIN THE SUBSTANTIAL EMISSION REDUCTIONS NEEDED TO MITIGATE GLOBAL WARMING TO A TARGET OF 2 DEGREES C. CONSUMPTION SIDE CHANGES ARE LIKELY TO BE NEEDED TO ACHIEVE SUFFICIENT EMISSION REDUCTIONS. THE UNITED NATIONS EMPHASIZE THE IMPORTANCE OF DEVELOPED COUNTRIES TAKING THE LEAD IN LOWERING EMISSIONS TO ACHIEVE THE SUSTAINABLE DEVELOPMENT GOALS. THIS PAPER ASSESS TO WHAT EXTENT NORWEGIAN HOUSEHOLDS CAN LOWER THEIR CARBON FOOTPRINT CONSISTENT WITH TERRITORIAL EMISSION REDUCTIONS TOWARDS THE 2 DEGREES C TARGET OF GLOBAL WARMING THROUGH IMPLEMENTING A SET OF BEHAVIORAL ACTIONS. WE EVALUATE THE EFFICACY OF THE SET OF ACTIONS BOTH INITIALLY AND AFTER CONSIDERING REBOUND EFFECTS. A MULTIREGIONAL ENVIRONMENTALLY EXTENDED INPUT-OUTPUT DATABASE IS LINKED WITH THE NORWEGIAN CONSUMER EXPENDITURE SURVEY TO ANALYZE BOTH AVERAGE AND MARGINAL EXPENDITURE PER UNIT OF INCREASED INCOME. FURTHER, LINEAR PROGRAMMING IS APPLIED TO EXAMINE THE CHANGES NEEDED BY HOUSEHOLDS TO REACH DIFFERENT EMISSION REDUCTION TARGETS. WE FIND THAT HOUSEHOLDS IMPLEMENTING THE FULL SET OF ACTIONS WITHOUT RE-SPENDING CAN OBTAIN A 58\% DECREASE IN THEIR CARBON FOOTPRINT. WHEN ACCOUNTING FOR THE EFFECT OF RE-SPENDING, THIS REDUCTION DROPS TO 24-35\%, WHICH IS NOT WITHIN THE REQUIREMENTS OF THE 2 DEGREES C TARGET. THE OPTIMIZATION ANALYSIS SUGGESTS HOUSEHOLDS CAN ACHIEVE REDUCTIONS UP TO 45\% BY RESTRICTING RE-SPENDING TO SPECIFIC GOODS AND SERVICES. THIS INDICATES THAT CURBING THE REBOUND EFFECT IS KEY TO ACHIEVING REAL REDUCTIONS IN HOUSEHOLD CARBON FOOTPRINTS. WE SHOW THAT CHANGING CONSUMPTION PATTERNS CAN SIGNIFICANTLY CONTRIBUTE TO LOWERING ANTHROPOGENIC GREENHOUSE GAS EMISSIONS WITHOUT COMPROMISING THE LEVEL OF ECONOMIC ACTIVITY. (C) 2017 THE AUTHORS. PUBLISHED BY ELSEVIER LTD.",""
"19","Climate_Change","VICTORIA ROMAN M, 2018, ECON SYST RES","ISI000423491500003","WHY DO SOME ECONOMIES BENEFIT MORE FROM CLIMATE FINANCE THAN OTHERS? A CASE STUDY ON NORTH-TO-SOUTH FINANCIAL FLOWS","THE COPENHAGEN AND PARIS AGREEMENTS, IN WHICH DEVELOPED COUNTRIES COMMITTED TO MOBILISE USD 100 BILLION A YEAR BY 2020, INDICATE THAT CLIMATE FINANCE WILL CONTINUE TO GROW. EVEN THOUGH ECONOMIC DEVELOPMENT IS NOT THE AIM OF CLIMATE FINANCE, CLIMATE-RELATED DISBURSEMENTS WILL GENERATE AN ECONOMIC IMPACT ON RECIPIENT COUNTRIES' ECONOMIES. THIS IMPACT WILL ALSO REACH OTHER COUNTRIES (INCLUDING CLIMATE FINANCE DONORS) THROUGH INDUCED INTERNATIONAL TRADE. IN THIS PAPER, WE APPLY A STRUCTURAL DECOMPOSITION ANALYSIS TO STUDY WHY THE ECONOMIC IMPACT OF CLIMATE FINANCE VARIES BETWEEN COUNTRIES. WE FOCUS ON SPECIFIC CLIMATE ACTIONS AND QUANTIFY THE CONTRIBUTION OF FOUR DRIVERS: VALUE-ADDED INTENSITY, DOMESTIC MULTIPLIER, FOREIGN MULTIPLIER AND TRADE STRUCTURE. THE PAPER HELPS IDENTIFYING THE FACTORS WITH THE GREATEST POTENTIAL TO ENHANCE THE ECONOMIC GAINS OF CLIMATE FINANCE IN EACH COUNTRY. THIS INFORMATION CAN BE USEFUL FOR POLICY-MAKERS TRYING TO DESIGN NATIONAL STRATEGIES THAT EXPLOIT THE SYNERGIES BETWEEN CLIMATE ACTION AND ECONOMIC DEVELOPMENT.",""
"20","Climate_Change","DISTEFANO T, 2017, ECOL ECON","ISI000412259200013","ARE WE IN DEEP WATER? WATER SCARCITY AND ITS LIMITS TO ECONOMIC GROWTH","WATER IS AN IMPORTANT FACTOR OF PRODUCTION CONTRIBUTING BOTH DIRECTLY AND INDIRECTLY TO ECONOMIC ACTIVITY ACROSS ALL SECTORS AND REGIONS OF THE GLOBAL ECONOMY. WATER SCARCITY MAY THEREFORE GO BEYOND HAVING IMPORTANT CONSEQUENCES FOR PEOPLE, SOCIETY AND ECOLOGICAL SYSTEMS BUT MAY ALSO POSE A THREAT TO ECONOMIC GROWTH. USING THE LATEST IPCC RCP PROJECTIONS AND THE OECD SHARED SOCIO-ECONOMIC PATHWAYS (SSPS) FOR POPULATION GROWTH AND ECONOMIC OUTPUT, WE DEVELOP A MULTI-REGIONAL INPUT-OUTPUT MODEL TO ESTIMATE FUTURE DEMAND FOR WATER RESOURCES ACROSS DIFFERENT COUNTRIES AND SECTORS OF THE GLOBAL ECONOMY. MODEL RESULTS SHOW THAT MOST COUNTRIES WILL EXPERIENCE DECLINING WATER AVAILABILITY, PARTICULARLY THOSE COUNTRIES THAT EXPERIENCE A CONFLUENCE OF FACTORS INCLUDING LOW FRESH WATER AVAILABILITY, HIGH CLIMATE CHANGE IMPACTS, AND GROWING CONSUMPTION PATTERNS. WE SHOW THAT VIRTUAL WATER TRADE AND IMPROVED WATER EFFICIENCY HAS POTENTIAL TO ALLEVIATE THE WORST EFFECTS OF WATER SCARCITY FOR WEALTHY COUNTRIES BUT MAY HAVE LIMITED EFFECT ON POORER COUNTRIES. THE ANALYSIS CONCLUDES THAT THE MOST IMPORTANT DRIVER OF FUTURE WATER SCARCITY IS ECONOMIC GROWTH, WHICH OVERWHELMS ANY REALISTIC SAVINGS THAT CAN BE MADE FROM INCREASED TECHNOLOGICAL PROGRESS AND IMPROVEMENTS TO WATER EFFICIENCY. POPULATION GROWTH AND CLIMATE CHANGE ARE ALSO SHOWN TO BE IMPORTANT DRIVERS OF FUTURE WATER SCARCITY, PARTICULARLY OVER THE LONG-RUN. (C) 2017 ELSEVIER B.V. ALL RIGHTS RESERVED.",""
"21","Climate_Change","FAN JL, 2017, MITIG ADAPT STRATEG GLOB CHANG","ISI000413272600006","THE EVOLUTION OF CO2 EMISSIONS IN INTERNATIONAL TRADE FOR MAJOR ECONOMIES: A PERSPECTIVE FROM THE GLOBAL SUPPLY CHAIN","EMPLOYING GLOBAL MULTI-REGIONAL INPUT-OUTPUT MODELS, THIS PAPER REVISITS THE CARBON DIOXIDE (CO2) EMISSION TRADE (INCLUDING EXPORTS AND IMPORTS) AND ASSESSES THEIR POSITIONS IN THE NATIONAL EMISSIONS OF 14 MAJOR COUNTRIES WITH LARGE NATIONAL EMISSIONS OR LARGE EMISSION TRADES DURING 1995-2009. IT ESPECIALLY EXPLORES THE EVOLUTION OF THE EMISSION TRADES OF THESE COUNTRIES FROM BOTH CONTINUOUS TIME SERIES AND COMPARATIVE PERSPECTIVES, IN ORDER TO PROVIDE AN EXPLANATION FOR CO2 EMISSION SPILLOVERS ACROSS COUNTRIES. THE MAIN FINDINGS OBTAINED WERE AS FOLLOWS: (1) CHINA WAS THE LARGEST CO2 EXPORTER TO OTHER COUNTRIES, ACCOUNTING FOR OVER 20 \% OF GLOBAL EXPORTS SINCE 2005; THE CO2 EXPORTS OF THE UNITED STATES OF AMERICA (USA), GERMANY, AND JAPAN VARIED SLIGHTLY OVER THIS TIME PERIOD, BUT OVERALL, THEIR PROPORTIONS HAD DECREASED. (2) THE CO2 IMPORTS OF THE USA WERE THE LARGEST, OCCUPYING AROUND 20 \% OF THE GLOBAL CO2 IMPORTS; MEANWHILE, CHINA'S CO2 IMPORTS INCREASED RAPIDLY AND RANKED THE SECOND LARGEST. (3) FOR CHINESE TAIWAN, ITS PROPORTION OF CO2 EXPORTS IN PRODUCTION-BASED EMISSIONS RANKED THE HIGHEST WHILE THAT OF THE USA RANKED THE LOWEST; HIGHLY CO2 IMPORT-DEPENDENT COUNTRIES WITH AN OVER 40 \% PROPORTION OF CO2 IMPORTS IN ITS CONSUMPTION-BASED EMISSIONS INCLUDED FRANCE, GERMANY, ITALY, AND SPAIN, WHILE CHINA, INDIA, AND RUSSIA REMAINED THE LOWEST, DISTINGUISHED FROM THEIR PHYSICAL ENERGY IMPORTS. THESE RESULTS SUGGESTED THAT THE GLOBAL POLICY MAKERS SHOULD TAKE THE CO2 EMISSIONS IN TRADE INTO CONSIDERATION WHEN CAREFULLY ACCOUNTING FOR NATIONAL EMISSIONS INVENTORIES.",""
"22","Climate_Change","IVANOVA D, 2017, ENVIRON RES LETT","ISI000401335300001","MAPPING THE CARBON FOOTPRINT OF EU REGIONS","WHILE THE EU COMMISSION HAS ENCOURAGED MEMBER STATES TO COMBINE NATIONAL AND INTERNATIONAL CLIMATE CHANGE MITIGATION MEASURES WITH SUBNATIONAL ENVIRONMENTAL POLICIES, THERE HAS BEEN LITTLE HARMONIZED EFFORT TOWARDS THE QUANTIFICATION OF EMBODIED GREENHOUSE GAS (GHG) EMISSIONS FROM HOUSEHOLD CONSUMPTION ACROSS EUROPEAN REGIONS. THIS STUDY DEVELOPS AN INVENTORY OF CARBON FOOTPRINTS ASSOCIATED WITH HOUSEHOLD CONSUMPTION FOR 177 REGIONS IN 27 EU COUNTRIES, THUS, MAKING A KEY CONTRIBUTION FOR THE INCORPORATION OF CONSUMPTION-BASED ACCOUNTING INTO LOCAL DECISION-MAKING. FOOTPRINT CALCULATIONS ARE BASED ON CONSUMER EXPENDITURE SURVEYS AND ENVIRONMENTAL AND TRADE DETAIL FROM THE EXIOBASE 2.3 MULTIREGIONAL INPUT-OUTPUT DATABASE DESCRIBING THE WORLD ECONOMY IN 2007 AT THE DETAIL OF 43 COUNTRIES, 5 REST-OF-THE-WORLD REGIONS AND 200 PRODUCT SECTORS. OUR ANALYSIS HIGHLIGHTS THE SPATIAL HETEROGENEITY OF EMBODIED GHG EMISSIONS WITHIN MULTIREGIONAL COUNTRIES WITH SUBNATIONAL RANGES VARYING WIDELY BETWEEN 0.6 AND 6.5 TCO(2)E/CAP. THE SIGNIFICANT DIFFERENCES IN REGIONAL CONTRIBUTION IN TERMS OF TOTAL AND PER CAPITA EMISSIONS SUGGEST NOTABLE DIFFERENCES WITH REGARDS TO CLIMATE CHANGE RESPONSIBILITY. THE STUDY FURTHER PROVIDES A BREAKDOWN OF REGIONAL EMISSIONS BY CONSUMPTION CATEGORIES (E.G. HOUSING, MOBILITY, FOOD). IN ADDITION, OUR REGION-LEVEL STUDY EVALUATES DRIVING FORCES OF CARBON FOOTPRINTS THROUGH A SET OF SOCIO-ECONOMIC, GEOGRAPHIC AND TECHNICAL FACTORS. INCOME IS SINGLED OUT AS THE MOST IMPORTANT DRIVER FOR A REGION'S CARBON FOOTPRINT, ALTHOUGH ITS EXPLANATORY POWER VARIES SIGNIFICANTLY ACROSS CONSUMPTION DOMAINS. ADDITIONAL FACTORS THAT STAND OUT AS IMPORTANT ON THE REGIONAL LEVEL INCLUDE HOUSEHOLD SIZE, URBAN-RURAL TYPOLOGY, LEVEL OF EDUCATION, EXPENDITURE PATTERNS, TEMPERATURE, RESOURCE AVAILABILITY AND CARBON INTENSITY OF THE ELECTRICITY MIX. THE LACK OF CROSS-NATIONAL REGION-LEVEL STUDIES HAS SO FAR PREVENTED ANALYSTS FROM DRAWING BROADER POLICY CONCLUSIONS THAT HOLD BEYOND NATIONAL AND REGIONAL BORDERS.",""
"23","Climate_Change","NISHIJIMA D, 2017, ENERGY POLICY","ISI000397549500033","THE ROLE OF TECHNOLOGY, PRODUCT LIFETIME, AND ENERGY EFFICIENCY IN CLIMATE MITIGATION: A CASE STUDY OF AIR CONDITIONERS IN JAPAN","THIS STUDY ANALYZED THE IMPACT ON THE LIFE-CYCLE CO2 EMISSIONS DERIVED FROM A SPECIFIC DURABLE GOOD (I.E., HOUSEHOLD AIR CONDITIONERS IN THIS STUDY) OF INDUSTRIAL TECHNOLOGY CHANGES, PRODUCT LIFETIME CHANGES, AND ENERGY EFFICIENCY IMPROVEMENTS. I PROPOSED A COMPREHENSIVE STRUCTURAL DECOMPOSITION ANALYSIS INCLUDING TWO FACTORS OF AVERAGE LIFETIME AND ENERGY EFFICIENCY TREND OF HOUSEHOLD AIR CONDITIONERS AND APPLIED THE DECOMPOSITION METHOD TO THE JAPANESE ENVIRONMENTAL INPUT-OUTPUT TABLES OF 1990, 1995, 2000, AND 2005. THE EMPIRICAL RESULTS SHOW THAT ``HOUSEHOLD AIR-CONDITIONER SECTOR'' ITSELF CONTRIBUTED TO REDUCING LIFE-CYCLE CO2 EMISSIONS DERIVED FROM HOUSEHOLD AIR CONDITIONERS, WHILE OTHER SECTORS SUCH AS ``ON-SITE POWER GENERATION SECTOR'' AND ``RETAIL TRADE SECTOR'' CONTRIBUTED TO INCREASING LIFE-CYCLE CO2 EMISSIONS DERIVED FROM HOUSEHOLD AIR CONDITIONERS. I ALSO CONDUCTED COMBINED SCENARIO ANALYSIS ABOUT REDUCTION POTENTIAL OF PRODUCT LIFETIME AND ENERGY EFFICIENCY OF AIR CONDITIONERS AND THE RESULTS SHOWED THE REDUCTION RATE OF ENERGY EFFICIENCY NECESSARY FOR MAINTAIN CO2 EMISSIONS IN 2005 AT 1990 LEVEL ON EACH AVERAGE LIFETIME SCENARIO. (E.G. IF AVERAGE LIFETIME OF AIR CONDITIONERS IS SHORTENED BY 1 YEAR, ENERGY EFFICIENCY OF AIR CONDITIONERS HAVE TO BE FURTHER IMPROVED BY 20.6\% FROM CURRENT LEVEL.",""
"24","Climate_Change","MARKAKI M, 2017, ENERGY POLICY","ISI000391903900020","THE CARBON FOOTPRINT OF GREEK HOUSEHOLDS (1995-2012)","THE GOAL OF THIS PAPER IS TWOFOLD: I) TO INVESTIGATE THE CARBON FOOTPRINT OF GREEK HOUSEHOLDS THROUGHOUT THE PERIOD 1995-2012, IN ORDER TO IDENTIFY THE MAIN SOCIO-ECONOMIC FACTORS THAT AFFECT GHG EMISSIONS, AND II) TO EVALUATE THE EFFECTIVENESS OF THE IMPLEMENTED POLICIES TO TACKLE CLIMATE CHANGE. IN THIS, A CONSUMPTION-BASED EMISSIONS INVENTORY APPROACH IS APPLIED. THE ANALYSIS IS BASED ON AN ENVIRONMENTALLY-EXTENDED INPUT-OUTPUT MODEL INCLUDING DIRECT CO2 EMISSIONS FROM HOUSEHOLDS, INDIRECT CO2 EMISSIONS FROM ELECTRICITY CONSUMPTION AND INDIRECT CO2 EMISSIONS FROM ENERGY USED IN THE PRODUCTION OF GOODS AND SERVICES PURCHASED BY HOUSEHOLDS, DOMESTIC OR IMPORTED. STATISTICAL ANALYSIS AND APPROPRIATE REGRESSION MODELS WERE DEVELOPED IN ORDER TO IDENTIFY THE MAIN FACTORS INFLUENCING THE CARBON FOOTPRINT OF GREEK HOUSEHOLDS. THE RESULTS INDICATE THAT THE OBSERVED TRENDS DURING THE PERIOD 1995-2008 CAN BE ATTRIBUTED TO THE EFFECT OF HIGH ECONOMIC GROWTH. THIS TREND IS PARTIALLY COUNTERBALANCED BY FAVORABLE WEATHER CONDITIONS AND THE IMPLEMENTATION OF GREENHOUSE MITIGATION POLICIES AND MEASURES MAINLY IN THE SUPPLY SIDE. SINCE 2008 THE SHRINKING HOUSEHOLD INCOME IS THE DOMINANT DRIVER. IN ADDITION, THE EFFECTIVENESS OF ENERGY CONSERVATION POLICIES AND MEASURES IN PLACE IS RATHER LOW, WHILE THE EFFECT OF IMPORTS IS LIMITED.",""
"25","Climate_Change","DE LA RUA C, 2016, BIOMASS BIOENERG","ISI000385330600003","AN INTEGRATED MULTI-REGIONAL INPUT-OUTPUT (MRIO) ANALYSIS OF MISCANTHUS BIOMASS PRODUCTION IN FRANCE: SOCIO-ECONOMIC AND CLIMATE CHANGE CONSEQUENCES","SEVERAL EUROPEAN POLICIES HAVE BEEN DESIGNED OVER THE LAST DECADES TO ADDRESS THE CHALLENGE OF CLIMATE CHANGE AND SEVERAL MEASURES HAVE BEEN PUT IN PLACE TO ACCELERATE THE DEVELOPMENT AND DEPLOYMENT OF COST-EFFECTIVE LOW CARBON TECHNOLOGIES. THE DOMESTIC NATURE OF THE RESOURCE AND ITS GREAT POTENTIAL AVAILABILITY IN EUROPE MAKE BIOMASS CONVERSION TECHNOLOGIES RELEVANT MITIGATION OPTIONS TO BE CONSIDERED. IN THIS CONTEXT, THE PROJECT ``LOGISTICS FOR ENERGY CROPS BIOMASS (LOGISTEC)'' AIMS TO DEVELOP NEW OR IMPROVE TECHNOLOGIES OF BIOMASS LOGISTICS CHAIN. IN THIS PROJECT, THE SUSTAINABILITY OF DIFFERENT TYPES OF BIOMASS IS ANALYSED IN TERMS OF ENVIRONMENTAL, ECONOMIC AND SOCIAL IMPACTS, BASED ON THE SUPPLY CHAIN OF TWO EXISTING PLANTS. THE OBJECTIVE OF THIS PAPER IS TO PRESENT THE MAIN RESULTS OBTAINED IN THE SOCIOECONOMIC ANALYSIS OF THE FRENCH CASE AND ITS CLIMATE CHANGE CONSEQUENCES. THE INPUT-OUTPUT ANALYSIS (IOA) HAS BEEN SEEN AS THE MOST APPROPRIATE METHOD TO ESTIMATE THESE IMPACTS USING A MULTIREGIONAL INPUT -OUTPUT TABLE FROM THE WORLD INPUT -OUTPUT DATABASE PROJECT. SOCIO-ECONOMIC EFFECTS HAVE BEEN ESTIMATED IN TERMS OF ADDITIONAL ECONOMIC ACTIVITY, ADDED VALUE AND JOB CREATION. BY EXTENDING THE IOA WITH ENVIRONMENTAL ACCOUNTS, GREENHOUSE GAS (GHG) EMISSIONS HAVE ALSO BEEN ESTIMATED. ADDITIONALLY, THE MOST STIMULATED SECTORS HAVE BEEN IDENTIFIED. RESULTS HIGHLIGHT THE IMPORTANCE OF BIOMASS AT A NATIONAL LEVEL. (C) 2016 ELSEVIER LTD. ALL RIGHTS RESERVED.",""
"26","Climate_Change","PINTASSILGO P, 2016, TOUR ECON","ISI000380945600002","THE ECONOMIC DIMENSION OF CLIMATE CHANGE IMPACTS ON TOURISM: THE CASE OF PORTUGAL","CLIMATE VARIABLES SUCH AS TEMPERATURE AND PRECIPITATION PLAY A CRUCIAL ROLE ON TOURISM FLOWS WORLDWIDE. THIS PLACES TOURISM AT THE FOREFRONT OF THE ECONOMIC SECTORS TO BE AFFECTED BY CLIMATE CHANGE. IN THIS ARTICLE, WE ADDRESS THE IMPACTS OF CLIMATE CHANGE ON THE ARRIVALS OF INBOUND TOURISTS TO PORTUGAL, A SOUTH EUROPEAN COUNTRY WHERE TOURISM IS A CORE ECONOMIC SECTOR. THE ECONOMIC DIMENSION OF THE IMPACTS, IN TERMS OF GROSS DOMESTIC PRODUCT (GDP) AND EMPLOYMENT, IS THEN ASSESSED. THIS IS ACHIEVED BY COMBINING A WORLD GRAVITY MODEL OF TOURISM FLOWS WITH AN INPUT-OUTPUT MODEL. THE RESULTS SHOW THAT UNDER STANDARD CLIMATE CHANGE SCENARIOS FROM THE INTERGOVERNMENTAL PANEL ON CLIMATE CHANGE, PORTUGAL WILL EXPERIENCE A SIGNIFICANT INCREASE IN TEMPERATURE LEADING TO A DECREASE OF INBOUND TOURISM ARRIVALS BETWEEN 2.5\% AND 5.2\%. THIS DECREASE IN TOURIST ARRIVALS IS EXPECTED TO REDUCE PORTUGUESE GDP BETWEEN 0.19\% AND 0.40\%.",""
"27","Climate_Change","DOLTER B, 2016, ECOL ECON","ISI000376713100013","CASTING A LONG SHADOW: DEMAND-BASED ACCOUNTING OF CANADA'S GREENHOUSE GAS EMISSIONS RESPONSIBILITY","CANADA IS THE ONLY COUNTRY TO HAVE RATIFIED THE KYOTO PROTOCOL AND THEN WITHDRAWN. PART OF THE JUSTIFICATION FOR CANADA'S RELUCTANCE TO COMMIT TO GREENHOUSE GAS (GHG) EMISSIONS REDUCTIONS IS THE COUNTRY'S STATUS AS FOSSIL FUEL EXPORTER. IN THIS PAPER WE USE INPUT-OUTPUT ANALYSIS AND THE WORLD INPUT-OUTPUT DATABASE (WIOD) TO ASK WHETHER CANADA'S CONTRIBUTION TO GLOBAL GHG EMISSIONS CHANGES WHEN CALCULATED USING A DEMAND-BASED SHADOW EMISSION APPROACH THAT EXCLUDES GHG EMISSIONS CREATED IN THE PRODUCTION OF EXPORTS LIKE FOSSIL FUELS, BUT INCLUDES EMISSIONS RELEASED TO PRODUCE IMPORTS TO CANADA. WE FIND THAT FROM 1995 TO 2005 CANADA'S CONTRIBUTION TO GLOBAL EMISSIONS WAS LOWER USING THIS DEMAND-BASED GHG ACCOUNTING APPROACH THAN A PRODUCTION-BASED APPROACH. FROM 2006 TO 2009 HOWEVER, INCREASED IMPORTS FROM GHG-INTENSIVE TRADING PARTNERS LIKE CHINA MEANT THAT CANADA'S DEMAND-BASED SHADOW EMISSIONS WERE HIGHER THAN ITS PRODUCTION-BASED GHG EMISSIONS. WE ALSO INTRODUCE A METHOD OF CALCULATING SUB-NATIONAL GHG SHADOWS USING LIMITED DATA. APPLIED TO CANADA THIS EXERCISE DEMONSTRATES THAT FOSSIL FUEL EXPORTING PROVINCES SUCH AS ALBERTA AND SASKATCHEWAN HAVE DEMAND-BASED SHADOW EMISSIONS SIGNIFICANTLY LOWER THAN THEIR PRODUCTION-BASED EMISSIONS, WHILE POPULOUS PROVINCES SUCH AS QUEBEC AND ONTARIO HAVE DEMAND-BASED EMISSIONS THAT ARE RELATIVELY HIGHER THAN THEIR PRODUCTION-BASED EMISSIONS. (C) 2016 ELSEVIER B.V. ALL RIGHTS RESERVED.",""
"28","Climate_Change","HUYSMAN S, 2016, J CLEAN PROD","ISI000375816800022","QUANTIFYING THE ENVIRONMENTAL IMPACTS OF A EUROPEAN CITIZEN THROUGH A MACRO-ECONOMIC APPROACH, A FOCUS ON CLIMATE CHANGE AND RESOURCE CONSUMPTION","AS ECONOMIES IN THE EUROPEAN UNION ARE ULTIMATELY DRIVEN BY THE FINAL CONSUMPTION OF CITIZENS, POLICY MAKERS NEED PROPER INDICATORS TO MONITOR THE ENVIRONMENTAL IMPACTS ASSOCIATED WITH THIS CONSUMPTION. THESE INDICATORS CAN BE CONSTRUCTED USING TWO DIFFERENT APPROACHES, EACH HAVING THEIR STRENGTHS AND LIMITATIONS. THE TOP-DOWN APPROACH IS BASED ON ENVIRONMENTALLY EXTENDED INPUT-OUTPUT ANALYSIS AND QUANTIFIES THE ENVIRONMENTAL IMPACTS OF PRODUCT GROUPS AND SERVICES PROVIDED BY INDUSTRIAL SECTORS. THE BOTTOM-UP APPROACH IS BASED ON LIFE CYCLE ASSESSMENT AND QUANTIFIES THE ENVIRONMENTAL IMPACTS OF A SELECTION OF REPRESENTATIVE PRODUCTS. THE BOTTOM-UP APPROACH HAS ALREADY BEEN USED BY THE EUROPEAN COMMISSION'S JOINT RESEARCH CENTRE TO CALCULATE THE IMPACTS OF THE FINAL CONSUMPTION PER CAPITA IN THE EUROPEAN UNION IN 2006. IN THIS PAPER, WE CALCULATED THESE IMPACTS THROUGH A TOP-DOWN APPROACH, USING THE EXIOBASE DATABASE. THE COVERED HOUSEHOLD ACTIVITIES ARE FOOD, CONSUMER GOODS, MOBILITY, SHELTER AND SERVICES. THE GOAL WAS TO CALCULATE ALL THE IMPACT CATEGORIES RECOMMENDED BY THE INTERNATIONAL REFERENCE LIFE CYCLE DATA HANDBOOK, AND COMPARE BOTH APPROACHES. HOWEVER, THE CATEGORIES IONIZING RADIATION, TOXICITY AND ABIOTIC RESOURCE DEPLETION COULD NOT BE INCLUDED, AS SOME RELEVANT EMISSIONS AND RESOURCES ARE NOT AVAILABLE IN EXIOBASE. TO STUDY MORE PROFOUNDLY THE IMPACT ON NATURAL RESOURCES, WE ADDED THE CUMULATIVE EXERGY EXTRACTION FROM THE NATURAL ENVIRONMENT TO THE IMPACT ASSESSMENT. WHEN COMPARING BOTH APPROACHES, IT CAN BE CONCLUDED THAT THERE IS A CONSIDERABLE SHIFT IN THE RESULTS. THIS MEANS THAT THE INFORMATION OBTAINED BY A TOP-DOWN APPROACH COULD SUPPLEMENT THE INFORMATION BASE FOR POLICY SUPPORT. (C) 2016 ELSEVIER LTD. ALL RIGHTS RESERVED.",""
"29","Climate_Change","HOEKSTRA R, 2016, ECON SYST RES","ISI000376031700003","THE EMISSION COST OF INTERNATIONAL SOURCING: USING STRUCTURAL DECOMPOSITION ANALYSIS TO CALCULATE THE CONTRIBUTION OF INTERNATIONAL SOURCING TO CO2-EMISSION GROWTH","THE EFFECT OF CHANGES IN TRADE PATTERNS, PARTICULARLY INCREASING INTERNATIONAL SOURCING, ON GLOBAL CO2-EMISSIONS GROWTH HAS YET TO BE CLEARLY UNDERSTOOD. IN THIS PAPER, WE ESTIMATE THE EMISSION COST OF SOURCING (ECS), WHICH ORIGINATES FROM REPLACING DOMESTIC PRODUCTS BY IMPORTS FROM COUNTRIES WITH MORE CO2-INTENSIVE TECHNOLOGIES. USING A STRUCTURAL DECOMPOSITION ANALYSIS, WE FIND THAT CHANGES IN SOURCING PATTERNS BETWEEN 1995 AND 2007 CONTRIBUTE (1) TO REDUCING TERRITORIAL EMISSIONS IN HIGH-WAGE COUNTRIES (70\% OF THEIR TERRITORIAL EMISSIONS GROWTH) AND (2) TO INCREASING TERRITORIAL EMISSIONS IN LOW-WAGE COUNTRIES (30\% OF THEIR TERRITORIAL EMISSIONS INCREASE). THE NET GLOBAL EFFECT, THE ECS, AMOUNTS TO 18\% OF TOTAL GLOBAL CO2-EMISSIONS GROWTH. OUR RESULTS CALL THE CLIMATE CHANGE POLICIES BASED ON TERRITORIAL PRINCIPLES INTO QUESTION GIVEN THAT THEY DISREGARD THAT DIFFERENCES IN EMISSION INTENSITIES BETWEEN COUNTRIES CONTRIBUTE TO RAISING GLOBAL EMISSIONS. IN CONTRAST, POLICIES FOSTERING THE TRANSFER OF CLEANER TECHNOLOGIES TO LOW-WAGE COUNTRIES DECREASE THE ECS.",""
"30","Climate_Change","MO W, 2016, ENVIRON RES LETT","ISI000378812200019","MODELING THE INFLUENCE OF VARIOUS WATER STRESSORS ON REGIONAL WATER SUPPLY INFRASTRUCTURES AND THEIR EMBODIED ENERGY","WATER SUPPLY CONSUMES A SUBSTANTIAL AMOUNT OF ENERGY DIRECTLY AND INDIRECTLY. THIS STUDY AIMS TO PROVIDE AN ENHANCED UNDERSTANDING OF THE INFLUENCE OF WATER STRESSORS ON THE EMBODIED ENERGY OF WATER SUPPLY (EEWS). TO ACHIEVE THIS GOAL, THE EEWS IN 75 NORTH CAROLINA COUNTIES WAS ESTIMATED THROUGH AN ECONOMIC INPUT-OUTPUT BASED HYBRID LIFE CYCLE ASSESSMENT. TEN WATER STRESSOR INDICATORS RELATED TO POPULATION, ECONOMIC DEVELOPMENT, CLIMATE, WATER SOURCE, AND LAND USE WERE OBTAINED FOR THE 75 COUNTIES. A MULTIVARIATE ANALYSIS WAS PERFORMED TO UNDERSTAND THE CORRELATIONS BETWEEN WATER STRESSOR INDICATORS AND THE EEWS. A REGRESSION ANALYSIS WAS THEN CONDUCTED TO IDENTIFY THE STATISTICALLY SIGNIFICANT INDICATORS IN DESCRIBING THE EEWS. IT WAS FOUND THAT THE TOTAL AMOUNT OF WATER SUPPLY ENERGY VARIES SIGNIFICANTLY AMONG SELECTED COUNTIES. WATER DELIVERY PRESENTS THE HIGHEST ENERGY USE AND WATER STORAGE PRESENTS THE LEAST. THE TOTAL EMBODIED ENERGY WAS FOUND TO BE HIGHLY CORRELATED WITH TOTAL POPULATION. THE REGRESSION ANALYSIS SHOWS THAT THE TOTAL EMBODIED ENERGY CAN BE BEST DESCRIBED BY TOTAL POPULATION AND TEMPERATURE INDICATORS WITH A RELATIVELY HIGH R SQUARE VALUE OF 0.69.",""
"31","Climate_Change","BELEN MUNOZ-ZAMPONI T, 2016, AGROCIENCIA","ISI000375889300001","SIMULATION OF A CO(2)E TAX TO MITIGATE IMPACTS FROM CHILEAN AGRICULTURE AND LIVESTOCK SECTOR ON CLIMATE CHANGE","IN CHILE, THE AGRICULTURE AND LIVESTOCK SECTOR CONTRIBUTES 40.6 \% A OF TOTAL CO(2)E EMISSIONS. THE AIM OF THIS STUDY WAS TO USE AN ENVIRONMENTAL EXTENSION OF THE LEONTIEF PRICE MODEL TO SIMULATE THE ECONOMIC AND ENVIRONMENTAL EFFECTS THAT THE APPLICATION OF A TAX WOULD HAVE ON CO(2)E EMISSIONS FROM THIS SECTOR. WE USED THE METHODOLOGY OF THE INPUT-OUTPUT TABLE AND THE PRICING MODEL OF LEONTIEF TO CHARACTERIZE THE CURRENT PRICE STRUCTURE OF THE SECTORS OF THE CHILEAN ECONOMY; THEN WE INTRODUCED SEVERAL SIMULATIONS RATES OF ENVIRONMENTAL TAX ON CO(2)E EMISSIONS IN THE AGRICULTURE AND LIVESTOCK SECTOR, WHICH AFFECTS THE PRODUCTION COSTS OF THIS AND OTHER SECTORS, GENERATING IMPACT ON PRICES, CONSUMER PRICE INDEX, PRIVATE WELFARE, TAX COLLECTION AND EMISSION REDUCTIONS. THE RESULTS SHOWED THAT THE APPLICATION OF ENVIRONMENTAL TAXES IN THE AGRICULTURE AND LIVESTOCK SECTOR DOES NOT SIGNIFICANTLY REDUCE EMISSIONS IN CHILE. IN COUNTRIES THAT HAVE IMPLEMENTED THIS TAX, A LOW TAX OF US\$1 PER MG OF CO(2)E REDUCES EMISSIONS BY 0.2 \%, AN AVERAGE TAX OF US\$30 PER MG OF CO(2)E REDUCES EMISSIONS BY 4.0 \%, A HIGH TAX OF US\$130 PER MG OF CO(2)E ONLY LOW EMISSIONS BY 12.2 \%. IN THE LATTER MORE RESTRICTIVE SCENARIO, THE PRICE OF AGRICULTURE AND LIVESTOCK PRODUCTS WOULD RISE BY 66.1 \%, AS WELL AS THE PRICES OF FORESTRY, FOOD PROCESSING, AQUACULTURE, WOOD INDUSTRY, AMONG OTHER SECTORS, WHICH WILL EVENTUALLY RESULT IN AN INCREASE OF 4.7 \% OF THE CONSUMER PRICE INDEX.",""
