"","TOPIC","AUTHOR","UID","TITLE","ABSTRACT","NOTES"
"63","Climate_Change","WU S, 2020, J CLEAN PROD","ISI000510823700101","SECTORAL CHANGING PATTERNS OF CHINA'S GREEN GDP CONSIDERING CLIMATE CHANGE: AN INVESTIGATION BASED ON THE ECONOMIC INPUT-OUTPUT LIFE CYCLE ASSESSMENT MODEL","THE RAPID GROWTH OF ENERGY-INTENSIVE AND HIGH-EMISSION INDUSTRIES HAS UNDERPINNED CHINA'S ECONOMIC BOOM OVER THE PAST FEW DECADES. SINCE HER ECONOMIC DEVELOPMENT ENTERED THE NEW NORMAL PHASE IN 2013, CHINA HAS FACED THE CHALLENGE OF MITIGATING GREENHOUSE GAS (GHG) EMISSIONS WHILE ACHIEVING MEDIUM-HIGH ECONOMIC GROWTH. TRANSFORMING THE ECONOMIC DEVELOPMENT PATTERN AND RESTRUCTURING THE ECONOMY IS A PRINCIPAL SOLUTION, AND ONE IMPORTANT PREREQUISITE IS DISCERNING GREAT SECTORAL DISPARITIES OF GHG EMISSIONS AND CORRESPONDING ENVIRONMENTAL COSTS BECAUSE THE DIVERSITY OF CHARACTERISTICS AMONG DIFFERENT SECTORS CAUSES THE POLLUTANTS THAT ARE DISCHARGED TO VARY. HENCE, THIS PAPER AIMS TO ASSESS THE ENVIRONMENTAL COSTS OF CHINA'S TOTAL AND SECTORAL GHG EMISSIONS. BASED ON THE SYSTEM OF ENVIRONMENTAL AND ECONOMIC ACCOUNTS AND USING THE ECONOMIC INPUT-OUTPUT LIFE CYCLE ASSESSMENT MODEL, THIS STUDY CALCULATES THE GREEN GDP AND GREEN OUTPUT VALUE OF 27 SECTORS TO REFLECT THE ENVIRONMENTAL COSTS OF GHG EMISSIONS IN CHINA DURING 1991-2016. THE FINDINGS ARE AS FOLLOWS: (1) WHILE CHINA'S DIRECT GHG EMISSIONS INCREASED FROM 3,040.60 MILLION TONS OF CARBON DIOXIDE EQUIVALENT (MTCO(2)EQ) TO 10,641.10 MTCO(2)EQ DURING 1991-2014, DECLINING TRENDS WERE OBSERVED IN THE TOTAL AND 16 SECTORS' DIRECT GHG EMISSIONS IN THE SUBSEQUENT TWO YEARS; (2) ALTHOUGH THE RATIOS OF DIRECT GHG EMISSIONS TO TOTAL GHG EMISSIONS IN MOST SECTORS DECREASED, TOTAL GHG EMISSIONS IN EIGHT SECTORS ROSE FIRST AND THEN FELL, AND IN 15 SECTORS CONTINUED TO RISE; (3) CHINA'S GREEN GDP GREW FROM 2,003.88 BILLION CHINESE YUAN TO 26,245.25 BILLION CHINESE YUAN DURING 1991-2016, AND THE DIFFERENCE BETWEEN CHINA'S GDP AND GREEN GDP DECREASED FROM 2.73\% TO 1.02\%; AND (4) DIFFERENCES BETWEEN THE OUTPUT VALUE AND GREEN OUTPUT VALUE DECREASED IN OVER 20 SECTORS. FINALLY, SOME POLICY IMPLICATIONS ARE GIVEN FROM THE PERSPECTIVE OF SOME KEY SECTORS OF THE MANUFACTURING INDUSTRY, AGRICULTURAL SECTOR, AND TRANSPORT, STORAGE, AND POST SECTOR. (C) 2019 ELSEVIER LTD. ALL RIGHTS RESERVED.",""
"64","Climate_Change","GIANNAKIS E, NA, INT J SUSTAIN ENERGY","ISI000525129300001","LAND TRANSPORT CO2 EMISSIONS AND CLIMATE CHANGE: EVIDENCE FROM CYPRUS","THE LAND TRANSPORT SECTOR IS ONE OF THE MAJOR EMITTERS OF CO2 AND ONE OF THE HARDEST SECTORS TO DECARBONISE. THIS STUDY EMPLOYS AN ENVIRONMENTALLY-EXTENDED INPUT-OUTPUT MODEL TO CONDUCT AN ECONOMY-WIDE ASSESSMENT OF CO2 EMISSIONS IN CYPRUS, ASSOCIATED WITH A 22\% INCREASE IN THE FINAL DEMAND FOR THE OUTPUT OF THE SECTOR BY 2030. MODEL RESULTS INDICATE THAT THE LAND TRANSPORT SECTOR CREATES THE THIRD HIGHEST (DIRECT AND INDIRECT) CO2 EMISSIONS WITHIN CYPRUS ECONOMY; FOR EVERY 1 MILLION EURO INCREASE IN THE FINAL DEMAND OF THE SECTOR'S SERVICES AND PRODUCTS, 407 ADDITIONAL TONS OF CO2 ARE EMITTED. CONSIDERING THAT TEMPERATURE IN CYPRUS IS PROJECTED TO INCREASE BY UP TO 4.5-5 DEGREES C BY THE END OF THE CENTURY, OUR FINDINGS HIGHLIGHT THE IMPORTANCE OF THE LAND TRANSPORT SECTOR IN THE TRANSITION OF CYPRUS TO A LOW-CARBON ECONOMY AND THE URGENCY OF IMPLEMENTING IN-SECTOR COST-EFFECTIVE DECARBONISATION STRATEGIES.",""
"65","Climate_Change","DIETZENBACHER E, 2020, NAT COMMUN","ISI000518626300023","TOWARDS A MORE EFFECTIVE CLIMATE POLICY ON INTERNATIONAL TRADE","IN THE LITERATURE ON THE ATTRIBUTION OF RESPONSIBILITIES FOR GREENHOUSE GAS EMISSIONS, TWO ACCOUNTING METHODS HAVE BEEN WIDELY DISCUSSED: PRODUCTION-BASED ACCOUNTING (PBA) AND CONSUMPTION-BASED ACCOUNTING (CBA). IT HAS BEEN ARGUED THAT AN ACCOUNTING FRAMEWORK FOR ATTRIBUTING RESPONSIBILITIES SHOULD CREDIT ACTIONS CONTRIBUTING TO REDUCE GLOBAL EMISSIONS AND SHOULD PENALIZE ACTIONS INCREASING THEM. NEITHER PBA NOR CBA SATISFY THIS PRINCIPLE. ADAPTING CLASSICAL RICARDIAN TRADE THEORY, WE CONSIDER EX POST MEASUREMENT AND PROPOSE A SCHEME FOR ASSIGNING CREDITS AND PENALTIES. THEIR SIZE IS DETERMINED BY HOW MUCH CO2 EMISSIONS ARE SAVED GLOBALLY DUE TO TRADE. THIS LEADS TO THE EMISSION RESPONSIBILITY ALLOTMENT (ERA) FOR ASSIGNING RESPONSIBILITIES. WE ILLUSTRATE THE DIFFERENCES BETWEEN ERA AND PBA AND CBA BY COMPARING THEIR RESULTS FOR 41 COUNTRIES AND REGIONS BETWEEN 1995-2009. THE PARIS AGREEMENT (COP21) PROPOSED NEW MARKET MECHANISMS; WE ARGUE THAT ERA IS WELL SUITED TO MEASURE AND EVALUATE THEIR OVERALL MITIGATION IMPACT. PARTNERS WHO ACTUALLY REDUCE GLOBAL EMISSIONS CAN BE PENALIZED UNDER CARBON ACCOUNTING METHODS BASED ON PRODUCTION OR CONSUMPTION GIVE AN IDEA OF RESPONSIBILITY. HERE THE AUTHORS PROPOSE A NEW FRAMEWORK, EMISSION RESPONSIBILITY ALLOTMENT THAT PENALIZES/CREDITS THOSE THAT INCREASE/DECREASE GLOBAL EMISSIONS.",""
"66","Climate_Change","WANG X, NA, ENVIRON SCI POLLUT RES","ISI000516792700002","FORWARD AND BACKWARD CRITICAL SECTORS FOR CO2 EMISSIONS IN CHINA BASED ON EIGENVECTOR APPROACHES","CHINA HAD TAKEN MEASURES TO REDUCE THE EMISSIONS OF CO2 THESE YEARS AS A STAUNCH SUPPORTER OF THE PARIS AGREEMENT. HOWEVER, IT IS NOT SUCH AN EASY TASK FOR THE AUTHORITY TO DECIDE WHICH SECTORS SHOULD TAKE RESPONSIBILITY ON THE PROCESS OF CO2 EMISSIONS REDUCTION IN THE CONTEXT OF HIGHLY CONNECTED SUPPLY CHAINS. BASED ON THE SECTORAL CO2 EMISSIONS AND INPUT-OUTPUT TABLE OF CHINA, THIS STUDY PROVIDED BOTH FORWARD AND BACKWARD PERSPECTIVES BASED ON EIGENVECTOR APPROACHES TO IDENTIFY THE CRITICAL SECTORS THAT ARE CRITICAL FOR THE CO2 EMISSIONS IN VALUE CHAINS, INCLUDING A BACKWARD METHOD CALLED POWER-OF-PULL METHOD THAT IDENTIFIES THE PULLING EFFECT OF DEMAND SIDE AND A FORWARD METHOD CALLED POWER-OF-PUSH METHOD THAT IDENTIFIES THE PUSHING POWER OF SUPPLY SIDE. THE RESULTS SHOWED THAT THE ELECTRICITY AND HOT WATER PRODUCTION AND SUPPLY WAS THE MOST INFLUENTIAL PULLING SECTOR IN THE STUDYING PERIOD, FOLLOWED BY THE METAL MINING IN THE BACKWARD DIRECTION. IN THE FORWARD DIRECTION, THE ELECTRICITY AND HOT WATER PRODUCTION AND SUPPLY WAS ALSO THE TOP 1 IMPORTANT SECTOR WHILE COAL MINING RANKED THE SECOND. THE RESULTS SUGGEST THAT ELECTRICITY AND HOT WATER PRODUCTION AND SUPPLY PLAYED A VITAL ROLE IN THE CO2 EMISSION IN THE SYSTEM. DURING THE STUDIED PERIOD FROM 2007 TO 2015, THE POWER OF NONMETAL MINING TO PULL CO2 EMISSIONS SHOWED A NOTABLE INCREASE. OUR PROPOSED APPROACH COULD BE HELPFUL FOR POLICY-MAKING BECAUSE OF ITS USER-FRIENDLINESS COMPARING WITH OTHER METHOD AS WELL AS PROVIDING A NEW PERSPECTIVE.",""
"67","Climate_Change","VICTORIA ROMAN M, 2020, CLIM CHANG ECON","ISI000524003400002","THE ECONOMIC IMPLICATIONS OF TIED AID AND LOCAL CONTENT REQUIREMENTS FOR CLIMATE FINANCE","THE PARIS AGREEMENT STATES THAT FROM 2020 DEVELOPED COUNTRIES WILL MOBILIZE AT LEAST USD 100 BILLION PER YEAR TO SUPPORT CLIMATE ACTION IN DEVELOPING COUNTRIES. THE ATTAINMENT OF THIS OBJECTIVE INVOLVES DECISIONS BY DONOR COUNTRIES ABOUT THE CHANNEL AND DESTINATION OF CLIMATE FINANCE DISBURSEMENTS. THIS PAPER EXPLORES HOW THE SPENDING CONDITIONS ASSOCIATED TO DIFFERENT DISBURSEMENT OPTIONS CAN AFFECT THE OPPORTUNITIES FOR DONORS TO EXPAND THEIR EXPORTS. IN PARTICULAR, USING A MULTIREGIONAL INPUT-OUTPUT MODEL, IT FINDS THAT DONORS HAVE AN ECONOMIC INCENTIVE FOR CHOOSING BILATERAL CHANNELS THAT ENABLE TO TIE AID TO THE DETRIMENT OF MULTILATERAL ONES, SUCH AS THE GREEN CLIMATE FUND. ON THE OTHER HAND, LOCAL CONTENT REQUIREMENTS IMPOSED BY RECIPIENT COUNTRIES DO NOT SUBSTANTIALLY AFFECT DONORS' EXPORTS, SINCE THEY DO NOT REDUCE INTERMEDIATE EXPORTS, WHICH REPRESENT A RELEVANT SHARE OF THE TOTAL EXPORTS GENERATED BY THE MITIGATION AND ADAPTATION ACTIONS ANALYSED.",""
"68","Climate_Change","YANG Y, NA, J IND ECOL","ISI000510120500001","TOWARD SUSTAINABLE CLIMATE CHANGE ADAPTATION","INDUSTRIAL ECOLOGY (IE) HAS MADE GREAT CONTRIBUTIONS TO CLIMATE CHANGE MITIGATION RESEARCH, IN TERMS OF ITS SYSTEMS THINKING AND SOLID METHODOLOGIES SUCH AS LIFE CYCLE ASSESSMENT, MATERIAL FLOW ANALYSIS, AND ENVIRONMENTALLY EXTENDED INPUT-OUTPUT ANALYSIS. HOWEVER, ITS POTENTIAL CONTRIBUTION TO CLIMATE CHANGE ADAPTATION IS UNCLEAR. ADAPTATION HAS BECOME INCREASINGLY URGENT IN A CONTINUOUSLY CHANGING CLIMATE, ESPECIALLY IN DEVELOPING COUNTRIES, WHICH ARE PROJECTED TO BEAR THE BRUNT OF CLIMATE-CHANGE-RELATED DAMAGES. ON THE BASIS OF A BRIEF REVIEW OF CLIMATE CHANGE IMPACTS AND ADAPTATION LITERATURE, WE SUGGEST THAT IE CAN PLAY AN IMPORTANT ROLE IN THE FOLLOWING TWO ASPECTS. FIRST, WITH THE EMPHASIS ON A SYSTEMS PERSPECTIVE, IE CAN HELP US DETERMINE HOW CLIMATE CHANGE INTERACTS WITH OUR SOCIO-ECONOMIC SYSTEM AND HOW THE INTERACTIONS MAY AGGRAVATE (OR MODERATE) ITS DIRECT IMPACTS OR WHETHER THEY MAY SHIFT BURDEN TO OTHER ENVIRONMENTAL IMPACTS. SECOND, IE METHODOLOGIES CAN HELP US QUANTIFY THE DIRECT AND INDIRECT ENVIRONMENTAL IMPACTS OF ADAPTATION ACTIVITIES, IDENTIFY MITIGATION OPPORTUNITIES, AND ACHIEVE SUSTAINABLE ADAPTATION. FURTHER, WE FIND THAT SUBSTANTIAL INVESTMENT IS NEEDED TO INCREASE THE RESILIENCE OF INFRASTRUCTURE (E.G., TRANSPORT, ENERGY, AND WATER SUPPLY) AND AGRICULTURE IN DEVELOPING COUNTRIES. BECAUSE THESE SECTORS ARE ALSO THE MAIN DRIVERS OF ENVIRONMENTAL DEGRADATION, HOW TO ACHIEVE SUSTAINABLE CLIMATE-RESILIENT INFRASTRUCTURE AND AGRICULTURE IN DEVELOPING COUNTRIES DESERVES SPECIAL ATTENTION IN FUTURE IE STUDIES. OVERALL, IE THINKING AND METHODOLOGIES HAVE GREAT POTENTIAL TO CONTRIBUTE TO CLIMATE CHANGE ADAPTATION RESEARCH AND POLICY QUESTIONS, AND EXPLORING THIS GROWING FIELD WILL, IN TURN, INSPIRE IE DEVELOPMENT.",""
"69","Climate_Change","LI M, 2020, ENVIRON SCI TECHNOL","ISI000506723200043","ENABLING FULL SUPPLY CHAIN CORPORATE RESPONSIBILITY: SCOPE 3 EMISSIONS TARGETS FOR AMBITIOUS CLIMATE CHANGE MITIGATION","THERE IS BUILDING CONSENSUS THAT NONSTATE ACTORS HAVE THE POTENTIAL TO DRIVE MORE AMBITIOUS ACTION TOWARD CLIMATE TARGETS THAN GOVERNMENTS, THUS DRIVING THE NECESSARY TRANSITION TO ENSURE THAT HUMANITY REMAINS WITHIN A SAFE OPERATING SPACE. THESE BOTTOM-UP MITIGATION ACTIVITIES, HOWEVER, REQUIRE INDIVIDUAL TARGETS ON BOTH DIRECT AND INDIRECT (UPSTREAM) GREENHOUSE GAS (GHG) EMISSIONS IN ORDER TO RECONCILE TRADE-OFFS BETWEEN GLOBAL AND LOCAL SUSTAINABILITY GOALS. HERE WE USE A SCENARIO-DRIVEN APPROACH BASED ON A GLOBAL MULTIREGIONAL INPUT-OUTPUT (GMRIO) MODEL TO DEVELOP SCOPE 3 EMISSION REDUCTION TARGETS FOR INDIVIDUAL ECONOMIC SECTORS, COMPARABLE ACROSS COUNTRIES AND GEOG - RAPHIES. UNDER AN AMBITIOUS CARBON MITIGATION SCENARIO FOR 2035 (THAT FOLLOWS A TRAJECTORY OF 1.75 DEGREES C TOTAL WARMING BY 2100), GLOBAL UPSTREAM SCOPE 3 EMISSION INTENSITIES NEED TO BE REDUCED BY AN ADDITIONAL 54\% COMPARED TO A BASELINE SCENARIO WITH REFERENCE TECHNOLOGY. ON A SECTORAL BASIS, THIS IS EQUIVALENT TO A 58-67\% REDUCTION IN ENERGY, TRANSPORT, AND MATERIALS, A 50-52\% REDUCTION IN MANUFACTURING, SERVICES, AND BUILDINGS, AND A 39\% REDUCTION IN AGRICULTURE, FORESTRY, AND OTHER LAND USE. BY ALIGNING INDIRECT SUPPLY CHAIN TARGETS WITH AMBITIOUS CARBON MITIGATION SCENARIOS, OUR APPROACH CAN BE USED BY NONSTATE ACTORS TO SET ACTIONABLE SCOPE 3 TARGETS AND TO BUILD CLIMATE-COMPATIBLE BUSINESS MODELS.",""
"70","Climate_Change","MURAKAMI K, 2020, SUST CITIES SOC","ISI000504058400024","CHANGES IN PER CAPITA CO2 EMISSIONS OF SIX LARGE JAPANESE CITIES BETWEEN 1980 AND 2000: AN ANALYSIS USING ``THE FOUR SYSTEM BOUNDARIES'' APPROACH","CITIES CAN PLAY A CRITICAL ROLE IN MITIGATING CLIMATE CHANGE. ALTHOUGH SEVERAL CARBON ACCOUNTING METHODS HAVE BEEN PROPOSED TO IDENTIFY MITIGATION RESPONSIBILITY OF CITIES, THERE IS STILL NO SINGLE COMMON AND WIDELY ACCEPTED METHOD. IN THIS STUDY, WE HAVE ADOPTED A METHOD THAT IS BASED ON FOUR SYSTEM BOUNDARIES TO IDENTIFY AND COMPARE PER CAPITA CO2 EMISSIONS OF SIX LARGE JAPANESE CITIES IN 1980 AND 2000. DESPITE THE FACT THAT SUBSTANTIAL DIFFERENCES EXIST AMONG THESE CITIES IN TERMS OF INDUSTRIAL STRUCTURE AND TRANSFORMATION, POPULATION, AND LOCAL CLIMATIC CONDITIONS, WE FOUND THAT THE PER CAPITA CO2 EMISSIONS FOR THE SYSTEM BOUNDARY 4, WHICH IS CO2 EMISSIONS ATTRIBUTION TO CITY FROM THE CONSUMPTION PERSPECTIVES, ARE VERY SIMILAR AMONG THEM AND ARE STABLE OVER THE 20-YEAR STUDY PERIOD, ALTHOUGH THOSE FOR ALL THE OTHER SYSTEM BOUNDARIES ARE NOT SIMILAR. THIS IS IN CONTRAST TO THE GENERAL CLAIMS MADE BY LOCAL AUTHORITIES REGARDING THEIR SUCCESS IN REDUCING PER CAPITA CO2 EMISSIONS. SUCH CLAIMS ARE MADE ON THE BASIS OF EMISSIONS ESTIMATED USING THE SYSTEM BOUNDARY 2 METHOD. WE ARGUE THAT USING THE SYSTEM BOUNDARY 4 PROVIDES A MORE REALISTIC ACCOUNT OF CHANGES IN URBAN CO2 EMISSIONS AND TRENDS AND SHOULD BE ADOPTED BY LOCAL AUTHORITIES IN THEIR PURSUIT OF URBAN CLIMATE CHANGE MITIGATION GOALS.",""
"71","Climate_Change","LIN H, 2019, J COAST RES","ISI000501532900001","NATURAL DISASTERS CAUSED BY CLIMATE CHANGE AND AGRICULTURAL PRODUCTS LOSS IN CROSS-STRAIT INDUSTRY: AN INPUT-OUTPUT ANALYSIS","IN ORDER TO ESTIMATE THE DIRECT AND INDIRECT LOSSES CAUSED BY NATURAL DISASTER, THIS STUDY CONDUCTS AN INTER-COUNTRY INPUT-OUTPUT (ICIO) ANALYSIS TO DISCUSS THE IMPACTS ON CROSS-STRAIT INDUSTRIES IN THE FACE OF DISASTERS LOSSES. THE PRESENT STUDY INCLUDES DATA FROM 96 SECTORS' CROSS-STRAIT INTER-COUNTRY INPUT-OUTPUT TABLE AND THE STATISTICS OF AGRICULTURE DURING 2005-2011 IN TAIWAN AND THE PERIOD 2005-2010 IN MAINLAND CHINA. THE RESULTS INDICATE THE TOTAL VALUE-ADDED EFFECT IN MAINLAND CHINA IS LARGER THAN TAIWAN, WHEREAS THE MULTIPLIER OF AGRICULTURE LOSSES IN TAIWAN IS LARGER THAN MAINLAND CHINA. THIS INDICATES THAT THE LOSSES CAUSED BY NATURAL DISASTERS ARE LARGER IN TAIWAN IS THAN IN MAINLAND CHINA.",""
"72","Climate_Change","RODRIGUEZ-ALLOZA AM, 2019, ENVIRON RES LETT","ISI000499322600001","CONSEQUENCES OF LONG-TERM INFRASTRUCTURE DECISIONS?THE CASE OF SELF-HEALING ROADS AND THEIR CO2 EMISSIONS","WHAT COULD BE THE REDUCTION IN GREENHOUSE GAS EMISSIONS IF THE CONVENTIONAL WAY OF MAINTAINING ROADS IS CHANGED?EMISSIONS OF GREENHOUSE GASES MUST BE REDUCED IF GLOBAL WARMING IS TO BE AVOIDED, AND URGENT POLITICAL AND TECHNOLOGICAL DECISIONS SHOULD BE TAKEN. HOWEVER, THERE IS A LOCK-IN IN BUILT INFRASTRUCTURES THAT IS LIMITING THE RATE AT WHICH EMISSIONS CAN BE REDUCED. SELF-HEALING ASPHALT IS A NEW TYPE OF TECHNOLOGY THAT WILL REDUCE THE NEED FOR FOSSIL FUELS OVER THE LIFETIME OF A ROAD PAVEMENT, AT THE SAME TIME AS PROLONGING THE ROAD LIFESPAN. IN THIS STUDY WE HAVE ASSESSED THE BENEFITS OF USING SELF-HEALING ASPHALT AS AN ALTERNATIVE MATERIAL FOR ROAD PAVEMENTS EMPLOYING A HYBRID INPUT?OUTPUT-ASSISTED LIFE-CYCLE ASSESSMENT, AS ONLY BY DETERMINING THE PLAUSIBLE SCENARIOS OF FUTURE EMISSIONS WILL POLICY MAKERS IDENTIFY PATHWAYS THAT MIGHT ACHIEVE CLIMATE CHANGE MITIGATION GOALS. WE HAVE CONCLUDED THAT SELF-HEALING ROADS COULD PREVENT A CONSIDERABLE AMOUNT OF EMISSIONS AND COSTS OVER THE GLOBAL ROAD NETWORK: 16\% LOWER EMISSIONS AND 32\% LOWER COSTS COMPARED TO A CONVENTIONAL ROAD OVER THE LIFECYCLE.",""
"73","Climate_Change","HUANG L, 2019, SUSTAINABILITY","ISI000493525500367","CARBON COMMUNITIES AND HOTSPOTS FOR CARBON EMISSIONS REDUCTION IN CHINA","WITH CHINA'S COMMITMENT TO PEAK ITS EMISSIONS BY 2030, SECTORAL EMISSIONS ARE UNDER THE SPOTLIGHT DUE TO THE ROLLING OUT OF THE NATIONAL EMISSION TRADING SCHEME (ETS). HOWEVER, THE CURRENT SECTOR POLICIES FOCUS EITHER ON THE PRODUCTION SIDE OR CONSUMPTION WHILE THE MAJORITY OF SECTORS ALONG THE TRANSMISSION WERE OVERLOOKED. THIS RESEARCH COMBINES INPUT-OUTPUT MODELLING AND NETWORK ANALYSIS TO TRACK THE EMBODIED CARBON EMISSIONS AMONG THIRTY SECTORS OF THIRTY PROVINCES IN CHINA. BASED ON THE LARGE-DATA RESOLUTION NETWORK, A TWO-STEP NETWORK REDUCTION ALGORITHM IS USED TO EXTRACT THE BACKBONE OF THE NETWORK. IN ADDITION, NETWORK CENTRALITY METRICS AND COMMUNITY DETECTION ALGORITHMS ARE USED TO ASSESS EACH INDIVIDUAL SECTOR'S ROLES, AND TO REVEAL THE CARBON COMMUNITIES WHERE SECTORS HAVE INTENSIVE EMISSION LINKS. THE RESEARCH RESULTS SUGGEST THAT THE SECTORS WITH HIGH OUT-DEGREE, IN-DEGREE OR BETWEENNESS CAN ACT AS LEVERAGE POINTS FOR CARBON EMISSIONS MITIGATION. IN ADDITION TO THE ELECTRICITY SECTOR, WHICH IS INCLUDED IN THE NATIONAL ETS, THE STUDY ALSO FOUND THAT THE METALLURGY AND CONSTRUCTION SECTORS SHOULD BE PRIORITIZED FOR EMISSIONS REDUCTION FROM NATIONAL AND LOCAL LEVELS. HOWEVER, THE HOTPOTS ARE DIFFERENT ACROSS PROVINCES AND THUS PROVINCIAL SPECIFIC TARGETED POLICIES SHOULD BE FORMED. MOREOVER, THERE ARE NINETEEN CARBON COMMUNITIES IN CHINA WITH DIFFERENT FEATURES, WHICH PROVIDES DIRECTION FOR PROVINCIAL GOVERNMENTS' EXTERNAL COLLABORATION FOR SYNERGISTIC EFFECTS.",""
"74","Climate_Change","VICTORIA ROMAN M, 2019, CLIM DEV","ISI000482032400001","INTERNATIONAL TRADE AND THE DISTRIBUTION OF ECONOMY-WIDE BENEFITS FROM THE DISBURSEMENT OF CLIMATE FINANCE","IN THE FRAMEWORK OF RECENT INTERNATIONAL CLIMATE NEGOTIATIONS, INDUSTRIALIZED COUNTRIES HAVE COMMITTED TO TRANSFER AT LEAST USD 100 BILLION PER YEAR TO DEVELOPING COUNTRIES FROM 2020. CLIMATE FINANCE HAS BECOME THE SUBJECT OF AN ALREADY EXTENSIVE LITERATURE. HOWEVER, THE ECONOMIC IMPACT OF THE DISBURSEMENT OF CLIMATE FINANCE AND THE ROLE OF INTERNATIONAL TRADE IN ITS DISTRIBUTION GLOBALLY HAVE NOT BEEN STUDIED YET. THIS PAPER SPECIFICALLY ESTIMATES THE GEOGRAPHICAL DISTRIBUTION OF ECONOMIC BENEFITS FOR 17 MITIGATION AND 9 ADAPTATION OPTIONS. WE USE A GLOBAL MULTI-REGIONAL INPUT-OUTPUT FRAMEWORK TO TRACK BOTH DOMESTIC AS WELL AS SPILL-OVER EFFECTS OF CLIMATE FINANCE DISBURSEMENTS. THE RELEVANCE OF SPILL-OVERS IS CONFIRMED: ON AVERAGE, 29\% OF THE ECONOMIC BENEFITS OF CLIMATE ACTIONS FLOW TO COUNTRIES DIFFERENT FROM THE RECIPIENT COUNTRY (I.E. TO THE DONORS AND THIRD COUNTRIES). BUT THIS PERCENTAGE VARIES WIDELY, BETWEEN 11 AND 61\% DEPENDING ON THE TYPE OF CLIMATE ACTION IMPLEMENTED AS WELL AS THE RECIPIENT COUNTRY. THE FINDINGS ARE EXPECTED TO BE OF INTEREST FOR BOTH RECIPIENT AND DONOR COUNTRIES AS THEY PROVIDE GUIDANCE ON HOW TO MAXIMIZE THE ECONOMIC CO-BENEFITS OF CLIMATE FINANCE.",""
"75","Climate_Change","ZHAO H, 2019, J CLEAN PROD","ISI000474676300090","VIRTUAL WATER SCARCITY RISK TO GLOBAL TRADE UNDER CLIMATE CHANGE","THE FIFTH ASSESSMENT REPORT (AR5) OF THE INTERGOVERNMENTAL PANEL ON CLIMATE CHANGE (IPCC) HAS CONCLUDED THAT CLIMATE CHANGE WILL HAVE SIGNIFICANT IMPACTS ON GLOBAL WATER RESOURCES. THE RISK OF PRODUCTION LOSS DUE TO WATER SCARCITY CAN BE TRANSMITTED THROUGH INTERNATIONAL TRADE TO DISTANT ECONOMIES DOWNSTREAM THE SUPPLY CHAIN. IN THIS RESEARCH, HOW CLIMATE CHANGE MAY AFFECT THE GLOBAL ECONOMY VIA REDUCING AVAILABLE WATER RESOURCES IN SOME REGIONS IS INVESTIGATED BASED ON A MULTI-REGIONAL INPUT OUTPUT (MRIO) MODEL THAT PROVIDES INFORMATION ON THE CURRENT GLOBAL ECONOMIC STRUCTURE. KEY NATION SECTORS WITH THE GREATEST VIRTUAL WATER SCARCITY RISK (VWSR) EXPORTS ARE IDENTIFIED UNDER TWO CLIMATE CHANGE SCENARIOS, INCLUDING THE AGRICULTURE SECTORS IN SYRIA, PAKISTAN, KAZAKHSTAN, INDIA, UZBEKISTAN, IRAN, AND CHINA. IMPROVING WATER EFFICIENCY IN THESE SECTORS IS ESSENTIAL FOR INCREASING THE RESILIENCE OF THE GLOBAL ECONOMY AGAINST CLIMATE CHANGE-INDUCED WATER SCARCITY. NATION-SECTORS WITH THE LARGEST VWSR IMPORTS ARE ALSO IDENTIFIED UNDER THE TWO CLIMATE CHANGE SCENARIOS, INCLUDING FOOD \& BEVERAGES SECTORS, TEXTILES AND WEARING APPAREL SECTORS, AND PETROLEUM, CHEMICAL AND NON-METALLIC MINERAL PRODUCTS SECTORS IN SAUDI ARABIA, THE UNITED STATES OF AMERICA, RUSSIA, GERMANY, ITALY, AND CHINA. THESE ARE THE MOST VULNERABLE NATION-SECTORS FACING THE REDUCTION IN FOREIGN WATER RESOURCES DUE TO CLIMATE CHANGE. ADDITIONALLY, THROUGH COMPARING THE CHANGE OF RANKINGS OF VWSR IMPORTS, VWSR EXPORTS, AND LWSRS AT COUNTRY AND SECTOR LEVEL, THE RANKINGS OF VWSR EXPORTS ARE RELATIVELY CLOSE TO LWSRS, WHILE THE RANKINGS OF VWSR IMPORTS ARE QUITE DIFFERENT FROM LWSRS. THE EVALUATION DEMONSTRATES THAT NATIONS SHOULD COOPERATIVELY MANAGE WATER RESOURCES AND BE AWARE OF THE TRANSMISSION OF VIRTUAL WATER SCARCITY RISK THROUGH INTERNATIONAL TRADE UNDER CLIMATE CHANGE. MOREOVER, NATION-SECTORS WITH HIGH VWSR IMPORTS MAY REDUCE THE RELIANCE ON WATER-INTENSIVE PRODUCTS AND DIVERSIFY IMPORTING SOURCES, AND NATIONAL GOVERNMENTS CAN ENCOURAGE RESIDENTS TO CHANGE CONSUMPTION PATTERNS. (C) 2019 ELSEVIER LTD. ALL RIGHTS RESERVED.",""
"76","Climate_Change","SCOTT K, 2019, J IND ECOL","ISI000478901200014","BRIDGING THE CLIMATE MITIGATION GAP WITH ECONOMY-WIDE MATERIAL PRODUCTIVITY","PROJECTIONS OF UK GREENHOUSE GAS EMISSIONS ESTIMATE A SHORTFALL IN EXISTING AND PLANNED CLIMATE POLICIES MEETING UK CLIMATE TARGETS: THE UK'S MITIGATION GAP. MATERIAL AND PRODUCT DEMAND IS DRIVING INDUSTRIAL GREENHOUSE GAS EMISSIONS AT A RATE GREATER THAN CARBON INTENSITY IMPROVEMENTS IN THE ECONOMY. EVIDENCE SHOWS THAT PRODUCTS CAN BE PRODUCED WITH FEWER CARBON INTENSIVE INPUTS AND DEMAND FOR NEW PRODUCTS CAN BE REDUCED. THE ECONOMY-WIDE CONTRIBUTION OF MATERIAL PRODUCTIVITY AND LIFESTYLE CHANGES TO BRIDGING THE UK'S MITIGATION GAP IS UNDERSTUDIED. WE INTEGRATE AN INPUT-OUTPUT FRAMEWORK WITH ECONOMETRIC ANALYSIS AND CASE STUDY EVIDENCE TO ANALYSE THE POTENTIAL OF MATERIAL PRODUCTIVITY TO HELP THE UK BRIDGE ITS ANTICIPATED EMISSIONS DEFICITS, AND THE ADDITIONAL EFFORT REQUIRED TO ACHIEVE TRANSFORMATIVE CHANGE ALIGNED WITH 2 AND 1.5 DEGREES C TEMPERATURE TARGETS. WE ESTIMATE THAT THE EMISSIONS SAVINGS FROM MATERIAL PRODUCTIVITY MEASURES ARE COMPARABLE TO THOSE FROM THE GOVERNMENT'S PLANNED CLIMATE POLICY PACKAGE. THESE ADDITIONAL MEASURES COULD REDUCE THE UK'S ANTICIPATED EMISSIONS DEFICIT UP TO 73\%. THE RESULTS DEMONSTRATE THAT MATERIAL PRODUCTIVITY DESERVES GREATER CONSIDERATION IN CLIMATE POLICY.",""
"77","Climate_Change","WOOD R, NA, CLIM POLICY-a","ISI000472296000001","BEYOND PEAK EMISSION TRANSFERS: HISTORICAL IMPACTS OF GLOBALIZATION AND FUTURE IMPACTS OF CLIMATE POLICIES ON INTERNATIONAL EMISSION TRANSFERS","GLOBALIZATION OF SUPPLY CHAINS HAS RESULTED IN RAPID INCREASES IN EMISSION TRANSFERS FROM THE DEVELOPING TO THE DEVELOPED WORLD. AS OUTSOURCING HAS RISEN, DEVELOPED COUNTRIES HAVE BEEN ABLE TO DECARBONIZE DOMESTICALLY, AT THE EXPENSE OF INCREASED EMISSIONS IN DEVELOPING COUNTRIES. HOWEVER, THE RAPID IMPROVEMENT OF CARBON EFFICIENCY IN DEVELOPING REGIONS TOGETHER WITH THE POST-2008 DECELERATION IN INTERNATIONAL TRADE RAISES THE QUESTION OF WHETHER SUCH EMBODIED EMISSION TRANSFERS HAVE PEAKED. HERE WE UPDATE HISTORICAL ANALYSIS, FINDING THAT EMISSION TRANSFERS BETWEEN OECD AND NON-OECD COUNTRIES PEAKED IN 2006, AND HAVE BEEN DECLINING SINCE. THE REVERSAL IS PRINCIPALLY DUE TO THE REDUCTION IN THE EMISSIONS INTENSITY OF TRADED GOODS, RATHER THAN THE VOLUME OF TRADE. A MORE RECENT DECLINE IN EMBODIED EMISSIONS TRANSFERS IS ALSO OBSERVED IN TRADE BETWEEN DEVELOPING COUNTRIES. WE ANALYSE WHETHER THESE TRENDS ARE LIKELY TO CONTINUE, BY EXPLORING A BASELINE AND A NATIONALLY DETERMINED CONTRIBUTION (NDC) SCENARIO WITH THE MACRO-EJCONOMETRIC ENERGY-ENVIRONMENT-ECONOMY MODEL (E3ME) MODEL. THE RESULTS SUGGEST THAT ABSOLUTE EMBODIED EMISSIONS WILL PLATEAU AT CURRENT LEVELS OR SLOWLY RETURN TO PRE-2008- CRISIS LEVELS, AND DIFFERENCES BETWEEN THE NDC AND BASELINE SCENARIOS IMPLY THAT NDC POLICIES WILL NOT RESULT IN SIGNIFICANT CARBON LEAKAGE. HOWEVER, THE SHARE OF NATIONAL FOOTPRINT EMBODIED IN IMPORTS, AT LEAST FOR COUNTRIES WITH AMBITIOUS DECARBONIZATION POLICIES, WILL LIKELY INCREASE. THIS SUGGESTS THAT, DESPITE THE WORLD-WIDE STABILIZATION OF EMISSIONS TRANSFERS, ADDRESSING EMISSIONS EMBODIED IN IMPORTS WILL BECOME INCREASINGLY IMPORTANT FOR REDUCING CARBON FOOTPRINTS. KEY POLICY INSIGHTS EMISSIONS EMBODIED IN IMPORTS HAVE PLATEAUED SINCE 2006, AND ARE UNLIKELY TO RETURN TO THE PEAK OF THE MID-2000S. FOR DEVELOPED COUNTRIES, AS DOMESTIC DECARBONIZATION OCCURS, THE SHARE OF EMISSIONS EMBODIED IN IMPORTS AS A PERCENTAGE OF THE TOTAL NATIONAL CARBON FOOTPRINT WILL INCREASE. THE PARIS NDCS IN THEMSELVES ARE UNLIKELY TO CAUSE SIGNIFICANT CARBON LEAKAGE. CLIMATE POLICY WILL IDEALLY FOCUS ON REDUCING BOTH PRODUCTION AND CONSUMPTION EMISSIONS, THROUGH A VARIETY OF MECHANISMS, ESPECIALLY CENTRED AROUND INTERNATIONAL ASSISTANCE.",""
"78","Climate_Change","WANG Q, 2019, ENERGY ECON","ISI000478710000026","DISTRIBUTIONAL IMPACT OF CARBON PRICING IN CHINESE PROVINCES","BASED ON A MULTI-REGIONAL INPUT-OUTPUT (MRIO) MODEL, AND COMBINED WITH THE 2012 MRIO TABLE FOR 30 CHINESE PROVINCES, THIS PAPER ANALYZES THE DISTRIBUTIONAL IMPACTS OF CARBON PRICING ON HOUSEHOLDS WITHIN AND ACROSS CHINESE PROVINCES. THE RESULTS SHOW REGRESSIVE DISTRIBUTIONAL EFFECTS OF CARBON PRICING ACROSS PROVINCES, I.E. POOR PROVINCES ARE AFFECTED MORE BY THE PRICE. CARBON PRICING ALSO SHOWS RURAL-URBAN REGRESSIVITY (I.E. RURAL HOUSEHOLDS ARE IMPACTED MORE HEAVILY THAN URBAN HOUSEHOLDS) IN MORE THAN HALF OF THE PROVINCES. WITHIN EACH SELECTED PROVINCE, CARBON PRICING HAS MOSTLY REGRESSIVE EFFECTS, I.E. POORER URBAN HOUSEHOLDS ARE MORE AFFECTED THAN RICHER URBAN HOUSEHOLDS IN ALL PROVINCES AND POORER RURAL HOUSEHOLDS MORE THAN RICHER RURAL HOUSEHOLDS IN ONE THIRD OF THE PROVINCES. WHEN LOOKING MORE SPECIFICALLY AT DIRECT ENERGY CONSUMPTION, WE FIND THAT THE CARBON PRICING ON DOMESTIC FUELS GENERALLY SHOWS REGRESSIVITY, WHILE PRICING CARBON ON TRANSPORT FUELS SHOWS PROGRESSIVITY. IN ADDITION, THE IMPACT OF CARBON PRICING ON RESIDENTIAL DIRECT EXPENDITURES (MAINLY ON ELECTRICITY AND COAL) IS THE MOST IMPORTANT CONTRIBUTOR TO THE REGIONAL REGRESSIVITY ACROSS PROVINCES. (C) 2019 ELSEVIER B.V. ALL RIGHTS RESERVED.",""
