"","TOPIC","AUTHOR","UID","TITLE","ABSTRACT","NOTES"
"32","Climate_Change","YAN M, 2016, INT J NUMER ANAL MODEL","ISI000373023200008","PERTURBATION ANALYSIS OF INPUT-OUTPUT COEFFICIENTS ON ECONOMIC MODULE IN THE MRICE-E MODEL","MRICE-E MODEL IS A NEW INTEGRATED ASSESSMENT MODEL (IAM) APPLIED ON EVALUATING CLIMATE CHANGE AND THE LOSS OF ECONOMIC WELFARE. ITS ECONOMIC MODULE FOR CHINA ADOPTS A DYNAMIC, NONLINEAR AND MULTI-SECTIONAL CGE MODEL. IN THIS PAPER, WE ARE CONCERNED WITH THE EFFECTS OF PERTURBATIONS IN INPUT-OUTPUT COEFFICIENTS IN THE CGE MODEL. IN THE ANALYTICAL FRAMEWORK, SOME CONCEPTS SUCH AS THE LYAPUNOV EXPONENT AND THE CONDITION NUMBER FROM DYNAMIC SYSTEM AND NUMERICAL LINEAR ALGEBRA ARE EMPLOYED TO MEASURE THE ERRORS BROUGHT BY PERTURBATIONS OF THE I-O COEFFICIENTS. WE FINALLY DERIVE THE UPPER BOUND ESTIMATION OF ERRORS GROWTH THROUGH TIME. TO REDUCE THE EFFECTS OF THE POSSIBLE PERTURBATIONS, SOME SUGGESTIONS ABOUT CATEGORIZATION OF THE INDUSTRIAL SECTORS ARE GIVEN IN THE END.",""
"33","Climate_Change","AVISO KB, 2015, BIOMASS BIOENERG","ISI000367084100045","RISK ASSESSMENT OF THE ECONOMIC IMPACTS OF CLIMATE CHANGE ON THE IMPLEMENTATION OF MANDATORY BIODIESEL BLENDING PROGRAMS: A FUZZY INOPERABILITY INPUT-OUTPUT MODELING (IIM) APPROACH","MANY COUNTRIES HAVE IMPLEMENTED BIOFUEL PROGRAMS DESIGNED TO ADDRESS PRESSING CONCERNS SUCH AS CLIMATE CHANGE, ENERGY SECURITY AND RURAL DEVELOPMENT. HOWEVER, RECENT WORKS SUGGEST THAT BIOFUEL RESOURCES MAY BE AT RISK DUE TO CLIMATE-INDUCED DISRUPTIONS SUCH AS CHANGES IN PRECIPITATION LEVELS, PEST INFESTATION, OR INCREASED FREQUENCY OF EXTREME WEATHER EVENTS. THE INCIDENCE OF SUCH DISRUPTIONS NOT ONLY AFFECTS BIOFUEL PRODUCERS, BUT ALSO ENERGY-DEPENDENT ECONOMIC SECTORS, RESULTING IN ``RIPPLE EFFECTS'' THAT FURTHER INCREASE ECONOMIC LOSSES. A VARIANT OF THE INOPERABILITY INPUT-OUTPUT MODEL (IIM) IS USED TO ASSESS THE ECONOMIC EFFECTS OF IMPLEMENTING MANDATORY BIODIESEL BLENDING PROGRAMS IN THE PHILIPPINES. THIS APPROACH IS AN EXTENSION OF INPUT-OUTPUT ANALYSIS THAT QUANTIFIES RISK THROUGH THE DIMENSIONLESS INOPERABILITY METRIC, WHOSE VALUE RANGES FROM 0 TO 1 DEPENDING ON THE DEGREE OF FAILURE. USING THE IIM, WE ESTIMATE THE RESULTING CROP LOSSES USING THE STORM DAMAGE AND PEST INFESTATION SCENARIOS AT THE PROPOSED BLENDING RATE OF 5\% CURRENTLY BEING CONSIDERED IN THE PHILIPPINES. UNCERTAINTIES WITHIN THE MODELING FRAMEWORK ARE CAPTURED USING FUZZY NUMBERS. DIFFERENT RANKING STRATEGIES ARE THEN EVALUATED TO DETERMINE SECTOR VULNERABILITY USING INOPERABILITY LEVELS AND ECONOMIC LOSSES. THE EFFECT OF UNCERTAINTIES IS ALSO TAKEN INTO ACCOUNT THROUGH FUZZY RANKING OF THE SECTORS. (C) 2015 ELSEVIER LTD. ALL RIGHTS RESERVED.",""
"34","Climate_Change","KAGAWA S, 2015, GLOB ENVIRON CHANGE-HUMAN POLICY DIMENS","ISI000366767100043","CO2 EMISSION CLUSTERS WITHIN GLOBAL SUPPLY CHAIN NETWORKS: IMPLICATIONS FOR CLIMATE CHANGE MITIGATION","PRODUCTION AND CONSUMPTION OF GOODS AND SERVICES ARE INTERLINKED THROUGH COMPLEX GLOBAL SUPPLYCHAIN NETWORKS; SO ARE THE GREENHOUSE GAS EMISSIONS ASSOCIATED WITH THEM. USING A MODEL THAT REPRESENTS GLOBAL SUPPLY-CHAIN NETWORKS, WE IDENTIFIED SUPPLY-CHAIN CLUSTERS WITH HIGH CO2 EMISSIONS WITHIN MORE THAN 300 MILLION INDIVIDUAL SUPPLY CHAINS. WE DISTINGUISHED 4756 SIGNIFICANT CO2 CLUSTERS AND FOUND THAT IN 2008, GLOBAL SUPPLY-CHAIN NETWORKS ASSOCIATED WITH U.S. TRANSPORT EQUIPMENT AND CONSTRUCTION DEMAND INCLUDED RELATIVELY LARGE CO2 CLUSTERS IN CHINA, ACCOUNTING FOR 17\% AND 10\%, RESPECTIVELY, OF THE U.S. CO2 FOOTPRINT. OF ADDED IMPORTANCE IS THE FACT THAT THESE TWO CLUSTERS IN CHINA HAD ANNUAL GROWTH RATES OF 42\% AND 58\%, RESPECTIVELY, DURING THE PERIOD 1995-2008. OUR RESULTS SHOW THE IMPORTANCE FOR CLIMATE POLICY OF MONITORING THESE CO2 CLUSTERS THAT DOMINATE CO2 EMISSIONS IN GLOBAL SUPPLY CHAINS, AND THEY OFFER INSIGHTS ON WHERE CLIMATE POLICY CAN BE EFFECTIVELY DIRECTED. (C) 2015 PUBLISHED BY ELSEVIER LTD.",""
"35","Climate_Change","HE B, 2015, ENVIRON EARTH SCI","ISI000362016100003","CARBON SEQUESTRATION FROM CHINA'S AFFORESTATION PROJECTS","SINCE THE LATE 1970S, THE CHINESE GOVERNMENT HAS IMPLEMENTED MASSIVE AFFORESTATION PROJECTS TO ADDRESS GRIEVOUS ENVIRONMENTAL DISASTERS, PROTECT HUMAN HEALTH AND PROVIDE LONG-TERM ENVIRONMENTAL SECURITY. HAVING A BETTER UNDERSTANDING OF THE TOTAL CARBON SINK FROM THE AFFORESTATION PROJECTS IS FUNDAMENTAL TO ASSESS ITS GLOBAL CARBON BENEFIT. HERE, THE SEQUESTERED CARBON STOCK BASED ON CHINESE NATIONAL FOREST INVENTORY DATA IS CALCULATED BY USING THREE COMPARABLE VOLUME-DERIVED BIOMASS MODELS. RESULTS SHOW THAT THE CARBON SINK CONTRIBUTION FROM THESE CHINESE AFFORESTATION PROJECTS WAS 1.02 PG C BY THE END OF 2008 AND 0.79 PG C ON AVERAGE FROM 1981 TO 2008 WITH A CUMULATIVE RATE OF 0.028 PG C/A, WHICH CORRESPONDS TO 2 \% OF THE TOTAL INDUSTRIAL CARBON EMISSIONS FROM CHINA DURING THE SAME PERIOD. THE FINANCIAL VALUE OF CARBON SEQUESTRATION FROM THESE PROJECTS CAN BE ESTIMATED BY ITS VALUE IN CARBON TAXES OF FINLAND AND IS POTENTIALLY 190 BILLION RMB FROM 1981 TO 2008, WHICH IS 43.4 \% OF THE ORIGINAL INVESTMENT. HENCE ALTHOUGH CHINA'S AFFORESTATION PROJECTS MAKE ONLY MODEST CONTRIBUTIONS TO OFFSETTING INDUSTRIAL GROWTH IN CARBON, THE CARBON SEQUESTERED, IF VALUED ACCORDING TO SOME MARKETS, IS A SIGNIFICANT FRACTION OF THE TOTAL PROJECT COSTS.",""
"36","Climate_Change","HERTWICH EG, 2015, PROC NATL ACAD SCI U S A","ISI000354729500037","INTEGRATED LIFE-CYCLE ASSESSMENT OF ELECTRICITY-SUPPLY SCENARIOS CONFIRMS GLOBAL ENVIRONMENTAL BENEFIT OF LOW-CARBON TECHNOLOGIES","DECARBONIZATION OF ELECTRICITY GENERATION CAN SUPPORT CLIMATE-CHANGE MITIGATION AND PRESENTS AN OPPORTUNITY TO ADDRESS POLLUTION RESULTING FROM FOSSIL-FUEL COMBUSTION. GENERALLY, RENEWABLE TECHNOLOGIES REQUIRE HIGHER INITIAL INVESTMENTS IN INFRASTRUCTURE THAN FOSSIL-BASED POWER SYSTEMS. TO ASSESS THE TRADEOFFS OF INCREASED UP-FRONT EMISSIONS AND REDUCED OPERATIONAL EMISSIONS, WE PRESENT, TO OUR KNOWLEDGE, THE FIRST GLOBAL, INTEGRATED LIFE-CYCLE ASSESSMENT (LCA) OF LONG-TERM, WIDE-SCALE IMPLEMENTATION OF ELECTRICITY GENERATION FROM RENEWABLE SOURCES (I.E., PHOTOVOLTAIC AND SOLAR THERMAL, WIND, AND HYDROPOWER) AND OF CARBON DIOXIDE CAPTURE AND STORAGE FOR FOSSIL POWER GENERATION. WE COMPARE EMISSIONS CAUSING PARTICULATE MATTER EXPOSURE, FRESHWATER ECOTOXICITY, FRESHWATER EUTROPHICATION, AND CLIMATE CHANGE FOR THE CLIMATE-CHANGE-MITIGATION (BLUE MAP) AND BUSINESS-AS-USUAL (BASELINE) SCENARIOS OF THE INTERNATIONAL ENERGY AGENCY UP TO 2050. WE USE A VINTAGE STOCK MODEL TO CONDUCT AN LCA OF NEWLY INSTALLED CAPACITY YEAR-BY-YEAR FOR EACH REGION, THUS ACCOUNTING FOR CHANGES IN THE ENERGY MIX USED TO MANUFACTURE FUTURE POWER PLANTS. UNDER THE BASELINE SCENARIO, EMISSIONS OF AIR AND WATER POLLUTANTS MORE THAN DOUBLE WHEREAS THE LOW-CARBON TECHNOLOGIES INTRODUCED IN THE BLUE MAP SCENARIO ALLOW A DOUBLING OF ELECTRICITY SUPPLY WHILE STABILIZING OR EVEN REDUCING POLLUTION. MATERIAL REQUIREMENTS PER UNIT GENERATION FOR LOW-CARBON TECHNOLOGIES CAN BE HIGHER THAN FOR CONVENTIONAL FOSSIL GENERATION: 11-40 TIMES MORE COPPER FOR PHOTOVOLTAIC SYSTEMS AND 6-14 TIMES MORE IRON FOR WIND POWER PLANTS. HOWEVER, ONLY TWO YEARS OF CURRENT GLOBAL COPPER AND ONE YEAR OF IRON PRODUCTION WILL SUFFICE TO BUILD A LOW-CARBON ENERGY SYSTEM CAPABLE OF SUPPLYING THE WORLD'S ELECTRICITY NEEDS IN 2050.",""
"37","Climate_Change","AVISO KB, 2015, J CLEAN PROD","ISI000351649900033","P-GRAPH APPROACH FOR GDP-OPTIMAL ALLOCATION OF RESOURCES, COMMODITIES AND CAPITAL IN ECONOMIC SYSTEMS UNDER CLIMATE CHANGE-INDUCED CRISIS CONDITIONS","CLIMATE CHANGE IMPACTS MAY MANIFEST VIA MULTIPLE PATHWAYS, OFTEN LEADING TO A SHORTAGE OF RESOURCES, REDUCTION IN PRODUCTION CAPACITIES, OR REDUCTION IN AVAILABLE LABOR INPUTS THAT ARE VITAL FOR ECONOMIC ACTIVITIES. EFFECTIVE CLIMATE CHANGE ADAPTATION STRATEGIES ARE NEEDED TO DETERMINE THE OPTIMAL ALLOCATION OF SCARCE RESOURCES, COMMODITIES OR CAPITAL UNDER CRISIS CONDITIONS TO MINIMIZE THE ECONOMIC CONSEQUENCES. IN SUCH CASES, IT IS NECESSARY TO ACCOUNT FOR STRUCTURAL PROPERTIES OF ECONOMIC SYSTEMS TO ENSURE THAT RATIONAL DISTRIBUTION POLICIES ARE IMPLEMENTED. INPUT OUTPUT MODELS ARE USED TO ILLUSTRATE INTERDEPENDENCIES AMONG ECONOMIC SECTORS AND TO ASSESS BOTH DIRECT AND INDIRECT EFFECTS OF DISRUPTIVE EVENTS. ALTERNATIVELY, THESE INTERDEPENDENCIES MAY BE EXPLOITED FOR DEVELOPING EFFECTIVE RECOVERY EFFORTS TO MINIMIZE THE RIPPLE EFFECTS OF A CRISIS. IN THIS PAPER, A PROCESS GRAPH REPRESENTATION OF THE INPUT OUTPUT MODEL IS DEVELOPED TO GENERATE A RATIONAL PROCEDURE FOR THE ALLOCATION OF SCARCE RESOURCES, COMMODITIES OR CAPITAL DURING CRISIS CONDITIONS. THE PROCESS GRAPH MODEL IS A GRAPH-THEORETIC APPROACH ORIGINALLY DEVELOPED FOR CHEMICAL PROCESS DESIGN APPLICATIONS. THE ANALOGOUS PROBLEM STRUCTURE ALLOWS IT TO BE USED FOR THE INPUT-OUTPUT SYSTEM. THE METHOD IS DEMONSTRATED THROUGH SEVERAL CASE STUDIES TO IDENTIFY ALLOCATION POLICIES GEARED TOWARDS REDUCING THE IMPACT OF DISRUPTIONS ATTRIBUTED TO CRITICAL RESOURCES, COMMODITIES, OR CAPITAL. RESULTS SHOW THAT DEPENDING ON THE ECONOMIC STRUCTURE, THE OPTIMAL ALLOCATION OF SCARCE RESOURCES, COMMODITIES OR CAPITAL WILL SATISFY THE FINAL DEMANDS OF SOME ECONOMIC SECTORS AND REDUCE THE PRODUCTION CAPACITY OF OTHERS IN ORDER TO MINIMIZE THE REDUCTION OF TOTAL GROSS DOMESTIC PRODUCT. THOUGH SIMILAR RESULTS CAN BE OBTAINED THROUGH TRADITIONAL MATHEMATICAL PROGRAMMING MODELS, THE PROCESS GRAPH PLATFORM HAS THE ADVANTAGE TO VISUALLY PRESENT THE DISTRIBUTION OF SCARCE RESOURCES, COMMODITIES OR CAPITAL WITHIN THE SYSTEM. THIS WORK IS A FIRST ATTEMPT TO IMPLEMENT THE PROCESS GRAPH APPROACH IN THE FIELDS OF ECONOMICS AND CLIMATE CHANGE ADAPTATION. IN CONCLUSION, THE PROCESS GRAPH BASED APPROACH DEVELOPED IN THIS WORK CAN BE USED TO PROVIDE POLICYMAKERS WITH INSIGHTS IN DEVELOPING APPROPRIATE RISK MITIGATION PLANS ASSOCIATED WITH CLIMATE CHANGE-INDUCED CRISIS CONDITIONS. POTENTIAL APPLICATIONS INCLUDE BOTH THE DEVELOPMENT OF DISASTER PREPAREDNESS MEASURES FOR ANTICIPATED DISRUPTIONS, AS WELL AS THE IMPLEMENTATION OF REAL-TIME EMERGENCY RESPONSE IN THE MIDST OF A CRISIS. (C) 2014 ELSEVIER LTD. ALL RIGHTS RESERVED.",""
"38","Climate_Change","ZHONG Z, 2015, FRONT EARTH SCI","ISI000349441200007","CHINA'S PROVINCIAL CO2 EMISSIONS EMBODIED IN TRADE WITH IMPLICATIONS FOR REGIONAL CLIMATE POLICY","CO2 EMISSIONS EMBODIED IN TRADE HAVE AN IMPORTANT AND FAR-REACHING IMPACT ON CO2 EMISSIONS REDUCTION OBLIGATIONS. BASED ON A MULTI-REGIONAL INPUT-OUTPUT ANALYSIS, THIS PAPER CALCULATES CHINA'S PROVINCIAL CO2 EMISSIONS EMBODIED IN TRADE AND ANALYZES CO2 EMISSIONS EMBODIED IN TRADE PER UNIT OF VALUE OF TRADE IN 30 CHINESE PROVINCES. SEVERAL CLIMATE POLICY OPTIONS THAT POTENTIALLY REDUCE THE IMPACT OF TRADE ON INDIVIDUAL PROVINCES ARE DISCUSSED. ONE FINDING FROM THIS STUDY IS THAT PROVINCIAL CO2 EMISSIONS EMBODIED IN TRADE ACCOUNTED FOR APPROXIMATELY 60.02\% OF CHINA'S CO2 EMISSIONS IN 2007. THE CO2 EMISSIONS EMBODIED IN IMPORTS AND EXPORTS FOR 30 CHINESE PROVINCES DIFFER WIDELY, AND REMARKABLE DIFFERENCES IN THE CO2 EMISSIONS EMBODIED IN TRADE PER UNIT OF VALUE OF TRADE EXIST. ANOTHER IMPORTANT FINDING IS THAT IF PROVINCES TAKE BINDING COMMITMENTS AS A PART OF A COALITION, INSTEAD OF AS INDIVIDUAL PROVINCES, THEN THE IMPACTS OF TRADE CAN BE REDUCED. NOTABLY, HOWEVER, THE EXTENT OF REDUCTION IN A COALITION VARIES IN DIFFERENT PROVINCES.",""
"39","Climate_Change","OSHITA Y, 2012, ENERGY ECON","ISI000306158000018","IDENTIFYING CRITICAL SUPPLY CHAIN PATHS THAT DRIVE CHANGES IN CO2 EMISSIONS","TO ADDRESS THE PROBLEM OF GLOBAL WARMING, IT IS IMPORTANT TO IDENTIFY THE SUPPLY CHAIN PATHS THAT DRIVE CHANGES IN LIFE CYCLE CO2 EMISSIONS AND PROVIDE BOTH POLICY MAKERS AND DECISION MAKERS WITH THE INFORMATION ON THE CRITICAL PATHS IN ORDER TO EFFICIENTLY REDUCE THE CO2 EMISSIONS. IN THIS ARTICLE, I EXTRACT AND ANALYZE THE FACTORS AND KEY SUPPLY CHAINS INVOLVED IN CHANGES IN CO2 EMISSIONS ASSOCIATED WITH JAPAN'S OVERALL DEMAND FROM 1990 TO 2000 USING THE STRUCTURAL PATH DECOMPOSITION (SPD) METHOD APPLIED TO THE 1990-1995-2000 LINKED JAPANESE ENVIRONMENTAL INPUT-OUTPUT TABLES AT THE FOUR-DIGIT COMMODITY CLASSIFICATION LEVEL. THE RESULTS REVEAL THAT THE VOLUME OF CO2 EMISSIONS INCREASED AS A RESULT OF CHANGES IN THE INPUT STRUCTURE OF THE ELECTRICITY OF THE SERVICES SECTOR, SUCH AS ``ELECTRICITY -> AMUSEMENT AND RECREATION FACILITIES -> HOUSEHOLD DEMAND'' ``ELECTRICITY -> RETAIL TRADE -> HOUSEHOLD DEMAND'' AND ``ELECTRICITY -> PUBLIC ADMINISTRATION (LOCAL) -> LOCAL GOVERNMENT DEMAND'' INDICATING INCREASING DEPENDENCE OF SERVICES ON ENERGY INPUT. I ALSO FIND THAT THE FINAL DEMAND SHIFT CHANGED CO2 EMISSIONS, FOR EXAMPLE THE RISE IN DEMAND FOR INTEGRATED CIRCUITS IN EXPORTS HAS CONTRIBUTED TO INCREASING CO2 EMISSIONS GENERATED FROM ELECTRICITY, THE FALL IN DEMAND FOR FROZEN FISH AND SHELLFISH IN HOUSEHOLD DEMAND HAS CONTRIBUTED TO DECREASING CO2 EMISSIONS FROM MARINE FISHERIES. (C) 2011 ELSEVIER B.V. ALL RIGHTS RESERVED.",""
"40","Climate_Change","RAO ND, 2012, SUSTAINABILITY","ISI000324039300012","``DECENT LIVING'' EMISSIONS: A CONCEPTUAL FRAMEWORK","THERE IS VERY LITTLE ELABORATION IN LITERATURE OF THE PHRASE ``EQUITABLE ACCESS TO SUSTAINABLE DEVELOPMENT'' THAT IS REFERENCED IN THE CANCUN AGREEMENT ON CLIMATE CHANGE. WE INTERPRET THIS AT A MINIMUM AS PEOPLE'S RIGHT TO A DECENT LIVING STANDARD, WHICH GIVES RISE TO CLAIMS BY COUNTRIES TO AN EXEMPTION FROM MITIGATION FOR THE ENERGY AND EMISSIONS NEEDED TO PROVIDE A DECENT LIFE TO ALL. WE ELABORATE A CONCEPTUAL FRAMEWORK FOR A COMPREHENSIVE QUANTIFICATION OF SUCH AN ENERGY REQUIREMENT, INCLUDING THE ENERGY REQUIRED TO BUILD OUT INFRASTRUCTURE TO SUPPORT THESE LIVING STANDARDS. WE INTERPRET DECENT LIVING AS THE CONSUMPTION BY HOUSEHOLDS OF A SET OF BASIC GOODS INCLUDING ADEQUATE NUTRITION, SHELTER, HEALTH CARE, EDUCATION, TRANSPORT, REFRIGERATION, TELEVISION AND MOBILE PHONES. WE DEVELOP UNIVERSAL INDICATORS FOR THESE ACTIVITIES AND THEIR INFRASTRUCTURE REQUIREMENTS, AND SPECIFY A METHODOLOGY TO CONVERT THESE TO ENERGY REQUIREMENTS USING ENERGY INPUT-OUTPUT ANALYSIS. OUR MAIN RECOMMENDATIONS INCLUDE ESTIMATING BOTTOM-UP, COUNTRY-SPECIFIC ENERGY AND EMISSIONS REQUIREMENTS, INCORPORATING A MINIMUM FOR METHANE EMISSIONS, AND USING INTERNATIONAL BENCHMARKS AT THE SECTOR LEVEL TO ENCOURAGE THE REDUCTION OF COUNTRIES' ENERGY AND EMISSIONS INTENSITY.",""
"41","Climate_Change","WHITTLESEA ER, 2012, J SUSTAIN TOUR","ISI000306170000005","TOWARDS A LOW CARBON FUTURE - THE DEVELOPMENT AND APPLICATION OF REAP TOURISM, A DESTINATION FOOTPRINT AND SCENARIO TOOL","THIS PAPER EXPLORES THE DEVELOPMENT AND APPLICATION OF A BESPOKE MODELLING AND SCENARIO TOOL TO QUANTIFY THE FULL GREENHOUSE GAS (CO(2)E) FOOTPRINT ASSOCIATED WITH VISITOR ACTIVITY AND CONSUMPTION. DESIGNED FOR USE BY DESTINATION DECISION-MAKERS, IT HELPS UNDERSTAND THE FULL CO(2)E IMPACT OF VISITORS, EXPLORES POTENTIAL MITIGATION STRATEGIES AND IDENTIFIES EMISSIONS REDUCTION POSSIBILITIES. REAP TOURISM CAN CALCULATE DIRECT AND INDIRECT SUPPLY CHAIN EMISSIONS RELATED TO ACCOMMODATION, TRAVEL, FOOD, SHOPPING, SERVICES, ATTRACTIONS, ACTIVITIES AND EVENTS. THIS PAPER DEMONSTRATES THE TOOL AT A RANGE OF DIFFERENT GEOGRAPHIC LEVELS IN SOUTH WEST ENGLAND. INITIAL RESULTS SHOW OVERSEAS VISITORS TO HAVE AN IMPACT OF 196 KG CO(2)E PER DAY, DOMESTIC OVERNIGHT VISITORS HAVING 49 KG AND DAY VISITORS 48 KG. FURTHER EXPLORATION SHOWS THE TOOL'S ABILITY TO SHOW THE IMPACT OF DIFFERENT MARKETING/DEVELOPMENT SCENARIOS ON CO(2)E EMISSIONS INCLUDING HOLIDAYING LOCALLY STRATEGIES, ENCOURAGING LONGER STAYS, BUYING LOCAL GOODS AND ENCOURAGING LOW MEAT DIETS. COMPARISONS SHOW THAT LUXURY WEEKEND VISITORS HAVE FIVE TIMES THE DAILY IMPACT OF FAMILY HOLIDAY VISITORS AND TEN TIMES THOSE OF BACK-PACKERS. THE STRENGTHS AND WEAKNESSES OF THE TOOL'S METHODOLOGIES AND ITS RANGE OF OUTPUTS ABLE TO INFORM TOURISM POLICY AND DECISION-MAKING ARE DISCUSSED.",""
"42","Climate_Change","SEPPALA J, 2011, J CLEAN PROD","ISI000295148300006","AN ASSESSMENT OF GREENHOUSE GAS EMISSIONS AND MATERIAL FLOWS CAUSED BY THE FINNISH ECONOMY USING THE ENVIMAT MODEL","AN ENVIRONMENTALLY EXTENDED INPUT OUTPUT (EE-IO) ANALYSIS ENVIRONMENTAL IMPACTS OF MATERIAL FLOWS CAUSED BY THE FINNISH ECONOMY WAS CARRIED OUT IN ORDER TO IMPROVE DATA ON PRODUCTION AND CONSUMPTION IN FINLAND. THE STUDY RESULTED IN THE ENVIMAT MODEL, WHICH CAN BE USED TO ANALYZE THE RELATIONSHIP BETWEEN MATERIAL FLOWS, ENVIRONMENTAL IMPACTS AND THE ECONOMY. THE MODEL IS BASED ON MONETARY AND PHYSICAL INPUT OUTPUT TABLES AND AN ENVIRONMENTAL LIFE-CYCLE IMPACT ASSESSMENT. THIS ARTICLE SUMMARIZES THE MAIN METHODOLOGICAL ASPECTS AND FINDINGS REGARDING THE MATERIAL FLOWS AND CLIMATE IMPACTS CAUSED BY THE FINNISH ECONOMY IN 2002 AND 2005. THE FINNISH MODEL HAS RELATIVELY DETAILED INPUT DATA WITH 150 INDUSTRIES AND 918 PRODUCTS AND THE DATA ON IMPORTS WAS ASSESSED ACCORDING TO A MIXED APPROACH WITH THE HELP OF LIFE-CYCLE INVENTORY DATA. THE RESULTS OF THE MODEL SHOWED THAT THE FINNISH ECONOMY USES IMPORTED MATERIAL RESOURCES AS MUCH AS DOMESTIC RESOURCES. LIFE-CYCLE GREENHOUSE GAS (GHG) EMISSIONS CAUSED BY IMPORTS WERE EQUIVALENT TO 70-80\% OF DOMESTIC EMISSIONS. THE GHG EMISSIONS EMBODIED IN IMPORTS (EMISSIONS ABROAD) AND EXPORTS (EMISSIONS WITHIN FINLAND) WERE OF THE SAME MAGNITUDE. THE ANALYSIS SHOWED THAT THE SERVICE SECTOR ACCOUNTED FOR 44\% OF GHG EMISSIONS CAUSED BY THE DOMESTIC FINAL USE OF PRODUCTS. ANALYSIS OF THE RESULTS ALSO SHOWED THAT THE INDICATOR OF TOTAL MATERIAL REQUIREMENT (TMR) SHOULD NOT BE USED FOR ENVIRONMENTAL IMPACT COMPARISONS OF PRODUCTS AND SERVICES. IN THE FUTURE, THE AIM IS TO USE THE ENVIMAT MODEL FOR ASSESSING TEMPORAL CHANGES IN THE ECONOMY; FOR MONITORING SUSTAINABLE DEVELOPMENT: FOR PLANNING CLIMATE CHANGE MITIGATION; AND FOR IDENTIFYING IMPORTANT FACTORS IN THE ECONOMY AND ASSESSING THEIR IMPACTS. (C) 2011 ELSEVIER LTD. ALL RIGHTS RESERVED.",""
"43","Climate_Change","YOON B, 2011, ASIAN J TECHNOL INNOV","ISI000294581700001","A FRAMEWORK FOR IMPACT ANALYSIS OF THE INTERNATIONAL TRANSFER OF MARINE TECHNOLOGY IN A CLIMATE CHANGE ERA: AN INPUT-OUTPUT ANALYSIS AND ANALYTIC HIERARCHY PROCESS APPROACH","THIS STUDY RESPONDS TO THE NEED FOR THE INTERNATIONAL TRANSFER OF MARINE TECHNOLOGY BY FOCUSING ON IMPACT ANALYSIS AT THE PRELIMINARY STAGE. TO THIS END, WE PROPOSE A SYSTEMATIC FRAMEWORK BY INTEGRATING THE MERITS OF THE ANALYTIC HIERARCHY PROCESS FOR MULTIPLE CRITERIA DECISION MAKING AND THE STRENGTHS OF INPUT-OUTPUT ANALYSIS IN THE ASSESSMENT OF THE EFFECTS OF TECHNOLOGY DIFFUSION. THE SUGGESTED FRAMEWORK IS COMPRISED OF THREE CONSECUTIVE MODULES: TECHNOLOGY PRIORITY ANALYSIS, COUNTRY PRIORITY ANALYSIS AND IMPACT ANALYSIS OF TECHNOLOGY TRANSFER. THE FIRST TWO MODULES DEAL WITH TECHNOLOGY AND COUNTRY SELECTION AS A MULTIPLE CRITERIA DECISION MAKING PROBLEM. IN THE LAST MODULE, THE ECONOMIC IMPACTS ON BOTH THE TRANSFEROR AND TRANSFEREE ARE ESTIMATED IN TERMS OF THE GENERATED PRODUCTION, VALUE ADDED AND EMPLOYMENT. A CASE STUDY SHOWS THAT THE INTERNATIONAL TRANSFER OF GEOGRAPHIC INFORMATION SYSTEM (GIS) TECHNOLOGY FROM THE REPUBLIC OF KOREA TO THE PHILIPPINES IS THE MOST EFFECTIVE SCENARIO AMONG THOSE FOR THE MEMBERS OF PARTNERSHIPS IN ENVIRONMENTAL MANAGEMENT FOR THE SEAS OF EAST ASIA (PEMSEA). WE BELIEVE THAT OUR METHOD CAN PROMOTE RAPID AND EFFICIENT CONSENSUS BUILDING ON THE MOST COMPETITIVE STRATEGY FOR THE INTERNATIONAL TRANSFER OF MARINE TECHNOLOGY.",""
"44","Climate_Change","ATKINSON G, 2011, GLOB ENVIRON CHANGE-HUMAN POLICY DIMENS","ISI000292177500028","TRADE IN `VIRTUAL CARBON': EMPIRICAL RESULTS AND IMPLICATIONS FOR POLICY","THE FACT THAT DEVELOPING COUNTRIES DO NOT HAVE CARBON EMISSION CAPS UNDER THE KYOTO PROTOCOL HAS LED TO THE CURRENT INTEREST IN HIGH INCOME COUNTRIES IN BORDER TAXES ON THE `VIRTUAL' CARBON CONTENT OF IMPORTS. WE USE GTAP DATA AND INPUT-OUTPUT ANALYSIS TO ESTIMATE THE FLOWS OF VIRTUAL CARBON IMPLICIT IN DOMESTIC PRODUCTION TECHNOLOGIES AND THE PATTERN OF INTERNATIONAL TRADE. THE RESULTS PRESENT STRIKING EVIDENCE ON THE WIDE VARIATION IN THE CARBON-INTENSIVENESS OF TRADE ACROSS COUNTRIES, WITH MAJOR DEVELOPING COUNTRIES BEING LARGE NET EXPORTERS OF VIRTUAL CARBON. OUR ANALYSIS SUGGESTS THAT A TAX ON VIRTUAL CARBON COULD LEAD TO VERY SUBSTANTIAL EFFECTIVE TARIFF RATES ON THE EXPORTS OF THE MOST CARBON-INTENSIVE DEVELOPING NATIONS. AS AN ILLUSTRATION, WE FIND THAT AVERAGE TARIFF RATES OF 10\%, 8\% AND 12\% WOULD BE FACED BY IMPORTS FROM CHINA, INDIA AND SOUTH AFRICA IF CARBON IS TAXED AT \$50/TON CO2. MOREOVER, THERE IS WIDE VARIATION IN INTENSIVENESS ACROSS SECTORS WITHIN COUNTRIES WITH IMPLICATIONS FOR THE DISPARATE EFFECTIVE TARIFF BURDENS ON PARTICULARS PARTS OF THE ECONOMIES OF THESE COUNTRIES. SUCH EMPIRICAL FINDINGS, WE ARGUE, ARE USEFUL FOR FRAMING ON-GOING DISCUSSIONS ABOUT THE PRINCIPLES AND PRACTICE OF BORDER TAXES ON VIRTUAL CARBON. (C) 2010 ELSEVIER LTD. ALL RIGHTS RESERVED.",""
"45","Climate_Change","KAGAWA S, 2011, ENVIRON SCI TECHNOL","ISI000287122400006","ROLE OF MOTOR VEHICLE LIFETIME EXTENSION IN CLIMATE CHANGE POLICY","VEHICLE REPLACEMENT SCHEMES SUCH AS THE ``CASH FOR CLUNKERS'' PROGRAM IN THE U.S. AND THE ``SCRAPPAGE SCHEME'' IN THE UK HAVE FEATURED PROMINENTLY IN THE ECONOMIC STIMULATION PACKAGES INITIATED BY MANY GOVERNMENTS TO COPE WITH THE GLOBAL ECONOMIC CRISIS. WHILE THESE SCHEMES WERE DESIGNED AS ECONOMIC INSTRUMENTS TO SUPPORT THE VEHICLE PRODUCTION INDUSTRY, GOVERNMENTS HAVE ALSO CLAIMED THAT THESE PROGRAMS HAVE ENVIRONMENTAL BENEFITS SUCH AS REDUCING CO2 EMISSIONS BY BRINGING MORE FUEL-EFFICIENT VEHICLES ONTO THE ROADS. HOWEVER, LITTLE EVIDENCE IS AVAILABLE TO SUPPORT THIS CLAIM AS CURRENT ENERGY AND ENVIRONMENTAL ACCOUNTING MODELS ARE INADEQUATE FOR COMPREHENSIVELY CAPTURING THE ECONOMIC AND ENVIRONMENTAL TRADE-OFFS ASSOCIATED WITH CHANGE'S IN PRODUCT LIFE AND PRODUCT USE. WE THEREFORE DEVELOPED A NEW DYNAMIC MODEL TO QUANTIFY THE CARBON EMISSIONS DUE TO CHANGES IN PRODUCT LIFE AND CONSUMER BEHAVIOR RELATED TO PRODUCT USE. BASED ON A CASE STUDY OF JAPANESE VEHICLE USE DURING THE 1990-2000 PERIOD, WE FOUND THAT EXTENDING, NOT SHORTENING, THE LIFETIME OF A VEHICLE HELPS TO REDUCE LIFE-CYCLE CO2 EMISSIONS THROUGHOUT THE SUPPLY CHAIN. EMPIRICAL RESULTS ALSO REVEALED THAT EVEN IF THE FUEL ECONOMY OF LESS FUEL-EFFICIENT ORDINARY PASSENGER VEHICLES WERE IMPROVED TO LEVELS COMPARABLE WITH THOSE OF THE BEST AVAILABLE TECHNOLOGY, I.E. HYBRID PASSENGER CARS CURRENTLY BEING PRODUCED IN JAPAN, TOTAL CO2 EMISSIONS WOULD DECREASE BY ONLY 0.2\%. ON THE OTHER HAND, WE ALSO FIND THAT EXTENDING THE LIFETIME OF A VEHICLE CONTRIBUTED TO A MODERATE INCREASE IN EMISSIONS OF HEALTH-RELEVANT AIR POLLUTANTS (NOX, HC, AND CO) DURING THE USE PHASE. FROM THE RESULTS, THIS STUDY CONCLUDES THAT THE EFFECTS OF GLOBAL WARMING AND AIR POLLUTION CAN BE SOMEWHAT MODERATED AND THAT THESE PROBLEMS CAN BE ADDRESSED THROUGH SPECIFIC POLICY INSTRUMENTS DIRECTED AT INCREASING THE MARKET FOR HYBRID CARS AS WELL AS EXTENDING LIFETIME OF AUTOMOBILES, WHICH IS CONTRARY TO THE CURRENT WISDOM.",""
"46","Climate_Change","STEFFEK R, 2011, BULL INSECTOLOGY","ISI000296681900093","VITISCLIM, A PROJECT MODELLING EPIDEMIOLOGY AND ECONOMIC IMPACT OF GRAPEVINE `FLAVESCENCE DOREE' PHYTOPLASMA IN AUSTRIAN VITICULTURE UNDER A CLIMATE CHANGE SCENARIO","CLIMATE WARMING ALLOWS INVASIVE PESTS TO ESTABLISH IN AREAS WHERE THEY HAVE NOT BEEN RECOGNIZED BEFORE. SINCE ITS INTRODUCTION IN THE 1950'S IN SOUTHERN FRANCE, GRAPEVINE `FLAVESCENCE DOREE', A QUARANTINE DISEASE OF GRAPEVINES, HAS SPREAD SIGNIFICANTLY IN EUROPE AND HAS FIRST BEEN DETECTED IN AUSTRIA IN THE SOUTHEAST OF STYRIA IN AUTUMN 2009, WHICH CURRENTLY MARKS THE NORTHEASTERN BORDER OF ITS EXTENSION. VITISCLIM, A PROJECT FUNDED BY THE AUSTRIAN CLIMATE AND ENERGY FUND, STARTED IN APRIL 2011 AND AIMS TO MODEL THE CURRENT AND FUTURE POTENTIAL DISTRIBUTION OF THE DISEASE AND ITS VECTOR, THE LEAFHOPPER SCAPHOIDEUS TITANUS, IN EUROPE UNDER THE INFLUENCE OF CLIMATE CHANGE. VINE GROWING AREAS OF HIGH RISK IN AUSTRIA WILL BE DEFINED. BASED ON SCIENTIFIC LITERATURE AND EMPIRIC STUDIES, AN EPIDEMIOLOGICAL MODEL WILL SIMULATE THE TEMPORAL AND SPATIAL DYNAMICS OF THE SPREAD OF THE DISEASE AND ITS VECTOR. SENSITIVITY ANALYSIS WILL DETERMINE CRITICAL PARAMETERS, INCLUDING DIFFERENT MANAGEMENT STRATEGIES WHICH HAVE AN IMPACT ON THE DYNAMICS OF THE SPREAD. THE SPREAD MODEL, TOGETHER WITH THE RESULTS OF A SURVEY ON DIRECT AND INDIRECT COSTS WILL THEN BE USED IN INPUT-OUTPUT ANALYSIS TO MODEL THE POTENTIAL ECONOMIC IMPACT OF `FLAVESCENCE DOREE' TO AUSTRIAN VITICULTURE AND RELATED ECONOMIC SECTORS. THE RESULTS OF THE PROJECT WILL BE COMMUNICATED TO STAKEHOLDERS, RISK MANAGERS, POLICY MAKERS.",""
