"","TOPIC","AUTHOR","UID","TITLE","ABSTRACT","NOTES"
"1","Climate_Change","KANITKAR T, 2019, ENERGY","ISI000456351800055","AN INTEGRATED MODELING FRAMEWORK FOR ENERGY ECONOMY AND EMISSIONS MODELING: A CASE FOR INDIA","ADDRESSING ENVIRONMENTAL CONCERNS ALONGSIDE ECONOMIC DEVELOPMENT AND ENERGY TRANSITIONS IS A CHALLENGE FOR ALL COUNTRIES AND EFFECTIVE POLICY MAKING REQUIRES APPROACHES THAT CAN BALANCE ALL THESE CONCERNS. IN THIS PAPER, COMBINING A RANGE OF MODELING METHODOLOGIES IS PROPOSED AS A WAY OF ADDRESSING THESE QUESTIONS IN AN INTEGRATED MANNER. THE CHOICE OF MODELS TO BE USED WOULD DEPEND ON THE SPECIFIC CHARACTERISTICS OF THE SYSTEM AND REGION BEING STUDIED. ONE POSSIBLE COMBINATION OF MODELS IS DISCUSSES IN THIS PAPER FOR THE SPECIFIC CASE OF INDIA. THE INTEGRATED MODELING FRAMEWORK (IMF) PROPOSED COMBINES THREE MODELING APPROACHES - I) INDEX DECOMPOSITION TO ESTIMATE IMPACTS OF STRUCTURAL CHANGES IN THE ECONOMY, II) CONSTRAINED OPTIMIZATION TO ESTIMATE LEAST COST FUEL OPTIONS FOR THE POWER SECTOR, III) INPUT-OUTPUT ANALYSIS TO ESTIMATE ECONOMIC IMPACTS. THE MODEL RESULTS INDICATE THAT THE MODE OF INVESTMENT FOR CLIMATE CHANGE MITIGATION IS A SIGNIFICANT DETERMINANT OF THE IMPACT ON ECONOMIC GROWTH, INCOMES, AND INCOME DISTRIBUTION IN INDIA. IN SOME SCENARIOS, HIGHER INVESTMENTS IN GREEN ENERGY NEGATIVELY AFFECTS LOW INCOME HOUSEHOLDS SIGNIFICANTLY MORE AS COMPARED TO OTHER HOUSEHOLDS. THE PAPER ALSO DEMONSTRATES HOW THE IMF CAN BE USED TO DETERMINE THE REASONS FOR AND THEREFORE ALLEVIATE THE NEGATIVE IMPACTS. (C) 2018 ELSEVIER LTD. ALL RIGHTS RESERVED.",""
"2","Climate_Change","ARTO I, 2019, SCI TOTAL ENVIRON","ISI000447805500120","THE SOCIOECONOMIC FUTURE OF DELTAS IN A CHANGING ENVIRONMENT","DELTAS ARE ESPECIALLY VULNERABLE TO CLIMATE CHANGE GIVEN THEIR LOW-LYING LOCATION AND EXPOSURE TO STORM SURGES, COASTAL AND FLUVIAL FLOODING, SEA LEVEL RISE AND SUBSIDENCE. INCREASES IN SUCH EVENTS AND OTHER CIRCUMSTANCES ARE CONTRIBUTING TO THE CHANGE IN THE ENVIRONMENTAL CONDITIONS IN THE DELTAS, WHICH TRANSLATES INTO CHANGES IN THE PRODUCTIVITY OF ECOSYSTEMS AND, ULTIMATELY, INTO IMPACTS ON LIVELIHOODS AND HUMAN WELL-BEING. ACCORDINGLY, CLIMATE CHANGE WILL AFFECT NOT ONLY THE BIOPHYSICAL CONDITIONS OF DELTAIC ENVIRONMENTS BUT ALSO THEIR ECONOMIC CIRCUMSTANCES. FURTHERMORE, THESE ECONOMIC IMPLICATIONS WILL SPILL OVER TO OTHER REGIONS THROUGH GOODS AND SERVICES SUPPLY CHAINS AND VIA MIGRATION. IN THIS PAPER WE TAKE A WIDER VIEW ABOUT SOME OF THE SPECIFIC STUDIES WITHIN THIS SPECIAL ISSUE. WE ANALYSE THE EXTENT TO WHICH THE BIOPHYSICAL CONTEXT OF THE DELTAS CONTRIBUTES TO THE SUSTAINABILITY OF THE DIFFERENT ECONOMIC ACTIVITIES, IN THE DELTAS AND IN OTHER REGIONS. WE CONSTRUCT A SET OF ENVIRONMENTAL-EXTENDED MULTIREGIONAL INPUT-OUTPUT DATABASES AND SOCIAL ACCOUNTING MATRICES THAT ARE USED TO TRACE THE FLOW OF PROVISIONING ECOSYSTEM SERVICES ACROSS THE SUPPLY CHAINS, PROVIDING A VIEW OF THE LINKS BETWEEN THE BIOPHYSICAL ENVIRONMENT AND THE ECONOMIC ACTIVITIES. WE ALSO INTEGRATE THIS INFORMATION INTO A COMPUTABLE GENERAL EQUILIBRIUM MODEL TO ASSESS HOW THE CHANGES IN THE PROVISION OF NATURAL RESOURCES DUE TO CLIMATE CHANGE CAN POTENTIALLY AFFECT THE ECONOMIES OF THE DELTAS AND LINKED REGIONS, AND HOW THIS IN TURN AFFECTS ECONOMIC VULNERABILITY AND SUSTAINABILITY IN THESE REGIONS. (C) 2018 PUBLISHED BY ELSEVIER B.V.",""
"3","Climate_Change","ESPOSIO L, 2019, J SUSTAIN FINANC INVEST","ISI000471963600005","ENVIRONMENT - RISK-WEIGHTED ASSETS: ALLOWING BANKING SUPERVISION AND GREEN ECONOMY TO MEET FOR GOOD","THE 2008 CRISIS EXPOSED THE NOT-SO-BENIGN NEGLECT OF SYSTEMIC RISK AND FINANCIAL STABILITY IN THEORETICAL ANALYSES AS WELL AS IN ECONOMIC AND REGULATORY POLICIES. AS THE WORLD FINANCIAL CRISIS WAS UNFOLDING, WE HAVE ALSO SEEN A GROWING AWARENESS OF ANOTHER THREAT TO THE WORLD ECONOMY: CLIMATE CHANGE. A CONNECTION IS EMERGING BETWEEN THE TWO ASPECTS WITH THE DEVELOPMENT OF THE GREEN AND SUSTAINABLE FINANCE' PARADIGM AS AN ESSENTIAL PART OF THE PARIS AGREEMENT ON CLIMATE CHANGE AND OF THE NEEDED TRANSITION TO A LOW CARBON AND GREEN ECONOMY. WE PROPOSE REDESIGNING BANKING PRUDENTIAL REGULATION TO TAKE INTO ACCOUNT THE ENVIRONMENTAL DIMENSION OF BANKS RISKINESS AS AN ADDITIONAL COMPONENT OF THE CURRENT PRUDENTIAL FRAMEWORK, BASED ON THE CALCULATION AND GRADUAL IMPLEMENTATION OF POLLUTION-BASED RISK COEFFICIENTS FOR CAPITAL REQUIREMENTS. WE PRESENT THE MAIN METHODS AND SUGGEST PRACTICAL APPROACHES TO DEVELOP THEM. FINALLY, WE TEST OUR PROPOSAL USING AVAILABLE DATA FOR ITALY, SHOWING HOW THE TOOL CAN HELP TO PUSH THE BANKS' TO TAKE INTO ACCOUNT THE ENVIRONMENT DIMENSION IN THEIR CREDIT POLICIES WITHOUT DISRUPTING THE BANKING SYSTEM.",""
"4","Climate_Change","WANG S, 2019, APPL ENERGY","ISI000454376900064","ENERGY WATER NEXUS UNDER ENERGY MIX SCENARIOS USING INPUT OUTPUT AND ECOLOGICAL NETWORK ANALYSES","INCREASING DEMAND FOR ENERGY, AN EVOLVING ELECTRICITY-GENERATION MIX, AND WATER DEMAND FROM COMPETING SECTORS HAVE IMPORTANT IMPLICATIONS FOR WATER BUDGETS AND ENERGY PLANNING. TO EVALUATE THE WATER-RELATED IMPACTS OF ENERGY-RELATED DECISIONS, WE BUILT A NATIONAL ENERGY WATER NEXUS SCENARIO ANALYSIS ASSESSMENT FRAMEWORK BY EXTENDING INPUT OUTPUT ANALYSIS (IOA) TO FUTURE ENERGY MIX SCENARIOS OF CHINA. THE SCENARIOS FOR CHINA OUT TO 2050 INCLUDE FOUR LOW-CARBON-DEVELOPMENT SCENARIOS THAT ARE PLANNED IN CLIMATE CHANGE MITIGATION ROADMAPS AND ONE BASELINE SCENARIO. SECTORAL DIRECT ENERGY, DIRECT WATER, WATER-RELATED ENERGY, AND ENERGY-RELATED WATER CONSUMPTION WERE INVENTORIED. SECTORAL EMBODIED CONSUMPTION OF WATER AND ENERGY AND THEIR INTER-SECTOR FLOWS WERE MAPPED USING IOA TO CREATE ENERGY WATER NEXUS NETWORKS. A SECTORAL NEXUS WAS DEFINED TO INVESTIGATE THE IMPACT OF THE ENERGY WATER LINKAGE ON ENERGY AND WATER SYSTEMS. SECTORAL CONTROL AND DEPENDENCE RELATIONSHIPS WERE REVEALED BY ECOLOGICAL NETWORK ANALYSIS. RESULTS SHOWED THAT NEXUS IMPACT ON THE WATER SYSTEM WAS LARGER THAN THAT ON THE ENERGY SYSTEM. THE MAIN EXPORT AND IMPORT PAIRS-CHEMICAL INDUSTRY-AGRICULTURE (AG), MANUFACTURING-AG, AG METAL SMELTING AND PRESSING (ME), AND ME-ELECTRICITY (EL) SHOULD BE CRITICAL PATHWAYS FOR NEXUS MANAGEMENT VIA THE ADJUSTMENT OF SECTORAL ECONOMIC RELATIONSHIPS. THE SECTORS WITH A HIGH NEXUS IMPACT-AG, EL, AND ME-SHOULD DECREASE THEIR ENERGY AND WATER CONSUMPTION TO ACHIEVE OUTSIZED SYSTEM-WIDE SAVINGS. SECTORS WITH A LOW NEXUS IMPACT SUCH AS DOMESTIC SERVICES; TRANSPORT, STORAGE AND POST SERVICES; AND WATER PRODUCTION AND SUPPLY-CAN INCREASE THEIR ENERGY AND WATER CONSUMPTION WITH A LESSER IMPACT ON THE WIDER SYSTEM. THE LOW-CARBON-DEVELOPMENT SCENARIO EXHIBITED THE LOWEST NEXUS IMPACT, FOLLOWED BY THE ENHANCED LOW-CARBON SCENARIO, WHOSE ENERGY MIX ALSO EXERTED THE LOWEST PRESSURE ON THE WATER SYSTEM. BY ANALYZING THE TRADEOFFS BETWEEN ENERGY, WATER, AND CARBON EMISSIONS UNDER FIVE SCENARIOS, THIS STUDY PROVIDES INSIGHTS FOR NEXUS MANAGEMENT ON HOW TO BALANCE WATER SHORTAGE ISSUES AND THE DEVELOPMENT OF ENERGY GENERATION IN FUTURE ENERGY AND WATER RESOURCE PLANNING.",""
"5","Climate_Change","MONTT G, 2018, INT LABOUR REV","ISI000454620000001","DOES CLIMATE ACTION DESTROY JOBS? AN ASSESSMENT OF THE EMPLOYMENT IMPLICATIONS OF THE 2-DEGREE GOAL","THE PARIS AGREEMENT LAYS OUT THE OBJECTIVE OF KEEPING GLOBAL WARMING BELOW 2 DEGREES C. THE GOAL CAN BE ACHIEVED BY INCREASING BOTH THE SHARE OF RENEWABLES IN THE ENERGY MIX AND ENERGY EFFICIENCY. SUCH ACTION ENTAILS A TRANSFORMATION OF THE ENERGY SECTOR, WHICH, GIVEN ITS LINKAGES WITH THE REST OF THE ECONOMY, WILL HAVE A KNOCK-ON EFFECT ON OTHER SECTORS. USING SCENARIOS BASED ON A MULTIREGIONAL INPUT-OUTPUT DATABASE, THIS ARTICLE EXPLORES THE ECONOMY-WIDE AND WORLDWIDE EMPLOYMENT IMPACT OF SUCH A TRANSITION. FINDINGS SUGGEST THAT BY 2030 MOST ECONOMIES WILL EXPERIENCE NET JOB CREATION AND REALLOCATION ACROSS INDUSTRIES. JOB CREATION IS DRIVEN BY THE CONSTRUCTION, MANUFACTURING AND RENEWABLES SECTORS.",""
"6","Climate_Change","SCHERER L, 2018, ENVIRON SCI POLICY","ISI000450383100008","TRADE-OFFS BETWEEN SOCIAL AND ENVIRONMENTAL SUSTAINABLE DEVELOPMENT GOALS","THE UN'S 17 SUSTAINABLE DEVELOPMENT GOALS (SDGS) AIM TO IMPROVE THE LIVES OF PEOPLE, INCREASE PROSPERITY, AND PROTECT THE PLANET. GIVEN THE LARGE NUMBER OF GOALS, INTERACTIONS ARE INEVITABLE. WE ANALYSE THE INTERACTION BETWEEN TWO SOCIAL GOALS (RELATED TO SDG1 POVERTY AND SDG10 INEQUALITY) AND THREE ENVIRONMENTAL GOALS (RELATED TO SDG13 CARBON, SDG15 LAND, AND SDG6 WATER). WE USE A TRADE-LINKED, CONSUMPTION-BASED APPROACH TO ASSESS INTERACTIONS IN 166 NATIONS, EACH SUBDIVIDED INTO FOUR INCOME GROUPS. WE FIND THAT PURSUING SOCIAL GOALS IS, GENERALLY, ASSOCIATED WITH HIGHER ENVIRONMENTAL IMPACTS. HOWEVER, INTERACTIONS DIFFER GREATLY AMONG COUNTRIES AND DEPEND ON THE SPECIFIC GOALS. IN BOTH INTERACTIONS, CARBON EXPERIENCES SMALLER CHANGES THAN LAND AND WATER. ALTHOUGH EFFORTS BY HIGH- AND LOW-INCOME GROUPS ARE NEEDED, THE RICH HAVE A GREATER LEVERAGE TO REDUCE HUMANITY'S FOOTPRINTS. GIVEN THE IMPORTANCE OF BOTH SOCIAL AND ENVIRONMENTAL SUSTAINABILITY, IT IS CRUCIAL THAT QUANTITATIVE INTERACTIONS BETWEEN SDGS BE WELL UNDERSTOOD SO THAT, WHERE NEEDED, INTEGRATIVE POLICIES CAN BE DEVELOPED.",""
"7","Climate_Change","WANG Z, 2018, J ENVIRON MANAGE","ISI000446147000004","CRITICAL SECTORS AND PATHS FOR CLIMATE CHANGE MITIGATION WITHIN SUPPLY CHAIN NETWORKS","CERTAIN SECTORS AND PATHS ALONG SUPPLY CHAINS PLAY A CRITICAL ROLE IN CLIMATE CHANGE MITIGATION. WE DEVELOPE A CONSUMPTION-BASED FRAMEWORK, WHICH COMBINES INPUT-OUTPUT ANALYSIS, A POWER-OF-PULL APPROACH AND STRUCTURAL PATH ANALYSIS, AND APPLIED IT TO SUPPLY CHAIN NETWORKS DERIVED FROM 2010 AND 2012 JING-JIN-JI INTERREGIONAL INPUT-OUTPUT TABLES. THE AIM OF THIS STUDY IS TO IDENTIFY (1) THE KEY ECONOMIC SECTORS FOR CONTROLLING CARBON EMISSIONS AND THEIR CHANGES, (2) THE CRITICAL DIRECTIONS FROM A CARBON-PULLING SECTOR TO THE EMISSIONS OF KEY ECONOMIC SECTORS, AND (3) THE PATHS WITH THE LARGEST CARBON EMISSIONS FLUX IN THESE CRITICAL DIRECTIONS. OUR RESULTS SHOW THAT THE KEY SECTORS ARE FROM HEBEI AND TIANJIN, MORE CONCENTRATED IN HEBEI. MOST SECTORS HAVE THE LARGEST PULLING POWER OVER THEIR OWN CARBON EMISSIONS, AND WITHIN-REGION CONNECTIONS DOMINATED IN THE EMISSION NETWORK, WITH A STRONGER TIE BETWEEN BEIJING AND THE OTHER TWO REGIONS. CRITICAL PATHS ALONG CARBON-PULLING DIRECTIONS ARE LOCATED IN TIERS 0 AND 1. OUR FRAMEWORK CAN PROVIDE NEW INSIGHT INTO THE CREATION OF CARBON EMISSIONS CONTROL POLICIES.",""
"8","Climate_Change","HOA THI NGUYEN HTN, 2018, SUSTAIN PROD CONSUMP","ISI000451188200012","A LINEAR PROGRAMMING INPUT-OUTPUT MODEL FOR MAPPING LOW-CARBON SCENARIOS FOR VIETNAM IN 2030","THE INTENDED NATIONALLY DETERMINED CONTRIBUTION (INDC) OF VIETNAM TO THE 2015 UNITED NATIONS CLIMATE CHANGE CONFERENCE (COP21) IS A 25\% REDUCTION IN GREENHOUSE GAS (GHG) EMISSIONS RELATIVE TO THE BUSINESS-AS-USUAL (BAU) SCENARIO BY 2030. THERE ARE VARIOUS MEASURES PROPOSED IN THE INDC, BUT STUDIES TO ASSESS THEIR POTENTIAL EFFECTIVENESS ARE STILL NEEDED. AN INPUT-OUTPUT BASED LINEAR PROGRAMMING MODEL IS DEVELOPED IN THIS WORK TO EVALUATE THE MAXIMUM GHG EMISSION REDUCTIONS WHICH CAN BE ACHIEVED, GIVEN VARIOUS CLIMATE CHANGE MITIGATION STRATEGIES. SIX SCENARIOS ARE CONSIDERED TO IDENTIFY THE HIGHEST GHG EMISSION REDUCTION THAT CAN BE ACHIEVED BY THE YEAR 2030. THESE SCENARIOS INCLUDE BAU, THE CONSIDERATION OF TWO DIFFERENT LEVELS OF DIFFERENTIATED SECTOR GROWTH, THE ADOPTION OF A LOW-CARBON ELECTRICITY MIX, ENERGY EFFICIENCY ENHANCEMENT FOR FINAL CONSUMPTION, AND ENERGY EFFICIENCY ENHANCEMENT IN THE AGRICULTURE, TRANSPORT AND WASTE SECTORS. EACH SCENARIO QUANTIFIES THE SECTOR FINAL DEMAND, SECTOR GROSS OUTPUT, SECTOR GHG EMISSION LOAD AND THE IMPACT ON HUMAN HEALTH. RESULTS SHOW THAT THE BEST STRATEGY IS TO SIMULTANEOUSLY IMPLEMENT ALL OF THE IDENTIFIED LOW-CARBON MEASURES, WHICH ACHIEVES A 24.6\% REDUCTION IN OVERALL GHG EMISSIONS IN COMPARISON TO BAU LEVELS. (C) 2018 INSTITUTION OF CHEMICAL ENGINEERS. PUBLISHED BY ELSEVIER B.V. ALL RIGHTS RESERVED.",""
"9","Climate_Change","TIAN Y, 2018, J CLEAN PROD","ISI000437997200045","STRUCTURAL PATH DECOMPOSITION OF CARBON EMISSION: A STUDY OF CHINA'S MANUFACTURING INDUSTRY","MANUFACTURING IS THE FOUNDATION OF CHINA'S ECONOMY AND ACCOUNTS FOR A LARGE PROPORTION OF CHINA'S CO2 EMISSIONS. IN THIS STUDY, THE STRUCTURAL PATH DECOMPOSITION (SPD) METHODOLOGY, BASED ON AN ENVIRONMENTAL INPUT-OUTPUT MODEL, WAS USED TO FIND CRITICAL SUPPLY CHAIN PATHS THAT DRIVE CHANGES IN CO2 LIFE CYCLE IN CHINA'S MANUFACTURING INDUSTRY FROM 1992 TO 2012. THE CHANGES IN CO2 EMISSIONS WERE DECOMPOSED INTO THREE MAIN FACTORS: CARBON EMISSIONS INTENSITY, INPUT-OUTPUT STRUCTURE, AND FINAL DEMAND. IN THIS STUDY, THE ``WEIGHTED AVERAGE DECOMPOSITIONS'' METHOD OF STRUCTURAL DECOMPOSITION ANALYSIS AND THE NON-COMPARABLE INPUT-OUTPUT TABLE WERE FIRST APPLIED TO THE SPD METHOD TO OBTAIN ACCURATE RESULTS. THE RESULTS INDICATE THAT HIGHER-ORDER PATHS, ESPECIALLY THE PATHS THAT STARTED FROM THE ``SMELTING AND ROLLING OF METALS'' AND THE ``PRODUCTION AND SUPPLY OF ELECTRICITY AND STEAM'' SECTORS, LED TO AN INCREASE IN CARBON EMISSIONS. THIS WAS MAINLY DUE TO THE EXTENSION OF THE INDUSTRIAL CHAIN AS WELL AS POLICY PRIORITIES. MOREOVER, CO2 EMISSIONS FROM THE ``CHEMICAL INDUSTRY'' ``MANUFACTURE OF NONMETALLIC MINERAL PRODUCTS'' AND ``SMELTING AND ROLLING OF METALS'' SECTORS WERE MAINLY INDUCED BY THE INCREASE OF FINAL EXPORT DEMANDS. BASED ON THE RESULTS OF THIS STUDY, RELEVANT POLICY CHANGES HAVE ALSO BEEN RECOMMENDED. (C) 2018 ELSEVIER LTD. ALL RIGHTS RESERVED.",""
"10","Climate_Change","ACQUAYE A, 2018, EUR J OPER RES","ISI000433017000015","A QUANTITATIVE MODEL FOR ENVIRONMENTALLY SUSTAINABLE SUPPLY CHAIN PERFORMANCE MEASUREMENT","THE DEVELOPMENT OF ROBUST MECHANISMS FOR SUPPLY CHAIN PERFORMANCE MEASUREMENT HAVE BEEN IDENTIFIED AS AN INTEGRAL STEP NEEDED FOR THE TRANSITION TOWARDS SUSTAINABLE SUPPLY CHAIN SYSTEMS AND A GREENER GLOBAL ECONOMY. HOWEVER, MEASURING THE ENVIRONMENTAL PERFORMANCE OF SUPPLY CHAINS IS A CHALLENGING TASK, DUE TO SEVERAL FACTORS, SUCH AS THE LACK OF STANDARDISED METHODOLOGIES AND THE INHERENT MULTI-CRITERIA NATURE OF THE PROBLEM. BY LEVERAGING THE CAPABILITY OF A MULTI-REGIONAL INPUT-OUTPUT FRAMEWORK TO HANDLE THE COMPLEX AND GLOBAL NATURE OF SUPPLY CHAINS, THE CURRENT WORK PRESENTS A ROBUST ENVIRONMENTAL SUSTAINABLE PERFORMANCE MEASUREMENT MODEL UNDERPINNED BY INDUSTRIAL LIFECYCLE THINKING. AS A RESULT, SOME THEORETICAL INSIGHTS ARE PROVIDED AND AN EMPIRICAL APPLICATION OF THE MODEL TO THE METAL PRODUCTS INDUSTRY OF THE BRICS (BRAZIL, RUSSIA, INDIA, CHINA, AND SOUTH AFRICA) NATIONS UNDERTAKEN IN AN ATTEMPT TO ADDRESS SOME OF THE METHODOLOGICAL AND APPLIED MEASUREMENT CHALLENGES. IN PARTICULAR, THIS ALLOWED THE MODELLING OF CARBON EMISSIONS TRENDS WITHIN, AND BETWEEN THE BRICS NATIONS AND WITH THE REST-OF-THE-WORLD OVER A 20-YEAR PERIOD (1992-2011) AS WELL AS PROVIDING AN OPPORTUNITY TO HYPOTHESIS ON THEIR FUTURE CARBON EMISSIONS PERFORMANCES. SPECIFIC ANALYSES OF THE METAL PRODUCT INDUSTRY SHOWED THAT DEMAND REPRESENTS THE MAIN DRIVER FOR THE INCREASING CARBON FOOTPRINT. HOWEVER, THE OVERALL DECLINE IN REPORTED CARBON FOOTPRINT WAS DUE TO IMPROVEMENTS IN EMISSIONS INTENSITY AND EFFICIENCY GAINS INDUCED BY TECHNOLOGY. THE STUDY FURTHER ASSESSES THE EFFECTS OF IMPORTS AND ECONOMIC GROWTH ON CARBON FOOTPRINT AND DISCUSSES THE IMPLICATIONS OF THE STUDY TO SUSTAINABILITY TRANSITION PROCESSES IN THE BRICS NATIONS. (C) 2017 THE AUTHORS. PUBLISHED BY ELSEVIER B.V.",""
"11","Climate_Change","BOEHM R, 2018, FOOD POLICY","ISI000445993500007","A COMPREHENSIVE LIFE CYCLE ASSESSMENT OF GREENHOUSE GAS EMISSIONS FROM US HOUSEHOLD FOOD CHOICES","CHANGES IN DIET HAVE BEEN PROPOSED AS ONE WAY TO REDUCE CARBON EMISSIONS FROM THE FOOD SYSTEM. BUT EVIDENCE ON THE IMPLICATIONS OF CHANGING TO LOW CARBON FOOD CHOICES FOR BOTH DIET QUALITY AND FOOD AFFORDABILITY ARE LIMITED IN THE U.S. THE OBJECTIVE OF THIS STUDY WAS TO (A) ESTIMATE GREENHOUSE GAS EMISSIONS (GHGES) FROM U.S. HOUSEHOLD FOOD PURCHASES; (B) EXAMINE THE SOURCE OF GHGES ACROSS U.S. FOOD PRODUCTION INDUSTRIES AND STAGES OF THE SUPPLY CHAIN; AND (C) SHOW THE ASSOCIATION BETWEEN GHGES AND SPENDING BY FOOD CATEGORIES AND HOUSEHOLD SOCIODEMOGRAPHICS. GHGES FROM FOOD EXPENDITURES MADE BY HOUSEHOLDS PARTICIPATING IN THE NATIONAL HOUSEHOLD FOOD ACQUISITION AND PURCHASE SURVEY WERE CALCULATED USING ECONOMIC INPUT-OUTPUT LIFE CYCLE ASSESSMENT. RESULTS INDICATE THAT FOOD PURCHASES ACCOUNTED FOR 16\% OF U.S. GHGES IN 2013 AND AVERAGE WEEKLY HOUSEHOLD GHGES WERE 71.8 KG CARBON DIOXIDE EQUIVALENTS PER STANDARD ADULT. 68\% OF AVERAGE WEEKLY HOUSEHOLD GHGES FROM FOOD SPENDING CAME FROM AGRICULTURE AND FOOD MANUFACTURING STAGES OF THE FOOD SUPPLY CHAIN. INDUSTRIES THAT PRODUCE ANIMAL PROTEINS ACCOUNTED FOR 30\% OF AVERAGE WEEKLY HOUSEHOLD GHGES, THE LARGEST SHARE OF ANY FOOD INDUSTRY. HOUSEHOLDS GENERATING THE HIGHEST LEVELS OF GHGES SPENT A SIGNIFICANTLY LARGER SHARE OF THEIR FOOD BUDGET ON PROTEIN FOODS COMPARED TO HOUSEHOLDS GENERATING LOWER LEVELS OF GHGES. WHITE HOUSEHOLDS AND THOSE WITH HIGHER EDUCATION LEVELS GENERATED MORE GHGES FROM FOOD SPENDING COMPARED TO NON-WHITE AND LESS EDUCATED HOUSEHOLDS. OVERALL THESE FINDINGS INFORM THE ONGOING DEBATE ABOUT WHICH DIETS OR FOOD SPENDING PATTERNS IN THE U.S. ARE BEST FOR MITIGATING GHGES IN THE FOOD SYSTEM AND IF THEY ARE FEASIBLE FOR CONSUMERS TO PURCHASE.",""
"12","Climate_Change","MACH R, 2018, ECOL ECON","ISI000433014500006","ENVIRONMENTAL IMPACT OF CONSUMPTION BY CZECH HOUSEHOLDS: HYBRID INPUT-OUTPUT ANALYSIS LINKED TO HOUSEHOLD CONSUMPTION DATA","WE QUANTIFY DIRECT AND INDIRECT EMISSIONS RESULTING FROM CZECH HOUSEHOLD CONSUMPTION CONTRIBUTING TO CLIMATE CHANGE, ACIDIFICATION AND SMOG FORMATION. WE DEVELOP A HYBRID ENVIRONMENTALLY EXTENDED INPUT-OUTPUT MODEL THAT LINKS THE SINGLE-REGION INPUT-OUTPUT ANALYSIS ON DOMESTIC PROCESSES WITH A MULTIREGIONAL INPUT-OUTPUT ANALYSIS TO DERIVE THE INDIRECT EMISSIONS ASSOCIATED WITH IMPORTS AND PART OF THE DOMESTIC PRODUCTION. WE APPLY ALMON'S ALGORITHM TO TRANSFORM THE DOMESTIC EMISSIONS FROM INDUSTRIES TO PRODUCT GROUPS. THE INDIRECT AND DIRECT EMISSION INTENSITIES OF MORE THAN HUNDRED CONSUMPTION ITEMS ARE THEN LINKED TO EXPENDITURES OF ALMOST 3000 INDIVIDUAL HOUSEHOLDS TO COMPUTE THE TOTAL EMISSIONS FOR EACH HOUSEHOLD. WE FIND THAT EMISSIONS ATTRIBUTABLE TO HOUSEHOLDS ARE NOT DISTRIBUTED EVENLY - WHILE THE FIRST EXPENDITURE DECILE OF HOUSEHOLDS IS RESPONSIBLE FOR LESS THAN 4\% OF ALL EMISSIONS, THE TENTH DECILE IS RESPONSIBLE FOR 20-24\%. CONSUMPTION OF SERVICES AND GOODS IS LEAST EMISSION INTENSIVE, WHILE USE OF ELECTRICITY, HEATING, AND TRANSPORTATION REMAINS RESPONSIBLE FOR THE MAJOR PART OF EMISSIONS. THE MOST IMPORTANT FACTOR OF EMISSIONS ATTRIBUTABLE TO HOUSEHOLD CONSUMPTION IS TOTAL EXPENDITURES; THE EXPENDITURE ELASTICITY OF EMISSIONS IS ABOUT 0.8, BUT WE IDENTIFY CONSUMPTION GROUPS WHICH EMISSIONS ARE LESS SENSITIVE TO TOTAL EXPENDITURES (ELECTRICITY, HEATING AND FOOD) AND MORE SENSITIVE (TRANSPORTATION, GOODS).",""
"13","Climate_Change","WOOD R, 2018, J IND ECOL","ISI000434132900008","PRIORITIZING CONSUMPTION-BASED CARBON POLICY BASED ON THE EVALUATION OF MITIGATION POTENTIAL USING INPUT-OUTPUT METHODS","CARBON FOOTPRINTS AIM TO ENGAGE CONSUMERS IN CONTRIBUTING TO CLIMATE-CHANGE MITIGATION. CONSUMPTION-ORIENTED POLICY MEASURES ATTEMPT TO CAUSE VOLUNTARY OR INCENTIVIZED INTERVENTIONS THAT REDUCE ENVIRONMENTAL IMPACT THROUGH THE SUPPLY CHAIN BY UTILIZING DEMAND DRIVERS. A LARGE BODY OF LIFE CYCLE ASSESSMENT STUDIES DESCRIBE HOW SPECIFIC ACTIONS CAN REDUCE THE ENVIRONMENTAL FOOTPRINT OF AN INDIVIDUAL OR HOUSEHOLD. HOWEVER, THESE ASSESSMENTS ARE OFTEN CONDUCTED WITH A NARROW FOCUS ON PARTICULAR GOODS AND PROCESSES. HERE, WE FORMALIZE A COUNTERFACTUAL METHOD AND OPERATIONAL TOOL FOR SCOPING THE POTENTIAL IMPACT OF SUCH ACTIONS, FOCUSING ON ECONOMY-WIDE IMPACT. THIS QUICKSCAN TOOL CAN MODEL SHIFTS AND REDUCTIONS IN DEMAND, REBOUND EFFECTS (USING MARGINAL EXPENDITURE), CHANGES IN DOMESTIC AND INTERNATIONAL PRODUCTION RECIPES, AND REDUCTIONS IN THE ENVIRONMENTAL INTENSITY OF PRODUCTION. THIS TOOL PROVIDES QUICK, MACRO-LEVEL ESTIMATES OF THE EFFICACY OF CONSUMER-ORIENTED POLICY MEASURES AND CAN HELP TO PRIORITIZE RELEVANT POLICIES. WE DEMONSTRATE THE METHOD USING TWO CASE STUDIES ON DIET AND CLOTHING USING THE EXIOBASE3 MULTIREGIONAL INPUT-OUTPUT DATABASE, GIVING SPATIALLY EXPLICIT INFORMATION ON WHERE ENVIRONMENTAL IMPACT REDUCTIONS OF THE INTERVENTIONS OCCUR, AND WHERE IMPACTS MAY INCREASE IN THE CASE OF REBOUNDS.",""
"14","Climate_Change","SIMONEN K, 2018, ENERGY BUILD","ISI000428492700012","EMBODIED CARBON AS A PROXY FOR THE ENVIRONMENTAL IMPACT OF EARTHQUAKE DAMAGE REPAIR","IN EVALUATING THE LIFE CYCLE ENVIRONMENTAL IMPACTS OF BUILDINGS, THE CONTRIBUTIONS OF SEISMIC DAMAGE ARE RARELY CONSIDERED. IN ORDER TO ENABLE A MORE COMPREHENSIVE ASSESSMENT OF A BUILDING'S ENVIRONMENTAL IMPACT BY ACCOUNTING FOR SEISMIC EVENTS, THIS PROJECT DEVELOPED AN ENVIRONMENTAL IMPACT DATABASE OF BUILDING COMPONENT SEISMIC DAMAGE - THE LARGEST OF ITS KIND KNOWN TO DATE - BY COMBINING DATA FROM CARNEGIE MELLON UNIVERSITY'S ECONOMIC INPUT-OUTPUT LIFE CYCLE ANALYSIS (LCA) DATABASE WITH COST ESTIMATES OF REPAIR PREVIOUSLY DEVELOPED FOR FEMA'S PERFORMANCE ASSESSMENT CALCULATION TOOL (PACT), A SOFTWARE THAT MODELS PROBABILISTIC SEISMIC DAMAGE IN BUILDINGS. FIFTEEN INDICATORS OF ENVIRONMENTAL IMPACTS WERE CALCULATED FOR THE REPAIR OF APPROXIMATELY 800 BUILDING COMPONENTS FOR UP TO FIVE LEVELS OF SEISMIC DAMAGE, CAPTURING `EMBODIED' IMPACTS RELATED TO CRADLE-TO-GATE MANUFACTURING OF BUILDING MATERIALS, PRODUCTS, AND EQUIPMENT. ANALYSIS OF THE DATA REVEALED THAT NON-STRUCTURAL AND ARCHITECTURAL FINISHES OFTEN DOMINATED THE ENVIRONMENTAL IMPACTS OF SEISMIC DAMAGE PER DOLLAR SPENT IN REPAIR. A STATISTICAL ANALYSIS WAS PERFORMED ON THE DATA USING PRINCIPAL COMPONENT ANALYSIS, CONFIRMING THAT EMBODIED CARBON, A POPULAR METRIC FOR EVALUATING ENVIRONMENTAL IMPACTS IN BUILDING LCAS, IS A SUITABLE PROXY FOR OTHER RELEVANT ENVIRONMENTAL IMPACT METRICS WHEN ASSESSING THE IMPACT OF REPAIRING EARTHQUAKE DAMAGE OF BUILDINGS. (C) 2018 ELSEVIER B.V. ALL RIGHTS RESERVED.",""
"15","Climate_Change","JIBORN M, 2018, GLOB ENVIRON CHANGE-HUMAN POLICY DIMENS","ISI000429509100004","DECOUPLING OR DELUSION? MEASURING EMISSIONS DISPLACEMENT IN FOREIGN TRADE","IN A WORLD WHERE CLIMATE GOALS ARE GLOBAL BUT ACTION REMAINS FIRMLY IN THE HANDS OF STATES, RELIABLE METHODS ARE NEEDED TO ENSURE THAT EMISSIONS REDUCTIONS ON A NATIONAL LEVEL ARE NOT OFFSET BY CARBON LEAKAGE. APPROPRIATE INDICATORS ARE NEEDED TO HELP POLICY MAKERS SET ACCURATE TARGETS FOR THE CARBON BALANCE OF THEIR FOREIGN TRADE AND MONITOR THE DEVELOPMENT OF TRADE IN A MEANINGFUL WAY. THIS PAPER PROPOSES A NEW DISPLACEMENT INDICATOR - THE TECHNOLOGY ADJUSTED BALANCE OF EMISSIONS EMBODIED IN TRADE - THAT IMPROVES ON EXISTING IDEAS BY SEPARATING OUT THE EFFECTS OF SCALE AND COMPOSITION OF TRADE FROM THE EFFECTS OF DIFFERENT TECHNOLOGIES AND ENERGY SYSTEMS. THE NEW INDICATOR IS CALCULATED FOR SWEDISH AND UK TRADE FROM 1995 TO 2009, A PERIOD WHEN BOTH COUNTRIES HAVE REPORTED DECREASING TERRITORIAL EMISSIONS TOGETHER WITH SUSTAINED ECONOMIC GROWTH. ONE KEY FINDING IS THAT, FOR BOTH COUNTRIES, OUTSOURCING OF EMISSIONS IS LESS SERIOUS THAN WHAT CONVENTIONAL ANALYSIS OF EMISSIONS EMBODIED IN TRADE SUGGESTS. FOR SWEDEN, THE TECHNOLOGY ADJUSTED BALANCE OF EMISSIONS EMBODIED IN TRADE IS POSITIVE THROUGHOUT THE STUDIED PERIOD, IMPLYING THAT ITS EXPORTS REDUCE EMISSIONS ABROAD MORE THAN WHAT IS GENERATED BY ITS IMPORTS. HOWEVER, WE ALSO FIND THAT BOTH COUNTRIES HAVE CHANGED THE COMPOSITION OF THEIR IMPORTS AND EXPORTS DURING THIS PERIOD: IMPORTS HAVE BECOME MORE CARBON INTENSIVE AND, EXPORTS LESS SO, COMPARED TO THE WORLD ECONOMY AT LARGE.",""
"16","Climate_Change","NAKANO K, 2018, MITIG ADAPT STRATEG GLOB CHANG","ISI000424030100006","FUTURE RISK OF DENGUE FEVER TO WORKFORCE AND INDUSTRY THROUGH GLOBAL SUPPLY CHAIN","THE PRIMARY VECTOR OF THE DENGUE FEVER VIRUS, THE AEDES AEGYPTI MOSQUITO, IS DISTRIBUTED ACROSS THE TROPICAL AND SUB-TROPICAL LATITUDES; HOWEVER, THE AREA AT RISK OF INFECTION HAS BEEN EXPANDING STEADILY. THIS STUDY AIMED TO IDENTIFY THE INDUSTRIES MOST VULNERABLE TO THE EFFECTS OF DENGUE FEVER BY 2030. THE ASSESSMENT WAS DONE BY CONSIDERING THE INTERNATIONAL SUPPLY CHAIN, WITH ASPECTS SUCH AS THE LABOR INTENSITY, AND THE RELEVANT GEOGRAPHICAL AND SOCIOECONOMIC ASPECTS BEING TAKEN INTO ACCOUNT. IN ADDITION, MULTI-REGIONAL INPUT-OUTPUT TABLES WERE EMPLOYED TO ANALYZE THE RIPPLE EFFECTS OF PRODUCTIVITY LOSSES RESULTING FROM WORKERS CONTRACTING THE DISEASE. THE RESULTS INDICATE THAT MORE THAN 10\% OF THE WORKERS INVOLVED IN THE SUPPLY CHAIN OF ALL THE MAJOR INDUSTRIES IN THE UNITED STATES (USA), CHINA, JAPAN, AND GERMANY COULD BE CONSIDERED AT RISK OF CONTRACTING DENGUE FEVER BY 2030. MOREOVER, THE RISK WAS EVEN HIGHER IN INDIA AND BRAZIL, NAMELY, MORE THAN 70\%. THE EFFECT OF WIDESPREAD DENGUE FEVER INFECTION COULD INFLUENCE INDUSTRIAL ACTIVITIES SEVERELY, NOT ONLY IN THE REGIONS MOST AT RISK (INDIA AND BRAZIL) BUT ALSO IN THE OTHER REGIONS (USA, JAPAN, AND GERMANY). LABOR-INTENSIVE INDUSTRIES, SUCH AS AGRICULTURE, FISHERIES, AND THE DISTRIBUTION SECTOR ARE PARTICULARLY AT RISK AND WILL HAVE TO CONSIDER APPROPRIATE CONTINGENCY MEASURES. IT IS RECOMMENDED THAT THE DOWNSTREAM SIDE OF THE SUPPLY CHAIN, THE INDUSTRIES IN THE USA, JAPAN, AND GERMANY, SUPPORTS THE INTRODUCTION OF WORKER'S HEALTH MANAGEMENT SYSTEM AGAINST THE INFECTIOUS DISEASE INTO THEIR BUSINESS PARTNERS. THIS STUDY EMPLOYED LIMITED DATA AND ONLY ESTIMATED THE POSSIBLE EFFECTS OF THE DISEASE BY 2030. FURTHER COMPREHENSIVE ANALYSIS IS REQUIRED WITH MORE DATA MODELED FOR THE FUTURE TO VERIFY AND ENHANCE THE RELIABILITY OF THE PRESENT RESULTS.",""
