"","TOPIC","AUTHOR","UID","TITLE","ABSTRACT","NOTES"
"60","Land","BRANKOVIC C, 2006, CLIM DYN","ISI000237089600005","GCM SENSITIVITY EXPERIMENTS WITH LOCALLY MODIFIED LAND SURFACE PROPERTIES OVER TROPICAL SOUTH AMERICA","ENSEMBLES OF 1-YEAR-LONG EXPERIMENTS WITH A RELATIVELY HIGH-RESOLUTION ECMWF MODEL WERE CONDUCTED IN ORDER TO INVESTIGATE THE IMPACT OF MODIFIED LAND SURFACE PROPERTIES ON LOCAL, REGIONAL AND LARGE-SCALE ATMOSPHERIC CIRCULATIONS. THE MODIFICATIONS CONSISTED OF CHANGES TO LAND COVER AND INCREASED ALBEDO OVER THE NORTHERN PART OF SOUTH AMERICA. IN MANY RESPECTS THE EXPERIMENTAL DESIGN RESEMBLES THE SETTING OF CLASSICAL DEFORESTATION EXPERIMENTS. THE LOCAL MODEL RESPONSE TO IMPOSED MODIFICATIONS, WHICH INCLUDES A REDUCTION IN PRECIPITATION AS WELL AS IN EVAPORATION AND AN INCREASE IN SURFACE TEMPERATURE, WAS FOUND TO BE STRONGER IN DRY (JULY-SEPTEMBER, JAS) THAN IN WET (JANUARY-MARCH, JFM) SEASON, AND IN THE ENSEMBLE WITH HIGHER ALBEDO VALUE. LOCAL DRYING IS DISCUSSED IN TERMS OF LOCALLY GENERATED OVERTURNING THAT RESEMBLES A DIRECT THERMAL CIRCULATION. THE EFFECTS OF THIS CIRCULATION SEEM TO BE DOMINANT OVER THE REDUCTION IN LARGE-SCALE MOISTURE SUPPLY FROM THE ADJACENT OCEAN. ON LARGE SCALES, CHANGES TO THE PACIFIC BRANCH OF THE WALKER CIRCULATION LEAD, THROUGH MODIFIED DIVERGENT FLOW, TO A TROPICS-WIDE IMPACT ON PRECIPITATION. IN ADDITION TO SOUTH AMERICA, THE LARGEST CHANGES ARE SEEN IN THE SOUTH PACIFIC CONVERGENCE ZONE IN JFM, WHILE THE IMPACT ON THE ATLANTIC INTER-TROPICAL CONVERGENCE ZONE IS STRONGER IN JAS. IN THE EXTRATROPICS, THERE IS LITTLE CHANGE IN PRECIPITATION. IN THE UPPER TROPOSPHERE, A DISTINCTIVE TELECONNECTION WAVE-PATTERN COULD BE SEEN IN THE PACIFIC/NORTH AMERICAN REGION DURING JFM. A NOTABLE FEATURE IN THE UPPER-AIR MODEL RESPONSE IN JAS IS A WAVE TRAIN EXTENDING FROM SOUTH AMERICA, OVER THE NORTHERN ATLANTIC INTO EUROPE. WITH REGARD TO THE INTERACTION BETWEEN THE LAND SURFACE RESPONSE AND MODEL SYSTEMATIC ERRORS, OUR RESULTS SUGGEST THAT THE ERRONEOUS SHIFT OF THE DOWNWARD BRANCH OF THE PACIFIC/SOUTH AMERICAN WALKER CIRCULATION IS LIKELY TO BE A CAUSE, RATHER THAN A CONSEQUENCE, OF THE RAINFALL DEFICIT OVER SOUTH AMERICA IN THE MODEL CLIMATOLOGY.",""
"61","Land","FUNDEL F, 2006, J GEOPHYS RES -ATMOS","ISI000235966800001","INFLUENCE OF LARGE-SCALE TELECONNECTION PATTERNS ON METHANE SULFONATE ICE CORE RECORDS IN DRONNING MAUD LAND","RECORDS OF METHANE SULFONATE (MS-) IN ICE CORES FROM THE HIGH PLATEAU OF DRONNING MAUD LAND (DML), ANTARCTICA, DRILLED IN THE FRAMEWORK OF THE EUROPEAN PROJECT FOR ICE CORING IN ANTARCTICA, ARE INVESTIGATED FOR THEIR POTENTIAL AS AN ENVIRONMENTAL AND CLIMATE ARCHIVE FOR THE ATLANTIC SECTOR OF THE SOUTHERN OCEAN. DESPITE POSTDEPOSITIONAL CHANGES, YEARS OF EXTRAORDINARY MS- CONCENTRATIONS CAN BE CLEARLY DETECTED IN THE ICE CORE RECORDS. WE USE COMPOSITE ANOMALY MAPS OF ATMOSPHERIC PARAMETERS FROM THE NATIONAL CENTERS FOR ENVIRONMENTAL PREDICTION/NATIONAL CENTER FOR ATMOSPHERIC RESEARCH REANALYSIS FIELDS FOR YEARS OF EXTREME MS - CONCENTRATION TO DETECT ATMOSPHERIC PATTERNS CAUSING MS- VARIABILITY. CHANGING ATMOSPHERIC TRANSPORT IS SHOWN TO BE AN IMPORTANT, BUT NOT EXCLUSIVE, PARAMETER BEING CONSERVED IN THE MS- RECORD IN DML. THE OFTEN HYPOTHESIZED DIRECT LINK BETWEEN HIGH MS- CONCENTRATIONS AND EL NINO EVENTS IS NOT SUPPORTED FOR THE OBSERVED REGION WHEREAS THE ANTARCTIC DIPOLE ( ADP), WHICH IS MODULATED BY EL NINO-SOUTHERN OSCILLATION CONDITIONS, EXERTS SIGNIFICANT INFLUENCE. A CLEAR 13.9-YEAR CYCLE CAN BE FOUND THROUGHOUT A 2000-YEAR MS- RECORD THAT CAN BE RELATED TO VARIATIONS IN THE ADP. OVER THE LAST 300 YEARS A 4.6-YEAR CYCLE IS REVEALED IN THE MS- ( AND SEA-SALT RECORD), WHICH VANISHES IN THE DEEPER PART OF THE ICE CORE AS A CONSEQUENCE OF DIFFUSION PROCESSES. FROM THE LONG-TERM PERSPECTIVE, PERIODS OF HIGH MS- CONCENTRATIONS ARE CONNECTED TO, ON AVERAGE, HIGHER SEA-SALT AEROSOL AS WELL, REFLECTING A SEASONALLY INDEPENDENT INFLUENCE OF TRANSPORT ON BOTH SPECIES. A DISTINCTIVE PERIOD OF EFFICIENT ATMOSPHERIC TRANSPORT, PROBABLY DUE TO A PRONOUNCED ADP, COULD BE FOUND FROM 1200 TO 1600 A.D.",""
"62","Land","POLIMENI JM, 2005, AGRIC HUMAN VALUES","ISI000234586600001","SIMULATING AGRICULTURAL CONVERSION TO RESIDENTIAL USE IN THE HUDSON RIVER VALLEY: SCENARIO ANALYSES AND CASE STUDIES","LAND USE CHANGES THREATEN AGRICULTURAL LAND. IF AGRICULTURAL LAND IS GOING TO BE PRESERVED, THE SOCIAL AND ECONOMIC CAUSES OF CONVERSION MUST BE UNDERSTOOD. HOWEVER, ANALYZING THE CAUSES OF AGRICULTURAL CONVERSION IS COMPLEX BECAUSE TRENDS NEED TO BE DOCUMENTED BEFORE ANALYZING THE CAUSES. ONE OF THE LEADING USES OF AGRICULTURAL LAND IS FOR RESIDENTIAL PURPOSES. THIS PAPER PROJECTS RESIDENTIAL DEVELOPMENT IN A HUDSON RIVER VALLEY WATERSHED WITHIN DUTCHESS COUNTY IN NEW YORK STATE USING AN INTEGRATED MODELING FRAMEWORK CONSISTING OF AN ECONOMETRIC MODEL, A GEOGRAPHIC INFORMATION SYSTEM (GIS), AND MONTE CARLO SIMULATION. THE ECONOMETRIC MODEL IS USED TO PROJECT RESIDENTIAL DEVELOPMENT, PROVIDING PARCEL-SPECIFIC PROBABILITIES OF RESIDENTIAL DEVELOPMENT. THE GIS IS EMPLOYED TO EXTRACT SOCIO-ECONOMIC AND COUNTY-LEVEL TAX PARCEL DATA TO BE USED IN CONJUNCTION WITH BIO-GEOPHYSICAL ATTRIBUTES, SUCH AS SLOPE, SOIL, AND LOCATION, TO CALCULATE AND PROJECT GROWTH TRENDS ON A RESIDENTIAL LEVEL FOR UNDEVELOPED LAND PARCELS. MONTE CARLO SIMULATION IS USED TO DISTRIBUTE THESE PROJECTIONS INTO THE GIS TO DISPLAY OUTCOMES OF SCENARIO ANALYSE; TO PROVIDE POLICY-MAKERS A DEMONSTRATION OF HOW POLICIES WOULD LIKELY AFFECT THE AGRICULTURAL LANDSCAPE OF THE WATERSHED.",""
"63","Land","DIETZENBACHER E, 2005, ECOL ECON","ISI000232478900003","WASTE TREATMENT IN PHYSICAL INPUT-OUTPUT ANALYSIS","WHEN COMPARED TO MONETARY INPUT-OUTPUT TABLES (MIOTS), A DISTINCTIVE FEATURE OF PHYSICAL INPUT-OUTPUT TABLES (PIOTS) IS THAT THEY INCLUDE THE GENERATION OF WASTE AS PART OF A CONSISTENT ACCOUNTING FRAMEWORK. AS A CONSEQUENCE, HOWEVER, PHYSICAL INPUT-OUTPUT ANALYSIS THUS REQUIRES THAT THE TREATMENT OF WASTE IS EXPLICITLY TAKEN INTO ACCOUNT, BECAUSE OTHERWISE THE RESULTS WILL BE GROSSLY UNDERESTIMATED. THE TREATMENT OF WASTE HAS RECENTLY LED TO AN INTERESTING METHODOLOGICAL DEBATE. THIS PAPER REVIEWS THE DISCUSSION AND INTRODUCES A NEW ALTERNATIVE. THIS ALTERNATIVE RECONCILES THE EXISTING METHODS AND ENABLES US TO OBTAIN ADDITIONAL INFORMATION THAT CANNOT BE DERIVED FROM THE OTHER METHODS. (C) 2005 ELSEVIER B.V. ALL RIGHTS RESERVED.",""
"64","Land","ZHAO Y, 2004, TRANSP RES PT B-METHODOL","ISI000223259300002","THE RANDOM-UTILITY-BASED MULTIREGIONAL INPUT-OUTPUT MODEL: SOLUTION EXISTENCE AND UNIQUENESS","A NUMBER OF OPERATIONAL LAND USE-TRANSPORTATION MODELS MAKE USE OF SPATIAL INPUT-OUTPUT (SIO) MODELS, SOME OF WHICH ARE BASED ON RANDOM-UTILITY THEORY. THE RANDOM-UTILITY-BASED MULTIREGIONAL INPUT-OUTPUT (RUBMRIO) MODEL HAS BEEN SOLVED IN PRACTICE BY ITERATIVELY APPLYING A SET OF EQUATIONS. EACH OF THE MODEL EQUATIONS DESCRIBES RELATIONSHIPS AMONG KEY MODEL VARIABLES. THIS PAPER EXAMINES THE EXISTENCE AND UNIQUENESS OF THE RUBMRIO SOLUTION, WHICH REPRESENTS THE SPATIAL ALLOCATION OF PRODUCTIVE ACTIVITIES AND COMMODITY FLOWS. FORMULATING THE SET OF EQUATIONS AS A FIXED-POINT PROBLEM ILLUMINATES THESE TWO KEY PROPERTIES, AND PROVIDES A GENERAL SOLUTION ALGORITHM. SEVERAL NUMERICAL EXAMPLES ILLUSTRATE THE SOLUTION UNIQUENESS AND ALGORITHM CONVERGENCE. THESE RESULTS ARE VALUABLE FOR EFFICIENT APPLICATION OF SUCH MODELS TO LARGE-SCALE PROBLEMS. BY PROVING THAT A UNIQUE SOLUTION DOES EXIST AND OFFERING AN ALGORITHM THAT IS GUARANTEED TO CONVERGE, THIS WORK ADDS VALUABLE SUPPORT TO THE GROWING POPULARITY OF THIS INTEGRATED TRANSPORTATION-LAND USE MODELING FRAMEWORK. (C) 2004 ELSEVIER LTD. ALL RIGHTS RESERVED.",""
"65","Land","WU MC, 2004, J CLIM","ISI000220450100021","IMPACTS OF EL NINO-SOUTHERN OSCILLATION EVENTS ON TROPICAL CYCLONE LANDFALLING ACTIVITY IN THE WESTERN NORTH PACIFIC","THE IMPACT OF EL NINO-SOUTHERN OSCILLATION (ENSO) EPISODES ON THE VARIABILITY IN THE LANDFALLING PATTERN OF TROPICAL CYCLONES IN THE WESTERN NORTH PACIFIC IS STUDIED USING THE BOOTSTRAP TECHNIQUE. IT IS FOUND THAT, RELATIVE TO NEUTRAL YEARS, IN THE MONTHS SEPTEMBER, OCTOBER, AND NOVEMBER OR THE LATE SEASON OF EL NINO YEARS THE NUMBER OF TROPICAL CYCLONES LANDFALLING IN THE LANDMASSES RIMMING THE WESTERN NORTH PACIFIC IS SIGNIFICANTLY REDUCED. THE EXCEPTION IS JAPAN AND THE KOREAN PENINSULA. ON THE OTHER HAND, IN THE LATE SEASON OF LA NINA YEARS, CHINA CAN EXPECT SIGNIFICANTLY MORE LANDFALLS. THE PREDICTABILITY OF THE NUMBER OF LANDFALLING TROPICAL CYCLONES IN THE WESTERN NORTH PACIFIC IS FOUND TO BE THE HIGHEST FOR CHINA IN THE LATE SEASON OF LA NINA YEARS. THE REDUCTION IN THE NUMBER OF LANDFALLS DURING THE LATE SEASON OF EL NINO YEARS SEEMS TO BE RELATED TO AN EASTWARD SHIFT IN THE MEAN TROPICAL CYCLONE GENESIS POSITION AND A BREAK IN THE 500-HPA SUBTROPICAL RIDGE NEAR 130DEGREESE. IN CONTRAST, THE INCREASE IN THE NUMBER OF LANDFALLS DURING THE LATE SEASON OF LA NINA YEARS APPEARS TO BE RELATED TO A WESTWARD SHIFT IN THE MEAN GENESIS POSITION TOGETHER WITH A CONTIGUOUS 500-HPA SUBTROPICAL RIDGE.",""
"66","Land","SUH S, 2004, ECOL ECON-a","ISI000188548300003","A NOTE ON THE CALCULUS FOR PHYSICAL INPUT-OUTPUT ANALYSIS AND ITS APPLICATION TO LAND APPROPRIATION OF INTERNATIONAL TRADE ACTIVITIES","IN A RECENT PAPER IN THIS JOURNAL, EMBODIED LAND APPROPRIATION IN INTERNATIONAL TRADE ACTIVITIES WAS ANALYSED USING A PHYSICAL INPUT-OUTPUT TABLE (PIOT) (ECOLOGICAL ECONOMICS 44 (2003) 137). THE AUTHORS STATED THAT THERE ARE SIGNIFICANT DIFFERENCES BETWEEN THE PHYSICAL AND THE MONETARY INPUT-OUTPUT TABLES IN THEIR RESULTS, WHICH THE AUTHORS ARGUED TO BE DUE TO THE FACT THAT THE RESULTS FROM THE MONETARY TABLE ARE DETERMINED MAINLY BY THE MONETARY STRUCTURE OF FINAL DEMAND, WHILE THE STRUCTURE OF A PHYSICAL TABLE MORE CLOSELY RESEMBLES THE `PHYSICAL REALITIES' OF AN ECONOMY. IN THE PRESENT PAPER, IT IS ARGUED THAT THE METHODOLOGICAL FOUNDATION THAT THE AUTHORS BASED THEIR ANALYSIS ON IS MISLEADING AND DOES NOT SATISFY THE OVERALL MATERIAL BALANCE REQUIREMENT. IT IS SHOWN THAT THE DIFFERENCES IN THE RESULTS BETWEEN THE MONETARY AND PHYSICAL TABLES PRESENTED BY THE AUTHORS HAVE NOTHING TO DO WITH THE RESEMBLANCE TO THE PHYSICAL REALITIES. I ALSO TRIED TO FURTHER CLARIFY A NUMBER OF CRITICAL ISSUES IN APPLYING PHYSICAL INPUT-OUTPUT TABLES, RELATED TO DOUBLE COUNTING, TREATMENT OF WASTES AND THE EFFECT OF CLOSING THE SYSTEM TOWARD DIRECT MATERIAL INPUTS. A NUMBER OF CONSISTENT BUT DIFFERENT APPROACHES TO COPE WITH THESE ISSUES ARE PRESENTED, INCLUDING THEIR PROOFS. THE EMBODIED LAND APPROPRIATION OF INTERNATIONAL TRADE ACTIVITIES IS CALCULATED AND COMPARED BY APPLYING THOSE APPROACHES. THERE ARE MANY ADVANTAGES OF USING PHYSICAL INPUT-OUTPUT TABLES, HOWEVER, THEIR SUPERIORITY SHOULD NOT BE EXAGGERATED NOR BE REGARDED AS ABSOLUTE. DEPENDING ON HOW IT IS CONSTRUCTED AND USED, IT IS ALSO POSSIBLE THAT THE RESULTS FROM A PHYSICAL INPUT-OUTPUT TABLE DO NOT TELL US MORE THAN THAT INDEED SOME COMMODITIES ARE CHEAPER, OR MORE COSTLY, PER UNIT OF THEIR MASS. (C) 2003 ELSEVIER B.V. ALL RIGHTS RESERVED.",""
"67","Land","KYTZIA S, 2004, J CLEAN PROD","ISI000222076200008","ECONOMICALLY EXTENDED - MFA: A MATERIAL FLOW APPROACH FOR A BETTER UNDERSTANDING OF FOOD PRODUCTION CHAIN","IN THE FOLLOWING ARTICLE, WE INTRODUCE A METHOD CALLED ECONOMICALLY EXTENDED MATERIAL FLOW ANALYSIS (EE-MFA), WHICH AIMS AT STUDYING CAUSAL RELATIONSHIPS BETWEEN ECONOMICALLY MOTIVATED HUMAN BEHAVIOUR AND RESOURCE CONSUMPTION. FOR THIS PURPOSE, WE EXPAND MFA WITH ECONOMIC INFORMATION. THIS METHOD IS EVALUATED BY APPLYING IT IN A CASE STUDY ON RESOURCE EFFICIENCY IN THE FOOD PRODUCTION CHAIN. EE-MFA REDUCES THE SHORTCOMINGS OF A TECHNICALLY ORIENTED MFA BY INCLUDING A DESCRIPTION OF THE INPUTS AND OUTPUTS IN MONEY UNITS WITHOUT CHANGING THE SYSTEM STRUCTURE. THIS BENEFIT IS SHOWN IN THE STATUS QUO ANALYSIS OF ``TO NOURISH'' WHERE DATA FROM VARIOUS SOURCES COULD BE COMPILED TO SET UP A CONSISTENT MODEL OF MATERIAL, ENERGY AND MONEY FLOWS. A FURTHER VALUE ADDITION OF THE METHOD IS THAT IT CREATES A BASIS FOR A MULTI-CRITERIA EVALUATION OF STRATEGIES TO IMPROVE RESOURCE EFFICIENCY ON A REGIONAL SCALE. ONE RESULT OF THIS MULTI-CRITERIA EVALUATION IS A CLASSIFICATION OF STRATEGIES ACCORDING TO THEIR INFLUENCE ON THE MATERIALS, ENERGY AND MONEY FLOWS. (C) 2004 ELSEVIER LTD. ALL RIGHTS RESERVED.",""
"68","Land","GOMEZ-SAL A, 2003, ECOL MODEL","ISI000186021400008","ASSESSING LANDSCAPE VALUES: A PROPOSAL FOR A MULTIDIMENSIONAL CONCEPTUAL MODEL","TO EVALUATE A SPECIFIC FORM OF RESOURCE MANAGEMENT, FOR EXAMPLE, THE MAINTENANCE OF VALUABLE CULTURAL LANDSCAPES, THE CONTRIBUTIONS OF MANY DIFFERENT VIEWPOINTS MUST BE CONSIDERED. IN THIS PAPER, A MODEL FOR ASSESSING AND INTEGRATING THE DIFFERENT ASPECTS CONTRIBUTING TO LANDSCAPE EVALUATION IS PROPOSED. SOME RESULTS OF ITS USE IN LANDSCAPE ASSESSMENT IN THE MADRID REGION (CENTRAL SPAIN) ARE DISCUSSED. THE MODEL TAKES INTO ACCOUNT FIVE ASSESSMENT DIMENSIONS WHICH ARE CONSIDERED TO BE INDEPENDENT-THE ECOLOGICAL, PRODUCTIVE, ECONOMIC, SOCIAL AND CULTURAL EVALUATIVE SYSTEMS AND IT RECOGNISES AND ASSUMES CONFLICTS AND TRADE-OFFS BETWEEN THESE COMPONENTS. THE INCLUSION OF THE PRODUCTION SYSTEM AS AN INDEPENDENT ASSESSMENT DIMENSION IS ORIGINAL AND IS JUSTIFIED BECAUSE IT IS THE LINK THAT CONNECTS THE ECOLOGICAL AND ECONOMIC SYSTEMS. SINCE THIS DIMENSION ACTS MOST DIRECTLY ON THE ECOSYSTEM, THE PRODUCTION SYSTEM INCLUDES THE ATTRIBUTE OF ECOLOGICAL OR STRONG (IN THE SENSE OF [FOR THE COMMON GOOD, BEACON PRESS, BOSTON, 19941) SUSTAINABILITY. THE EVALUATION METHOD PLACES SPECIAL EMPHASIS ON DEFINING A CONCEPTUAL FRAMEWORK, AND FROM THIS DEFINES SCENARIOS IN COMPARISON WITH WHICH PARTICULAR DEVELOPMENT MODELS (LANDSCAPE PLANNING, RESOURCES MANAGEMENT) CAN BE EVALUATED. SEVEN SCENARIOS, COMING FROM A HYPOTHETICAL, TRADITIONAL SUSTAINABLE SCENARIO OF RESOURCES MANAGEMENT, ARE DEFINED. ONE OF THESE, THE SOUND SUSTAINABLE SCENARIO, IS DEFENDED AS THE ONLY ONE VIABLE IN THE LONG TERM, PARTICULARLY IN DEVELOPING COUNTRIES. THIS METHOD WAS EMPLOYED TO EVALUATE THE AGRICULTURAL AND NATURAL LANDSCAPE OF THE MADRID REGION MUNICIPALITIES. THE MULTIVARIATE APPROACH ADOPTED WAS BASED ON THE SELECTION OF INDICATOR SETS FOR EACH EVALUATIVE DIMENSION. THE STRUCTURE OF RELATIONSHIPS AMONG INDICATORS WAS THEN ANALYSED SEPARATELY FOR EACH DIMENSION AND VALUES ASSIGNED TO THE MUNICIPALITIES ACCORDING TO THEIR POSITION ON THE MAIN AXES OF THE MULTIVARIATE ANALYSES. EACH MUNICIPALITY WAS ASSIGNED TO ONE OF THE SEVEN DEVELOPMENT SCENARIOS BY MEANS OF DISCRIMINANT ANALYSIS. THE APPROACH'S GREATEST ASSETS ARE ITS FLEXIBILITY IN THE SELECTION OF THE INDICATORS AND THE EFFICACY IN ITS MONITORING AND COMPARISON OF THE DIFFERENT ANALYSED CASES ONCE A RIGOROUS CONCEPTUAL FRAMEWORK WAS ESTABLISHED. THE PAPER DISCUSSES THE CONDITIONS FOR THE SUSTAINABILITY OF THE HUMAN ACTIVITIES AND PROVIDES A METHOD FOR EVALUATING AND COMPARING SCENARIOS OF RESOURCES MANAGEMENT. (C) 2003 PUBLISHED BY ELSEVIER SCIENCE B.V.",""
"69","Land","HUBACEK K, 2003, ECOL ECON","ISI000181427100010","APPLYING PHYSICAL INPUT-OUTPUT ANALYSIS TO ESTIMATE LAND APPROPRIATION (ECOLOGICAL FOOTPRINTS) OF INTERNATIONAL TRADE ACTIVITIES","IN THE LAST FEW YEARS SOME STUDIES HAVE BEEN PRESENTED, WHICH LINK LAND USE ACCOUNTING AND INPUT-OUTPUT ANALYSIS (BASED ON MONETARY INPUT-OUTPUT TABLES (MIOTS)) FOR THE CALCULATION OF DIRECT AND INDIRECT LAND APPROPRIATION OF PRODUCTION AND CONSUMPTION ACTIVITIES. THE COMPILATION OF THE FIRST COMPREHENSIVE PHYSICAL INPUT-OUTPUT TABLES (PIOTS) FOR SOME WESTERN EUROPEAN COUNTRIES IN THE 1990S OPENED NEW POSSIBILITIES FOR LINKING PHYSICAL ACCOUNTING AND INPUT-OUTPUT ANALYSIS. USING A PHYSICAL MULTIPLIER FOR THIS KIND OF CALCULATION IS MORE APPROPRIATE, AS THE MOST LAND INTENSIVE SECTORS ARE ALSO THE SECTORS WITH THE HIGHEST AMOUNTS OF MATERIAL FLOWS. PHYSICAL INPUT-OUTPUT ANALYSIS ILLUSTRATES LAND APPROPRIATION IN RELATION TO MATERIAL FLOWS OF EACH OF THE SECTORS, WHICH IS MORE APPROPRIATE FROM THE POINT OF VIEW OF ENVIRONMENTAL PRESSURES THAN LAND APPROPRIATION IN RELATION TO MONETARY FLOWS OF A MIOT. PHYSICAL INPUT-OUTPUT ANALYSIS HAS SO FAR NOT BEEN APPLIED FOR ANY LAND-RELATED STUDIES. BASED ON A PHYSICAL INPUT-OUTPUT MODEL OF THE EU-15, PHYSICAL INPUT-OUTPUT ANALYSIS IS APPLIED IN THIS PAPER, IN ORDER TO CALCULATE DIRECT AND INDIRECT LAND REQUIREMENTS FOR THE PRODUCTION OF EXPORTS FROM EU-15 TO THE REST OF THE WORLD. (C) 2002 ELSEVIER SCIENCE B.V. ALL RIGHTS RESERVED.",""
"70","Land","KLINE JD, 2003, LANDSC ECOL","ISI000185919200001","MODELING THE SPATIALLY DYNAMIC DISTRIBUTION OF HUMANS IN THE OREGON (USA) COAST RANGE","A COMMON APPROACH TO LAND USE CHANGE ANALYSES IN MULTIDISCIPLINARY LANDSCAPE-LEVEL STUDIES IS TO DELINEATE DISCRETE FOREST AND NON-FOREST OR URBAN AND NON-URBAN LAND USE CATEGORIES TO SERVE AS INPUTS INTO SETS OF INTEGRATED SUB-MODELS DESCRIBING SOCIOECONOMIC AND ECOLOGICAL PROCESSES. SUCH DISCRETE LAND USE CATEGORIES, HOWEVER, MAY BE INAPPROPRIATE WHEN THE SOCIOECONOMIC AND ECOLOGICAL PROCESSES UNDER STUDY ARE SENSITIVE TO A RANGE OF HUMAN HABITATION. IN THIS PAPER, WE CHARACTERIZE THE SPATIAL DYNAMIC DISTRIBUTION OF HUMANS THROUGHOUT THE FOREST LANDSCAPE OF WESTERN OREGON (USA). WE DEVELOP AN EMPIRICAL MODEL DESCRIBING THE SPATIAL DISTRIBUTION AND RATE OF CHANGE IN HISTORIC BUILDING DENSITIES AS A FUNCTION OF A GRAVITY INDEX OF DEVELOPMENT PRESSURE, EXISTING BUILDING DENSITIES, SLOPE, ELEVATION, AND EXISTING LAND USE ZONING. WE USE THE EMPIRICAL MODEL TO PROJECT CHANGES IN BUILDING DENSITIES THAT ARE APPLIED TO A 1995 BASE MAP OF BUILDING DENSITY TO DESCRIBE FUTURE SPATIAL DISTRIBUTIONS OF BUILDINGS OVER TIME. THE PROJECTED BUILDING DENSITY MAPS SERVE AS INPUTS INTO A MULTIDISCIPLINARY LANDSCAPE-LEVEL ANALYSIS OF SOCIOECONOMIC AND ECOLOGICAL PROCESSES IN OREGON'S COAST RANGE MOUNTAINS.",""
"71","Land","CZECH B, 2002, CONSERV BIOL","ISI000179420100010","A TRANSDISCIPLINARY APPROACH TO CONSERVATION LAND ACQUISITION","LAND ACQUISITION IS ONE OF THE KEYS TO BIODIVERSITY CONSERVATION, AND IT IS A TRANSDISCIPLINARY ENDEAVOR REQUIRING CONSIDERATION OF NATURAL AND SOCIAL PHENOMENA. I INTEGRATED PRINCIPLES OF CONSERVATION BIOLOGY, ECOLOGICAL ECONOMICS, AND POLITICAL SCIENCE TO OUTLINE AN APPROACH TO CONSERVATION LAND ACQUISITION IN THE UNITED STATES. AMERICAN POLITICAL ECONOMY, ESPECIALLY, HAS PROFOUND IMPLICATIONS FOR CONSERVATION LAND ACQUISITION, YET THESE IMPLICATIONS HAVE BEEN LARGELY NEGLECTED BY PUBLIC LAND CONSERVATION AGENCIES. I DERIVED THREE GENERAL RECOMMENDATIONS FOR THE CONSERVATION OF BIODIVERSITY VIA LAND ACQUISITION: ( 1) RELATIVELY INEXPENSIVE LANDS IN RELATIVELY INTACT ECOSYSTEMS SHOULD BE PRIORITIZED FOR ACQUISITION, ( 2) FEE-TITLE ACQUISITION SHOULD BE FAVORED OVER EASEMENT ACQUISITION, AND ( 3) LOW-LYING COASTAL PROPERTIES SHOULD RECEIVE LOWER PRIORITY. THESE RECOMMENDATIONS CONTRIBUTE TO AN ECOLOGICALLY MACROECONOMIC APPROACH TO CONSERVATION LAND ACQUISITION, AND EACH WILL BECOME MORE APPROPRIATE AS THE SIZES OF THE U. S. AND GLOBAL ECONOMIES INCREASE. ULTIMATELY, HOWEVER, THE CONSERVATION OF BIODIVERSITY WILL REQUIRE A NEW POLITICAL ECONOMY PREDICATED ON SUSTAINABILITY RATHER THAN GROWTH.",""
"72","Land","PIETERSE NM, 2002, LANDSC ECOL","ISI000176041000007","A DECISION SUPPORT SYSTEM FOR RESTORATION PLANNING OF STREAM VALLEY ECOSYSTEMS","DESPITE EFFORTS THAT HAVE BEEN PUT INTO CONSERVATION, THERE IS A CONTINUING LOSS OF SPECIES AND ECOSYSTEMS IN WESTERN EUROPE. THERE IS A GROWING AWARENESS THAT RESTORATION IS AN ESSENTIAL STEP TO STOP THIS TIDE. UNFORTUNATELY, THERE IS LACK OF UNDERSTANDING ABOUT THE MULTITUDE OF FUNCTIONS AND THE COMPLEXITY OF SPATIAL INTERACTIONS IN A LANDSCAPE. THE FOCUS OF THIS PAPER IS TO DEMONSTRATE THAT AN INTEGRATED DECISION SUPPORT SYSTEM (IDSS) IS INDISPENSABLE TO OFFER INSIGHT IN THIS COMPLEXITY AND TO DESIGN EFFICIENT RESTORATION PROGRAMMES. THE IDSS IS APPLIED IN A LOWLAND CATCHMENT ON THE BORDER BETWEEN THE NETHERLANDS AND BELGIUM AND LEADS TO THE FOLLOWING RECOMMENDATIONS: (1) THE SITE CONDITIONS ON THE LOCATION WHERE RESTORATION IS PLANNED MUST BE CLOSE TO THE RANGE THAT IS REQUIRED FOR THE TARGET ECOSYSTEM. (2) THE MANAGER HAS TO DECIDE FOR THE MOST ATTAINABLE TARGETECOSYSTEM, AND ACCEPT THE INEVITABLE LOSS OF OTHER ECOSYSTEMS AS A RESULT FROM THIS CHOICE. (3) RESTORATION PLANNING INVOLVES THAT THE OPTIMAL MEASURE FOR EACH CATCHMENT, SUBCATCHMENT OR REGION IS ASSESSED, BEING ECOLOGICAL, URBAN OR AGRICULTURAL. (4) FOR EACH ECOSYSTEM AN OPTIMAL SET OF MEASURES MUST BE SELECTED. AN ANALYSIS OF THE RESTORATION EFFICIENCY (ECOLOGICAL GAIN DIVIDED BY ECONOMIC COSTS) IS CRUCIAL FOR THIS SELECTION.",""
"73","Land","CASKIE P, 2001, J RURAL STUD","ISI000172935100007","TARGETING DISADVANTAGE IN AGRICULTURE","THE EFFECTIVENESS OF THE MAIN POLICY INSTRUMENT TARGETING SUPPORT AT FARMERS IN DISADVANTAGED AREAS OF THE UK FROM 1976 TO 2000 (THE HILL LIVESTOCK COMPENSATORY ALLOWANCE SCHEME) IS EVALUATED FOR NORTHERN IRELAND, USING RECURSIVE LINEAR PROGRAMMING MODELS AND INPUT-OUTPUT ANALYSIS. CAPITAL. INCOME AND EMPLOYMENT EFFECTS OF THE SCHEME IN ITS LATTER YEARS ARE ESTIMATED AND ASSESSED AGAINST DECLARED POLICY OBJECTIVES. IT IS ESTIMATED THAT AVERAGE FARM CASH INCOMES WOULD HAVE BEEN BETWEEN 17 AND 31 PER CENT LOWER IN THE ABSENCE OF HLCA PAYMENTS, WHILE FARMER NET WORTH WOULD HAVE FALLEN BY APPROXIMATELY I PER CENT ANNUALLY. IN AGGREGATE, SOME 1000 JOBS WERE SUSTAINED BY THE SCHEME AND INCOMES AND PROFITS IN THE REGION WERE BOOSTED BY POUND9 MILLION EACH YEAR. THE MAIN ECONOMIC EFFECT ARISING FROM THE INTRODUCTION OF A SUCCESSOR AREA-BASED SUBSIDY, WILL BE A REDISTRIBUTION OF PAYMENTS FROM FARMS WITH RELATIVELY HIGH STOCKING RATES (PREDOMINANTLY LARGER UNITS) TO THOSE OPERATING MORE EXTENSIVELY (MOSTLY SMALLER, PART-TIME FARMS). (C) 2001 ELSEVIER SCIENCE LTD. ALL RIGHTS RESERVED.",""
"74","Land","FISCHER G, 2001, AGRIC ECOSYST ENVIRON","ISI000169062400011","MODEL BASED ANALYSIS OF FUTURE LAND-USE DEVELOPMENT IN CHINA","THE RECOGNITION THAT LAND-USE CHANGES ARE DIRECTLY LINKED WITH ECONOMIC DECISIONS HAS LED THE LAND USE CHANGE (LUC) PROJECT AT THE INTERNATIONAL INSTITUTE FOR APPLIED SYSTEMS ANALYSIS (IIASA) TO ADOPT AN ECONOMIC FRAMEWORK AS THE ORGANIZING PRINCIPLE OF ITS MODELING EFFORTS. THIS PAPER DISCUSSES THREE COMPLEMENTARY APPROACHES USED FOR ANALYZING AND PROJECTING REGIONAL LAND USE IN CHINA. FIRST, AN ENHANCED AGRO-ECOLOGICAL ZONES (AEZ) ASSESSMENT MODEL PROVIDES A SPATIALLY EXPLICIT MEASURE OF PRODUCTION POTENTIALS FOR AGRICULTURAL LAND USES. NEXT, LAND-USE CHANGE SCENARIOS ARE ASSESSED WITH AN EXTENDED INPUT-OUTPUT MODEL OF CHINA'S ECONOMY. FINALLY, WE INDICATE HOW LAND-USE POLICY ALTERNATIVES CAN ADEQUATELY BE ANALYZED IN A MULTI-REGION ECONOMIC FRAMEWORK USING OPTIMIZATION WHEN AN AEZ-BASED REPRESENTATION OF CLIMATE AND BIOPHYSICAL CONDITIONS IS INCORPORATED IN THE MODEL SPECIFICATION. THE ANALYSIS MAKES A STRONG APPEAL FOR SUSTAINING EFFORTS THAT CAN FURNISH RAPID TECHNOLOGICAL PROGRESS IN LAND-BASED SECTORS, AND IT SUGGESTS THAT AN INCREASE OF GRAIN IMPORTS TO ABOUT 10-15\% OF CHINA'S CURRENT TOTAL GRAIN OUTPUT WOULD GREATLY REDUCE THE PRESSURE ON CROPLAND AND WATER RESOURCES, ESPECIALLY IN THE NORTHERN HALF OF THE COUNTRY. (C) 2001 ELSEVIER SCIENCE B.V. ALL RIGHTS RESERVED.",""
