"","TOPIC","AUTHOR","UID","TITLE","ABSTRACT","NOTES"
"119","Land","ALEXANDER P, 2018, GLOB CHANGE BIOL","ISI000437281500006","ADAPTATION OF GLOBAL LAND USE AND MANAGEMENT INTENSITY TO CHANGES IN CLIMATE AND ATMOSPHERIC CARBON DIOXIDE","LAND USE CONTRIBUTES TO ENVIRONMENTAL CHANGE, BUT IS ALSO INFLUENCED BY SUCH CHANGES. CLIMATE AND ATMOSPHERIC CARBON DIOXIDE (CO2) LEVELS' CHANGES ALTER AGRICULTURAL CROP PRODUCTIVITY, PLANT WATER REQUIREMENTS AND IRRIGATION WATER AVAILABILITY. THE GLOBAL FOOD SYSTEM NEEDS TO RESPOND AND ADAPT TO THESE CHANGES, FOR EXAMPLE, BY ALTERING AGRICULTURAL PRACTICES, INCLUDING THE CROP TYPES OR INTENSITY OF MANAGEMENT, OR SHIFTING CULTIVATED AREAS WITHIN AND BETWEEN COUNTRIES. AS IMPACTS AND ASSOCIATED ADAPTATION RESPONSES ARE SPATIALLY SPECIFIC, UNDERSTANDING THE LAND USE ADAPTATION TO ENVIRONMENTAL CHANGES REQUIRES CROP PRODUCTIVITY REPRESENTATIONS THAT CAPTURE SPATIAL VARIATIONS. THE IMPACT OF VARIATION IN MANAGEMENT PRACTICES, INCLUDING FERTILISER AND IRRIGATION RATES, ALSO NEEDS TO BE CONSIDERED. TO DATE, MODELS OF GLOBAL LAND USE HAVE SELECTED AGRICULTURAL EXPANSION OR INTENSIFICATION LEVELS USING RELATIVELY AGGREGATE SPATIAL REPRESENTATIONS, TYPICALLY AT A REGIONAL LEVEL, THAT ARE NOT ABLE TO CHARACTERISE THE DETAILS OF THESE SPATIALLY DIFFERENTIATED RESPONSES. HERE, WE SHOW RESULTS FROM A NOVEL GLOBAL MODELLING APPROACH USING MORE DETAILED BIOPHYSICALLY DERIVED YIELD RESPONSES TO INPUTS WITH GREATER SPATIAL SPECIFICITY THAN PREVIOUSLY POSSIBLE. THE APPROACH COUPLES A DYNAMIC GLOBAL VEGETATIVE MODEL (LPJ-GUESS) WITH A NEW LAND USE AND FOOD SYSTEM MODEL (PLUMV2), WITH RESULTS BENCHMARKED AGAINST HISTORICAL LAND USE CHANGE FROM 1970. LAND USE OUTCOMES TO 2100 WERE EXPLORED, SUGGESTING THAT INCREASED INTENSITY OF CLIMATE FORCING REDUCES THE INPUTS REQUIRED FOR FOOD PRODUCTION, DUE TO THE FERTILISATION AND ENHANCED WATER USE EFFICIENCY EFFECTS OF ELEVATED ATMOSPHERIC CO2 CONCENTRATIONS, BUT REQUIRING SUBSTANTIAL SHIFTS IN THE GLOBAL AND LOCAL PATTERNS OF PRODUCTION. THE RESULTS SUGGEST THAT ADAPTATION IN THE GLOBAL AGRICULTURE AND FOOD SYSTEM HAS SUBSTANTIAL CAPACITY TO DIMINISH THE NEGATIVE IMPACTS AND GAIN GREATER BENEFITS FROM POSITIVE OUTCOMES OF CLIMATE CHANGE. CONSEQUENTLY, AGRICULTURAL EXPANSION AND INTENSIFICATION MAY BE LOWER THAN FOUND IN PREVIOUS STUDIES WHERE SPATIAL DETAILS AND PROCESSES CONSIDERATION WERE MORE CONSTRAINED.",""
"120","Land","WU XD, 2018, LAND USE POL","ISI000435619900021","AN OVERVIEW OF ARABLE LAND USE FOR THE WORLD ECONOMY: FROM SOURCE TO SINK VIA THE GLOBAL SUPPLY CHAIN","AS AN EXTENSION OF A PREVIOUS WORK (CHEN AND HAN, 2015A), THIS STUDY EXPLORED THE ARABLE LAND USE OF THE WORLD ECONOMY FROM SOURCE OF EXPLOITATION TO SINK OF FINAL CONSUMPTION VIA THE GLOBAL SUPPLY CHAIN, BY MEANS OF EMBODIMENT ACCOUNTING THAT INCLUDES THE INDIRECT FEEDBACKS ASSOCIATED WITH BOTH INTERMEDIATE AND PRIMARY INPUTS. IN MAGNITUDE, THE GLOBAL TRANSFER OF ARABLE LAND USE IS ESTIMATED TO BE AROUND 40\% OF THE TOTAL DIRECT EXPLOITATION. THE CONNECTIONS AS WELL AS IMBALANCES OF MAJOR ECONOMIES IN INTERMEDIATE AND FINAL TRADES OF ARABLE LAND USE ARE DISCUSSED. CANADA, AUSTRALIA, ARGENTINA, PAKISTAN AND AFRICAN REGIONS TURN OUT TO HAVE A MASSIVE DEFICIT OF ARABLE LAND USE IN BOTH INTERMEDIATE AND FINAL TRADES. IN CONTRAST, THE UNITED STATES, JAPAN, MAINLAND CHINA, THE UNITED KINGDOM, GERMANY AND FRANCE OBTAIN A SURPLUS OF ARABLE LAND USE IN BOTH INTERMEDIATE AND FINAL TRADES BY LAND DISPLACEMENT IN THOSE NET EXPORTERS. INDICES IN TERMS OF ARABLE LAND USE SELF-SUFFICIENCY RATE BY SOURCE AND THAT BY SINK ARE DEVISED. FOR INDIA AS THE BIGGEST SOURCE REGION, AROUND 20\% OF THE ARABLE LAND RESOURCES EXPLOITED LOCALLY ARE FOR FINAL CONSUMPTION ABROAD. FOR THE UNITED STATES AS THE LARGEST SINK REGION, AROUND 40\% OF ITS ARABLE LAND USE ORIGINATES FROM FOREIGN REGIONS LED BY CANADA. FOR JAPAN AS THE BIGGEST NET IMPORTER IN BOTH INTERMEDIATE AND FINAL TRADES, OVER 90\% OF ITS ARABLE LAND USE COMES FROM FOREIGN ECONOMIES LED BY AFRICAN AND ASIAN REGIONS. FOR SUSTAINED DEVELOPMENT, REGIONS ARE SUGGESTED TO BE MORE ADAPTED TO THE GLOBAL SUPPLY CHAIN BASED ON THEIR BEHAVIORS IN BOTH INTERMEDIATE AND FINAL TRADES OF ARABLE LAND USE.",""
"121","Land","ENGEL M, 2018, GEOSCIENCES","ISI000445150300015","MIGRATION OF BARCHAN DUNES IN QATAR-CONTROLS OF THE SHAMAL, TELECONNECTIONS, SEA-LEVEL CHANGES AND HUMAN IMPACT","BARCHAN DUNE FIELDS ARE A DOMINANT LANDSCAPE FEATURE IN SE QATAR AND A KEY ELEMENT OF THE PENINSULA'S GEODIVERSITY. THE MIGRATION OF BARCHAN DUNES IS MAINLY CONTROLLED BY DUNE SIZE, WIND PATTERNS, VEGETATION COVER AND HUMAN IMPACT. WE INVESTIGATE THE VARIABILITY OF DUNE MIGRATION IN QATAR OVER A TIME PERIOD OF 50 YEARS USING HIGH-RESOLUTION SATELLITE AND AERIAL IMAGERY. WE THEN EXPLORE ITS RELATION TO THE REGIONAL SHAMAL WIND SYSTEM, TELECONNECTION PATTERNS, AND LIMITATIONS IN SAND SUPPLY ASSOCIATED WITH THE TRANSGRESSION OF THE ARABIAN GULF. STRONG SIZE-DEPENDENT DIFFERENCES IN MIGRATION RATES OF INDIVIDUAL DUNES AS WELL AS SIGNIFICANT DECADAL VARIABILITY ON A DUNE-FIELD SCALE ARE DETECTED, WHICH ARE FOUND TO CORRELATE WITH THE INTENSITY OF THE NORTH ATLANTIC OSCILLATION (NAO) AND THE INDIAN SUMMER MONSOON (ISM), IN PARTICULAR DURING YEARS OF RELATIVELY STRONG (WEAK) SUMMER SHAMALS. HIGH UNCERTAINTIES ASSOCIATED WITH THE EXTRAPOLATION OF MIGRATION RATES BACK INTO THE HOLOCENE, HOWEVER, DO NOT PERMIT FURTHER EXAMINATION OF THE TIMING OF THE LOSS OF SAND SUPPLY AND THE ONSET OF THE MID-HOLOCENE RELATIVE SEA-LEVEL (RSL) HIGHSTAND. FOR THE YOUNGEST PHASE CONSIDERED IN THIS STUDY (2006-2015), HUMAN IMPACT HAS LIKELY ACCELERATED DUNE MIGRATION UNDER A WEAKENING SHAMAL REGIME THROUGH SAND MINING AND EXCESSIVE VEHICLE TRAFFIC UPWIND OF THE CORE STUDY AREA.",""
"122","Land","MCCORD P, 2018, APPL GEOGR","ISI000436053300003","THE TELECOUPLING GEOAPP: A WEB-GIS APPLICATION TO SYSTEMATICALLY ANALYZE TELECOUPLINGS AND SUSTAINABLE DEVELOPMENT","GLOBAL CHALLENGES, SUCH AS CHRONIC HUNGER IN DEVELOPING AND DEVELOPED REGIONS, LOSS OF WILDLIFE HABITAT, AND THE CONTINUING RISE OF GREENHOUSE GAS EMISSIONS FROM HUMAN ACTIVITIES, CAN BE ADDRESSED ONLY THROUGH AN INTEGRATED APPROACH. THE TELECOUPLING CONCEPT IS ONE SUCH APPROACH: IT EXPLORES SOCIOECONOMIC AND ENVIRONMENTAL INTERACTIONS AMONG COUPLED HUMAN-NATURAL SYSTEMS OVER DISTANCES. THE TELECOUPLING FRAMEWORK IS THEREFORE WELL POSITIONED TO PROVIDE NEW INSIGHTS TO PERSISTENT GLOBAL SUSTAINABILITY CHALLENGES. TO OPERATIONALIZE THE FRAMEWORK, WE HAVE DEVELOPED THE TELECOUPLING GEOAPP, A NEW WEB-BASED COMPONENT OF THE TELECOUPLING TOOLBOX THAT PROVIDES RESEARCHERS AND PRACTITIONERS WITH A USEFUL PLATFORM TO ADDRESS GLOBALLY IMPORTANT ISSUES SUCH AS INTERNATIONAL TRADE, SPECIES INVASION, BIODIVERSITY CONSERVATION, AND LAND-USE CHANGE. THE GEOAPP FEATURES MAPPING AND GEOSPATIAL ANALYSIS TOOLS TO VISUALIZE AND QUANTIFY THE FIVE MAJOR INTERRELATED COMPONENTS OF THE TELECOUPLING FRAMEWORK (SYSTEMS, FLOWS, AGENTS, CAUSES, AND EFFECTS). IN THIS PAPER, WE DEMONSTRATE THE GEOAPP'S FUNCTIONALITY BY APPLYING IT TO A CASE STUDY IN WHICH DISTANT SYSTEMS INTERACT ACROSS SPACE AND TIME: THE BRAZIL CHINA SOYBEAN TELECOUPLING. WE CONCLUDE BY HIGHLIGHTING THE ADVANTAGES OF THE TELECOUPLING GEOAPP IN ADDRESSING GLOBAL SUSTAINABILITY CHALLENGES. IT IS OUR HOPE THAT THIS WEB APPLICATION WILL BE VALUABLE TO A RANGE OF USERS EXPLORING TELECOUPLINGS AND OUTCOMES ACROSS DISTANT COUPLED HUMAN-NATURAL SYSTEMS FOR ACHIEVING SUSTAINABLE DEVELOPMENT GOALS.",""
"123","Land","YAO G, 2018, GLOB ENVIRON CHANGE-HUMAN POLICY DIMENS","ISI000436223800016","ECONOMIC DRIVERS OF TELECOUPLING AND TERRESTRIAL CARBON FLUXES IN THE GLOBAL SOYBEAN COMPLEX","TELECOUPLING IS A NOVEL CONCEPT DESCRIBING SIMULTANEOUS MULTISCALE INTERACTIONS BETWEEN HUMAN AND NATURAL SYSTEMS ACROSS LONG DISTANCES. ONE IMPORTANT VEHICLE FOR TELECOUPLING IS INTERNATIONAL AGRICULTURAL TRADE, WHICH HAS PREVIOUSLY BEEN ADDRESSED USING MULTIREGIONAL INPUT-OUTPUT (MRIO) METHODS. THIS STUDY ADVANCES THAT WORK BY ACCOUNTING FOR MARKET-MEDIATING FACTORS BASED ON THE GTAP-BIO MODEL. WE APPLY THIS FRAMEWORK TO ANALYZE THE ECONOMIC AND ENVIRONMENTAL CONSEQUENCES OF THE BRAZILIAN SOYBEAN BOOM. WE DECOMPOSE THE DRIVERS OF THIS TELECOUPLED SYSTEM INTO FIVE GROUPS - MACROECONOMIC GROWTH, SOYBEAN PRODUCTIVITY, OTHER CROP PRODUCTIVITY, GOVERNMENT POLICIES, AND PASTURE AND FORESTRY FACTORS - QUANTIFYING EACH SOCIO-ECONOMIC DRIVER'S LOCAL AND DISTANT CONTRIBUTIONS TO ALL HUMAN AND NATURAL CHANGES IN THIS SYSTEM. WE FIND THAT CHINA'S MACROECONOMIC GROWTH BOOSTED SOYBEAN PRODUCTION AND EXPORTS FROM BRAZIL AND THE US, WHEREAS MACROECONOMIC GROWTH IN THE LATTER TWO REGIONS ACTUALLY DAMPENED SOYBEAN EXPORTS OVER THE 2004-2011 PERIOD UNDER EXAMINATION. BRAZIL'S STRONG SOYBEAN PRODUCTIVITY GROWTH OVER THIS PERIOD, ALLOWED THAT COUNTRY TO BECOME DOMINANT IN THE GLOBAL SOYBEAN MARKET. IT ALSO HAD STRONG SPILLOVER EFFECTS, DISPLACING THE US IN THE CHINESE MARKET AND REDUCING OVERALL GROWTH IN SOYBEAN OUTPUT IN THE US. THIS STRONG SOYBEAN PRODUCTIVITY GROWTH ALSO CONTRIBUTED TO CROPLAND EXPANSION IN BRAZIL.",""
"124","Land","OPPON E, 2018, ECOL ECON","ISI000428008000037","MODELLING MULTI-REGIONAL ECOLOGICAL EXCHANGES: THE CASE OF UK AND AFRICA","AS ENVIRONMENTAL IMPACTS CONTINUE TO RISE, THE NEED TO IDENTIFY AND QUANTIFY THE UNDERLYING CAUSES OF THESE IMPACTS HAS PROMPTED IMPORTANT RESEARCH QUESTIONS. THIS IS HEIGHTENED BY THE FACT THAT THE PRODUCTION OF GOODS AND SERVICES IS BECOMING INCREASINGLY GLOBAL WITH COUNTRIES RELYING ON EACH OTHER THROUGH TRADE. AS SUCH, IT IS IMPORTANT TO HAVE A MECHANISM IN PLACE TO UNDERSTAND THE ENVIRONMENTAL BURDEN SHIFTS FROM ONE COUNTRY TO ANOTHER. TO THIS END, THIS PAPER EXPLOITS A PARADOX IN GLOBAL ENVIRONMENTAL ANALYSIS, WHICH STEMS FROM A FALSE DECOUPLING BETWEEN ECONOMIC AND PRODUCTION SYSTEMS AS OBSERVED IN MOST DEVELOPED NATIONS, WHICH RESULTS IN IMPROVED TERRITORIAL EMISSIONS OF THESE DEVELOPED COUNTRIES AT THE EXPENSE OF DEVELOPING COUNTRIES. ECOLOGICAL UNEQUAL EXCHANGE IS ONE SUCH CONTEMPORARY ECOLOGICAL ECONOMIC CONCEPT THAT IS USED TO HIGHLIGHT SUCH ASYMMETRIC TRANSFER OF EMBODIED NATURAL RESOURCES AND BIOPHYSICAL INDICATORS BETWEEN COUNTRIES. ATTEMPTS AT ENVIRONMENTAL IMPACTS REDUCTION EFFORTS HAS LARGELY FOCUSED ON CARBON EMISSIONS BUT GIVEN THE COMPLEX SUPPLY CHAIN CREATED THROUGH GLOBALISATION AND INTERNATIONAL TRADE, IT IS IMPORTANT TO CONSIDER OTHER IMPORTANT METRICS SUCH AS LAND AND WATER USE ALONGSIDE CARBON EMISSIONS TO DRIVE ENVIRONMENTAL POLICIES THAT WILL HOLISTICALLY ADDRESS ECOLOGICALLY UNEQUAL EXCHANGES. FOR DEVELOPING COUNTRIES IN AFRICA WHERE THE DEPENDENCE ON LAND USE AND WATER USE FOR AGRICULTURAL ACTIVITIES ARE CRUCIAL TO THE DEVELOPMENT OF NATIONAL ECONOMIES AND IN COMBATING POVERTY, AN ASSESSMENT OF THESE METRICS HAS BECOME EVEN MORE PARAMOUNT. AGAINST THIS BACKDROP, THE CURRENT WORK DRAWS UPON THE THEORETICAL CONSTRUCTS OF MULTI-REGIONAL INPUT-OUTPUT (MRIO) FRAMEWORK TO TRACE COUNTRY SPECIFIC SECTORIAL-LEVEL FLOWS OF THE AFOREMENTIONED METRICS BETWEEN A REPRESENTATIVE DEVELOPED NATION, UK, AND 27 AFRICAN REGIONS IN ORDER TO FULLY EXAMINE THEIR ECOLOGICAL EXCHANGES. KEY FINDINGS IN THE STUDY SUGGEST THAT FOR WATER CONSUMPTION AND LAND USE, THERE IS A NET EXTERNALISATION OF THESE IMPACTS FOR ALL THE 27 AFRICAN REGIONS BY THE UK. IT WAS ALSO DETERMINED THAT THE EXTENT OF THE IMBALANCE BETWEEN THE UK AND THE AFRICAN REGION IS EXCEEDINGLY FAR GREATER FOR WATER CONSUMPTION. IT IS RECOMMENDED THAT IN FORMULATING A ROBUST MULTI-NATIONAL ENVIRONMENTAL POLICY WHERE SO MANY FACTORS ARE AT PLAY, COUNTRY SPECIFIC AND INDUSTRY TARGETED APPROACH TO ECOLOGICAL UNEQUAL EXCHANGE BETWEEN NATIONS PROVIDES BETTER AND IMPROVED INSIGHT INTO ADDRESSING ENSUING ENVIRONMENTAL ISSUES.",""
"125","Land","YUAN X, 2018, GEOPHYS RES LETT","ISI000428402400028","A FIRST LOOK AT DECADAL HYDROLOGICAL PREDICTABILITY BY LAND SURFACE ENSEMBLE SIMULATIONS","THE PREDICTION OF TERRESTRIAL HYDROLOGY AT THE DECADAL SCALE IS CRITICAL FOR MANAGING WATER RESOURCES IN THE FACE OF CLIMATE CHANGE. HERE WE CONDUCTED AN ASSESSMENT BY GLOBAL LAND MODEL SIMULATIONS FOLLOWING THE DESIGN OF THE FIFTH COUPLED MODEL INTERCOMPARISON PROJECT (CMIP5) DECADAL HINDCAST EXPERIMENTS, SPECIFICALLY TESTING FOR THE SENSITIVITY TO PERFECT INITIAL OR BOUNDARY CONDITIONS. THE MEMORY FOR TERRESTRIAL WATER STORAGE (TWS) IS LONGER THAN 6 YEARS OVER 11\% OF GLOBAL LAND AREAS WHERE THE DEEP SOIL MOISTURE AND AQUIFER WATER HAVE A LONG MEMORY AND A NONNEGLIGIBLE VARIABILITY. ENSEMBLE DECADAL PREDICTIONS BASED ON REALISTIC INITIAL CONDITIONS ARE SKILLFUL OVER 31\%, 43\%, AND 59\% OF GLOBAL LAND AREAS FOR TWS, DEEP SOIL MOISTURE, AND AQUIFER WATER, RESPECTIVELY. THE FRACTION OF SKILLFUL PREDICTIONS FOR TWS INCREASES BY 10\%-16\% WHEN CONDITIONED ON PACIFIC DECADAL OSCILLATION AND ATLANTIC MULTIDECADAL OSCILLATION INDICES. THIS STUDY PROVIDES A FIRST LOOK AT DECADAL HYDROLOGICAL PREDICTABILITY, WITH AN IMPROVED SKILL WHEN INCORPORATING LOW-FREQUENCY CLIMATE INFORMATION. PLAIN LANGUAGE SUMMARY DECADAL PREDICTION, WHICH WAS INITIALLY PROPOSED TO MORE ACCURATELY PROJECT NEAR-TERM (E.G., 10-30 YEARS) CLIMATE CHANGE BY USING THE EXPERIENCES IN WEATHER AND SEASONAL CLIMATE FORECASTING, HAS RAISED A WIDE CONCERN SINCE THE IPCC CMIP5 PROJECT. THE CLIMATE COMMUNITY IS NOW TRYING TO TRANSITION THE DECADAL PREDICTION FROM A PURE RESEARCH TO A QUASI-REAL-TIME OPERATIONAL EFFORT. HOWEVER, VERY LIMITED INFORMATION IS KNOWN ABOUT THE DECADAL HYDROLOGICAL PREDICTABILITY OVER LAND, WHICH IS MORE RELEVANT TO THE LIVELIHOOD AND STAKEHOLDERS. HERE WE COMBINE AN ENSEMBLE SIMULATION METHOD THAT IS WIDELY USED TO ASSESS SEASONAL HYDROLOGICAL PREDICTABILITY, WITH THE EXPERIMENTAL DESIGN OF THE CMIP5 DECADAL CLIMATE HINDCASTS, TO PROVIDE A FIRST LOOK AT DECADAL HYDROLOGICAL PREDICTABILITY AND SKILL BY CARRYING OUT OVER 2,000 YEARS GLOBAL LAND MODEL SIMULATIONS. WE FOUND SKILLFUL DECADAL PREDICTION FOR TERRESTRIAL WATER STORAGE OVER ONE THIRD LAND AREAS WHERE DEEP SOIL MOISTURE AND AQUIFER HAVE A NONNEGLIGIBLE VARIABILITY. AND THE SKILL CAN BE FURTHER ENHANCED BY INCORPORATING LOW-FREQUENCY TELECONNECTION INFORMATION FROM ATLANTIC AND PACIFIC OCEANS. THIS STUDY SUGGESTS THAT IT IS POSSIBLE TO PROVIDE WATER RESOURCES MANAGERS USEFUL HYDROLOGICAL FORECAST INFORMATION OVER ARID AND SEMIARID REGIONS A FEW YEARS OR EVEN A DECADE IN ADVANCE.",""
"126","Land","DANNENBERG MP, 2018, ENVIRON RES LETT","ISI000434848400001","ATMOSPHERIC TELECONNECTION INFLUENCE ON NORTH AMERICAN LAND SURFACE PHENOLOGY","SHORT-TERM FORECASTS OF VEGETATION ACTIVITY ARE CURRENTLY NOT WELL CONSTRAINED DUE LARGELY TO OUR LACK OF UNDERSTANDING OF COUPLED CLIMATE-VEGETATION DYNAMICS MEDIATED BY COMPLEX INTERACTIONS BETWEEN ATMOSPHERIC TELECONNECTION PATTERNS. USING ECOREGION-SCALE ESTIMATES OF NORTH AMERICAN VEGETATION ACTIVITY INFERRED FROM REMOTE SENSING (1982-2015), WE EXAMINED SEASONAL AND SPATIAL RELATIONSHIPS BETWEEN LAND SURFACE PHENOLOGY AND THE ATMOSPHERIC COMPONENTS OF FIVE TELECONNECTION PATTERNS OVER THE TROPICAL PACIFIC, NORTH PACIFIC, AND NORTH ATLANTIC. USING A SET OF REGRESSION EXPERIMENTS, WE ALSO TESTED FOR INTERACTIONS AMONG THESE TELECONNECTION PATTERNS AND ASSESSED PREDICTABILITY OF VEGETATION ACTIVITY SOLELY BASED ON KNOWLEDGE OF ATMOSPHERIC TELECONNECTION INDICES. AUTUMN-TO-WINTER COMPOSITES OF THE SOUTHERN OSCILLATION INDEX (SOI) WERE STRONGLY CORRELATED WITH START OF GROWING SEASON TIMING, ESPECIALLY IN THE PACIFIC NORTHWEST. THE TWO LEADING MODES OF NORTH PACIFIC VARIABILITY (THE PACIFIC-NORTH AMERICAN, PNA, AND WEST PACIFIC PATTERNS) WERE SIGNIFICANTLY CORRELATED WITH START OF GROWING SEASON TIMING ACROSS MUCH OF SOUTHERN CANADA AND THE UPPER GREAT LAKES. REGRESSION MODELS BASED ON THESE PACIFIC TELECONNECTIONS WERE SKILLFUL PREDICTORS OF SPRING PHENOLOGY ACROSS AN EAST-WEST SWATH OF TEMPERATE AND BOREAL NORTH AMERICA, BETWEEN 40 DEGREES N-60 DEGREES N. WHILE THE NORTH ATLANTIC OSCILLATION (NAO) WAS NOT STRONGLY CORRELATED WITH START OF GROWING SEASON TIMING ON ITS OWN, WE FOUND COMPELLING EVIDENCE OF WIDESPREAD NAO-SOI AND NAO-PNA INTERACTION EFFECTS. THESE RESULTS SUGGEST THAT KNOWLEDGE OF ATMOSPHERIC CONDITIONS OVER THE PACIFIC AND ATLANTIC OCEANS INCREASES THE PREDICTABILITY OF NORTH AMERICAN SPRING PHENOLOGY. A MORE ROBUST CONSIDERATION OF THE COMPLEXITY OF THE ATMOSPHERIC CIRCULATION SYSTEM, INCLUDING INTERACTIONS ACROSS MULTIPLE OCEAN BASINS, IS AN IMPORTANT STEP TOWARDS ACCURATE FORECASTS OF VEGETATION ACTIVITY.",""
"127","Land","VADJUNEC JM, 2018, LAND","ISI000428560100025","A LAND SYSTEMS SCIENCE FRAMEWORK FOR BRIDGING LAND SYSTEM ARCHITECTURE AND LANDSCAPE ECOLOGY: A CASE STUDY FROM THE SOUTHERN HIGH PLAINS","RESOURCE-USE DECISIONS AFFECT THE ECOLOGICAL AND HUMAN COMPONENTS OF THE COUPLED HUMAN AND NATURAL SYSTEM (CHANS), BUT A CRITIQUE OF SOME FRAMEWORKS IS THAT THEY DO NOT ADDRESS THE COMPLEXITY AND TRADEOFFS WITHIN AND BETWEEN THE TWO SYSTEMS. LAND SYSTEM ARCHITECTURE (LA) WAS SUGGESTED TO ACCOUNT FOR THESE TRADEOFFS AT MULTIPLE LEVELS/SCALES. LA AND LANDSCAPE ECOLOGY (LE) FOCUS ON LANDSCAPE STRUCTURE (I.E., COMPOSITION AND CONFIGURATION OF LAND-USE AND LAND-COVER CHANGE [LULCC]) AND THE PROCESSES (SOCIAL-ECOLOGICAL) RESULTING FROM AND SHAPING LULCC. DRAWING ON MIXED-METHODS RESEARCH IN THE SOUTHERN GREAT PLAINS, WE DEVELOP A FRAMEWORK THAT INCORPORATES LA, LE, AND GOVERNANCE THEORY. PUBLIC LAND AND WATER ARE COMMONS RESOURCES THREATENED BY OVERUSE, DEGRADATION, AND CLIMATE CHANGE. RESOURCE USE IS EXACERBATED BY PUBLIC LAND AND WATER POLICIES AT THE STATE-AND LOCAL-LEVELS. OUR FRAMEWORK PROVIDES A FOUNDATION FOR INVESTIGATING THE MECHANISMS OF LAND SYSTEMS SCIENCE (LSS) COUPLINGS ACROSS MULTIPLE LEVELS/SCALES TO UNDERSTAND HOW AND WHY GOVERNANCE IMPACTS HUMAN LULCC DECISIONS (LA) AND HOW THOSE LULCC PATTERNS INFLUENCE, AND ARE INFLUENCED BY, THE UNDERLYING ECOLOGICAL PROCESSES (LE). THIS FRAMEWORK PROVIDES A MECHANISM FOR INVESTIGATING THE FEEDBACKS BETWEEN AND AMONG THE DIFFERENT SYSTEM COMPONENTS IN A CHANS THAT SUBSEQUENTLY IMPACT FUTURE HUMAN DESIGN DECISIONS.",""
"128","Land","WEINZETTEL J, 2018, ECOL ECON","ISI000424316700027","ENVIRONMENTAL FOOTPRINTS OF AGRICULTURE EMBODIED IN INTERNATIONAL TRADE: SENSITIVITY OF HARVESTED AREA FOOTPRINT OF CHINESE EXPORTS","CONSUMPTION-BASED ACCOUNTING SEEKS TO LINK A POPULATION'S LIFESTYLES TO THEIR ENVIRONMENTAL IMPACT. INPUT-OUTPUT ANALYSIS (IOA) SERVES WELL IN THIS APPROACH AS IT COVERS ALL TRADED PRODUCTS, THEIR FULL SUPPLY CHAINS AND EXPLICITLY DELINEATES FINAL CONSUMPTION. HOWEVER, USING IOA COMES AT THE EXPENSE OF PRECISION DUE TO AGGREGATION ERROR. THERE HAS BEEN A RECENT DISCUSSION ON THE PLAUSIBILITY OF IOA RESULTS OF AGRICULTURAL PRESSURES. WE LOOK AT THE HARVESTED AREA FOOTPRINT OF CHINESE EXPORTS, OPEN THE BLACK BOX OF THE RESULTS OF IOA AND PROVIDE A DETAILED COMPOSITION OF THE FOOTPRINT. THIS HELPS TO UNDERSTAND WHETHER ITS SIZE IS A RESULT OF THE POOR PRECISION OF IOA METHODS, OR WHETHER IT IS BASED ON PLAUSIBLE PRODUCTION PATTERNS OF THE EXPORTED PRODUCTS. WE HYBRIDIZE THE EXIOBASE DATABASE, IDENTIFY THE MOST IMPORTANT EXPORTED PRODUCTS, APPLY STRUCTURAL PATH ANALYSIS IN ORDER TO IDENTIFY THE MOST IMPORTANT PRODUCTION NODES IN THEIR PRODUCTION PATHS AND APPLY A SENSITIVITY ANALYSIS OVER THE MODEL. WE SHOW THAT THE RESULTS OF THE HYBRID MRIO METHOD ARE GENERALLY ROBUST TO ASSUMPTIONS. OUR RESULTS INDICATE THAT WHILE THE UNCERTAINTY OF THE SIGN OF NET TRADE FOOTPRINT CAN BE HIGH, THE UNCERTAINTY OF NATIONAL ENVIRONMENTAL FOOTPRINT ACCOUNTS IS LOW.",""
"129","Land","BARTON GG, 2018, CONDOR","ISI000424772100003","LONG-TERM CHANGES IN THE SEASONAL TIMING OF LANDBIRD MIGRATION ON THE PACIFIC FLYWAY","THE SEASONAL PHENOLOGY OF LATITUDINAL MOVEMENTS IS ONE OF THE KEY LIFE-HISTORY TRAITS OF MIGRATORY BIRDS. WE USED QUANTILE REGRESSION TO EXAMINE LONG-TERM CHANGES IN THE TIMING OF SPRING AND AUTUMN MIGRATION IN 5 SPECIES OF MIGRATORY PASSERINE BIRDS CAPTURED AT A BANDING STATION IN NORTHERN CALIFORNIA, USA, OVER A 22 YR PERIOD FROM 1987 TO 2008. OUR 5 STUDY SPECIES INCLUDED 3 SHORT-DISTANCE MIGRANTS, PACIFIC-SLOPE FLYCATCHER (EMPIDONAX DIFFICILIS), ORANGE-CROWNED WARBLER (OREOTHLYPIS CELATA), AND WILSON'S WARBLER (CARDELLINA PUSILLA); AND 2 LONG-DISTANCE MIGRANTS, SWAINSON'S THRUSH (CATHARUS USTULATUS) AND YELLOW WARBLER (SETOPHAGA PETECHIA). MEDIAN TIMING OF MIGRATION ADVANCED IN SPRING FOR 2 OF THE 5 SPECIES (-2.5 DAYS DECADE(-1)) BUT WAS DELAYED DURING AUTUMN MIGRATION FOR 3 OF THE SPECIES (+2.9 DAYS DECADE(-1)). THE DURATION OF THE MIGRATION PERIOD ALSO BECAME COMPRESSED IN SOME SPECIES BUT MORE PROTRACTED IN OTHERS. WE TESTED WHETHER ANNUAL VARIATION IN MIGRATION TIMING WAS RELATED TO 3 INDICES OF REGIONAL CLIMATIC CONDITIONS: THE PACIFIC-NORTH AMERICAN INDEX, MULTIVARIATE EL NINO-SOUTHERN OSCILLATION INDEX, AND NORTH ATLANTIC OSCILLATION INDEX. CLIMATE INDICES EXPLAINED RELATIVELY LITTLE OF THE VARIATION IN MIGRATION TIMING (R(2) < 0.35), BUT ADVANCES IN SPRING MIGRATION AND DELAYS IN AUTUMN MIGRATION WERE ASSOCIATED WITH WARM, WET CONDITIONS DURING POSITIVE PHASES OF THE CLIMATE INDICES. THE STRONGEST EFFECTS OF CLIMATIC CONDITIONS ON MIGRATION TIMING WERE FOUND AMONG SHORT-DISTANCE MIGRANTS, WITH THE LARGEST CHANGES IN TIMING DUE TO VARIATION IN THE EL NINO-SOUTHERN OSCILLATION AND PACIFIC-NORTH AMERICAN INDICES. LINKAGES BETWEEN THE TIMING OF MOVEMENTS AND CLIMATIC CONDITIONS INDICATE THAT PASSERINE BIRDS ON THE PACIFIC COAST EXHIBIT PHENOTYPIC PLASTICITY IN THEIR MIGRATION TIMING, BUT FUTURE STUDIES BASED ON EXPERIMENTAL METHODS ARE NEEDED TO TEST ALTERNATIVE ECOLOGICAL MECHANISMS.",""
"130","Land","CHEN B, 2018, SCI TOTAL ENVIRON","ISI000414160500096","GLOBAL LAND-WATER NEXUS: AGRICULTURAL LAND AND FRESHWATER USE EMBODIED IN WORLDWIDE SUPPLY CHAINS","AS AGRICULTURAL LAND AND FRESHWATER INEXTRICABLY INTERRELATE AND INTERACT WITH EACH OTHER, THE CONVENTIONAL WATER AND LAND POLICY IN ``SILOS'' SHOULD GIVE WAY TO NEXUS THINKING WHEN FORMULATING THE LAND AND WATER MANAGEMENT STRATEGIES. THIS STUDY CONSTRUCTS A SYSTEMS MULTI-REGIONAL INPUT-OUTPUT (MRIO) MODEL TO EXPOUND GLOBAL LAND-WATER NEXUS BY SIMULTANEOUSLY TRACKING AGRICULTURAL LAND AND FRESHWATER USE FLOWS ALONG THE GLOBAL SUPPLY CHAINS. FURTHERMORE, LAND PRODUCTIVITY AND IRRIGATIONWATER REQUIREMENTS OF 160 CROPS IN DIFFERENT REGIONS ARE INVESTIGATED TO REFLECT THE LAND-WATER LINKAGE. RESULTS SHOW THAT DEVELOPED ECONOMIES (E.G., USA AND JAPAN) AND MAJOR LARGE DEVELOPING ECONOMIES (E.G., MAINLAND CHINA AND INDIA) ARE THE OVERRIDING DRIVERS OF AGRICULTURAL LAND AND FRESHWATER USE GLOBALLY. IN GENERAL, SIGNIFICANT NET TRANSFERS OF THESE TWO RESOURCES ARE IDENTIFIED FROM RESOURCE-RICH AND LESS-DEVELOPED ECONOMIES TO RESOURCE-POOR AND MORE-DEVELOPED ECONOMIES. FOR SOME CROPS, BLUEWATER PRODUCTIVITY IS INVERSELY RELATED TO LAND PRODUCTIVITY, INDICATING THAT IRRIGATIONWATER CONSUMPTION IS SOMETIMES AT ODDS WITH LAND USE. THE RESULTS COULD STIMULUS INTERNATIONAL COOPERATION FOR SUSTAINABLE LAND AND FRESHWATER MANAGEMENT TARGETING ON ORIGINAL SUPPLIERS AND FINAL CONSUMERS ALONG THE GLOBAL SUPPLY CHAINS. MOREOVER, CROP-SPECIFIC LAND-WATER LINKAGE COULD PROVIDE INSIGHTS FOR TRADE-OFF DECISIONS ON MINIMIZING THE ENVIRONMENTAL IMPACTS ON LOCAL LAND AND WATER RESOURCES. (C) 2017 ELSEVIER B.V. ALL RIGHTS RESERVED.",""
"131","Land","WENG W, 2018, HYDROL EARTH SYST SCI","ISI000423877400004","AERIAL AND SURFACE RIVERS: DOWNWIND IMPACTS ON WATER AVAILABILITY FROM LAND USE CHANGES IN AMAZONIA","THE ABUNDANT EVAPOTRANSPIRATION PROVIDED BY THE AMAZON FORESTS IS AN IMPORTANT COMPONENT OF THE HYDROLOGICAL CYCLE, BOTH REGIONALLY AND GLOBALLY. SINCE THE LAST CENTURY, DEFORESTATION AND EXPANDING AGRICULTURAL ACTIVITIES HAVE BEEN CHANGING THE ECOSYSTEM AND ITS PROVISION OF MOISTURE TO THE ATMOSPHERE. HOWEVER, IT REMAINS UNCERTAIN HOW THE ONGOING LAND USE CHANGE WILL INFLUENCE RAINFALL, RUNOFF, AND WATER AVAILABILITY AS FINDINGS FROM PREVIOUS STUDIES DIFFER. USING MOISTURE TRACKING EXPERIMENTS BASED ON OBSERVATIONAL DATA, WE PROVIDE A SPATIALLY DETAILED ANALYSIS RECOGNIZING POTENTIAL TELECONNECTION BETWEEN SOURCE AND SINK REGIONS OF ATMOSPHERIC MOISTURE. WE APPLY LAND USE SCENARIOS IN UPWIND MOISTURE SOURCES AND QUANTIFY THE CORRESPONDING RAINFALL AND RUNOFF CHANGES IN DOWNWIND MOISTURE SINKS. WE FIND SPATIALLY VARYING RESPONSES OF WATER REGIMES TO LAND USE CHANGES, WHICH MAY EXPLAIN THE DIVERSE RESULTS FROM PREVIOUS STUDIES. PARTS OF THE PERUVIAN AMAZON AND WESTERN BOLIVIA ARE IDENTIFIED AS THE SINK AREAS MOST SENSITIVE TO LAND USE CHANGE IN THE AMAZON AND WE HIGHLIGHT THE CURRENT WATER STRESS BY AMAZONIAN LAND USE CHANGE ON THESE AREAS IN TERMS OF THE WATER AVAILABILITY. FURTHERMORE, WE ALSO IDENTIFY THE INFLUENTIAL SOURCE AREAS WHERE LAND USE CHANGE MAY CONSIDERABLY REDUCE A GIVEN TARGET SINK'S WATER RECEPTION (FROM OUR EXAMPLE OF THE UCAYALI RIVER BASIN OUTLET, RAINFALL BY 5-12\% AND RUNOFF BY 19-50\% ACCORDING TO SCENARIOS). SENSITIVE SINKS AND INFLUENTIAL SOURCES ARE THEREFORE SUGGESTED AS HOTSPOTS FOR ACHIEVING SUSTAINABLE LAND-WATER MANAGEMENT.",""
