"","TOPIC","AUTHOR","UID","TITLE","ABSTRACT","NOTES"
"174","Land","BEYLOT A, 2016, WASTE MANAGE","ISI000372676300052","A CONSUMPTION APPROACH TO WASTES FROM ECONOMIC ACTIVITIES","IN A CONTEXT OF WASTE MANAGEMENT POLICIES AIMED AT PROMOTING WASTE PREVENTION AND RECYCLING AND, CONVERSELY, REDUCING WASTE LANDFILLING, THIS STUDY INVESTIGATES HOW WASTE IS GENERATED AND TREATED IN A CONSUMPTION PERSPECTIVE. A WASTE INPUT-OUTPUT ANALYSIS IS IMPLEMENTED THAT CONSIDERS 14 WASTE FRACTIONS AND FOUR WASTE MANAGEMENT TECHNIQUES. INPUT-OUTPUT TABLES EXTENDED TO WASTES ARE INITIALLY COMPILED FOR THE YEAR 2008 CONSIDERING FRANCE AND FIVE OF ITS MAIN IMPORT SUPPLIERS, AND FURTHER COMPLETED WITH DATA ON WASTE TREATMENT. WASTES FROM ECONOMIC ACTIVITIES ARE ACCORDINGLY REALLOCATED TO THE PRODUCT CATEGORIES OF HOUSEHOLD CONSUMPTION THAT INDUCE THEIR PRODUCTION. IN PARTICULAR, CONSIDERING FIVE WASTE CATEGORIES (DRY RECYCLABLE WASTES, MIXED WASTES, MINERAL WASTES, ORGANIC WASTES, AND TOTAL WASTES) AS AN AGGREGATION OF THE 14 WASTE FRACTIONS STUDIED, THE TEN PRODUCT CATEGORIES WITH THE HIGHEST CONTRIBUTION ACCOUNT FOR 64-86\% OF THE TOTAL GENERATION OF WASTES. WASTE INTENSITY AND VOLUME OF EXPENSES ARE ANALYZED AS THE DRIVERS FOR THE AMOUNTS OF WASTES INDUCED BY EACH PRODUCT CATEGORY. SIMILARLY, THE PRODUCTS RESPONSIBLE FOR THE LARGEST AMOUNTS OF WASTE LANDFILLING AND INCINERATION WITHOUT ENERGY RECOVERY, I.E. THE MANAGEMENT TECHNIQUES AT THE BOTTOM OF THE ``WASTE MANAGEMENT HIERARCHY'' ARE IDENTIFIED. MOREOVER, THIS STUDY HIGHLIGHTS THE RELATIVE IMPORTANCE OF WASTE PRODUCED ABROAD AS COMPARED TO THAT PRODUCED IN FRANCE, REGARDING THE TOTAL AMOUNT OF WASTE INDUCED BY FRENCH HOUSEHOLD CONSUMPTION. THE SENSITIVITY OF RESULTS TO THE MODELING OF IMPORT PRODUCTION IS SUBSEQUENTLY DISCUSSED. FINALLY, THE POTENTIAL PERSPECTIVES FOR THIS TYPE OF CONSUMPTION APPROACH ARE CONSIDERED WITH RESPECT TO ITS UTILITY AND CURRENT LIMITATIONS IN A CONTEXT OF WASTE POLICY PLANNING, AND MORE PARTICULARLY REGARDING THE WAY WASTE POLICY TARGETS ARE SET. (C) 2016 ELSEVIER LTD. ALL RIGHTS RESERVED.",""
"175","Land","MISRA V, 2016, CLIM DYN","ISI000370030900035","RECONCILING DROUGHTS AND LANDFALLING TROPICAL CYCLONES IN THE SOUTHEASTERN UNITED STATES","A POPULAR PERCEPTION IS THAT LANDFALLING TROPICAL CYCLONES HELP TO MITIGATE DROUGHTS IN THE SOUTHEASTERN UNITED STATES (SEUS). HOWEVER INTRIGUING PARADIGMS ON THE ROLE OF LARGE SCALE SST VARIATIONS ON CONTINENTAL US INCLUDING SEUS DROUGHTS AND SEASONAL ATLANTIC TROPICAL CYCLONE ACTIVITY CONFRONTS US. THESE PARADIGMS SUGGEST THAT IN THE PRESENCE OF WARM (COLD) EASTERN TROPICAL PACIFIC AND COLD (WARM) ATLANTIC OCEAN SEA SURFACE TEMPERATURE ANOMALY (SSTA) LEAD TO THE INCREASED LIKELIHOOD OF WETTER (DRIER) CONDITIONS OVER THE CONTINENTAL US INCLUDING THE SEUS. JUXTAPOSING THIS UNDERSTANDING WITH THE FACT THAT LANDFALLING TROPICAL CYCLONES CONTRIBUTE SIGNIFICANTLY TO THE ANNUAL MEAN TOTAL RAINFALL IN THE SEUS AND IN EL NIO (LA NIA) YEARS WITH COLD (WARM) TROPICAL ATLANTIC SSTA LEAD TO REDUCED (INCREASED) ATLANTIC TROPICAL CYCLONE ACTIVITY RAISES A CONFLICT ON THE ROLE OF THE LARGE-SCALE SST VARIATIONS IN SEUS HYDROCLIMATE. THIS STUDY ATTEMPTS TO INVESTIGATE THE APPARENT DICHOTOMOUS ROLE OF THE LARGE SCALE SST VARIATIONS ON THE SEUS HYDROLOGY BY EXAMINING THE ROLE OF RAINFALL FROM LANDFALLING TROPICAL CYCLONES IN THE SEUS TO LOCAL SEASONAL DROUGHTS. OUR STUDY FINDS THAT THE CONTRIBUTION OF THE RAINFALL FROM LANDFALLING TROPICAL CYCLONE ON THE MITIGATION OF MONTHLY DROUGHT IN THE 28 SEUS WATERSHEDS IS RELATIVELY INSIGNIFICANT. SO MUCH SO THAT THE HYDROLOGICAL MODEL UNCERTAINTY IN ESTIMATING THE DROUGHT INDEX OVER THE 28 SEUS WATERSHEDS IS LARGER THAN THE SENSITIVITY EXHIBITED BY THE DROUGHT INDEX TO THE INCLUSION OF RAIN FROM LANDFALLING TROPICAL CYCLONE. THE CONCLUSIONS OF THIS STUDY ARE JUSTIFIED BY THE FACT THAT THE TIMING OF THE LANDFALLING TROPICAL CYCLONE IN RELATION TO OVERALL SOIL MOISTURE CONDITIONS OF THE WATERSHED DOES NOT COINCIDE WITH A DROUGHT LIKE SITUATION IN THE 1948-2006 TIME PERIOD ANALYZED IN THIS STUDY. THIS LARGELY STEMS FROM THE FACT THAT THE LARGE-SCALE FLOW PATTERN RESULTING IN ABUNDANT (LACK OF) ADVECTION OF MOISTURE FOR ANOMALOUSLY WET (DRY) SUMMER AND FALL SEASONS IN THE SEUS EMANATING FROM THE SOURCE REGION OF THE CARIBBEAN SEA AND THE NORTHWESTERN TROPICAL ATLANTIC OCEAN COINCIDES WITH THE STEERING FLOW OF THE ATLANTIC TROPICAL CYCLONES BOUND TO MAKE LANDFALL IN THE SEUS (RECURVING AWAY FROM THE SEUS).",""
"176","Land","CHOI K, 2016, J CONSTR ENG MANAGE","ISI000370079000027","ENVIRONMENTAL, ECONOMIC, AND SOCIAL IMPLICATIONS OF HIGHWAY CONCRETE REHABILITATION ALTERNATIVES","CURRENTLY, THERE IS NO COMPREHENSIVE BENCHMARK OF LIFE-CYCLE ASSESSMENT FOR THE RIGID PAVEMENT ALTERNATIVES FOR HIGHWAY REHABILITATION. TO FILL THIS GAP, THE MAJOR OBJECTIVE OF THIS STUDY IS TO INVESTIGATE THE ENVIRONMENTAL, ECONOMIC, AND SOCIAL IMPACTS OF THE THREE MOST WIDELY ADOPTED RIGID PAVEMENT CHOICES THROUGH A LIFE-CYCLE ASSESSMENT APPROACH WITH CUSTOM-BUILT ECONOMIC INPUT-OUTPUT LIFE-CYCLE ASSESSMENT (EIO-LCA) MODELS. QUANTITY TAKEOFFS WERE PERFORMED FOR EACH ALTERNATIVE ASSUMING A 1-LANE-KM HIGHWAY REHABILITATION. SUBSEQUENTLY, THE CONSTRUCTION COSTS OF EACH ALTERNATIVE WERE COMPUTED IN ORDER TO DETERMINE THE PRESENT VALUES FOR A LIFE SPAN OF 50YEARS, WHILE AT THE SAME TIME ACCOUNTING FOR A DIFFERENT LIFE EXPECTANCY FOR EACH PAVEMENT REHABILITATION STRATEGY. THE PRESENT VALUES WERE THEN INCORPORATED INTO A CORRESPONDING EIO-LCA MODEL. THE RESULTS CLEARLY INDICATE THAT CONTINUOUSLY REINFORCED CONCRETE PAVEMENT (CRCP) IS THE MOST SUSTAINABLE CHOICE AND MUCH PREFERABLE TO THE OTHER ALTERNATIVES FOR MINIMIZING NEGATIVE ENVIRONMENTAL, ECONOMIC AND SOCIAL IMPACTS FROM THE LIFE-CYCLE PERSPECTIVE. THIS FINDING CHAMPIONS A WIDER ADOPTION OF CRCP FOR FUTURE SUSTAINABLE TRANSPORTATION INFRASTRUCTURE DEVELOPMENT PROJECTS, AS CRCP'S RELATIVELY HIGH INITIAL CONSTRUCTION COST CAN BE RECOUPED BY LONG-TERM SUSTAINED BENEFITS. THE RESULTS AND FINDINGS OF THIS STUDY CAN SERVE AS A SOLID FOUNDATION FOR INDUSTRY PRACTITIONERS AND DECISION-MAKERS TO MAKE BETTER-INFORMED PROJECT DECISIONS WHEN CHOOSING THE MOST SUSTAINABLE PAVEMENT ALTERNATIVES FROM A LIFE-CYCLE PERSPECTIVE. (C) 2015 AMERICAN SOCIETY OF CIVIL ENGINEERS.",""
"177","Land","WANG Q, 2016, AGRIC ECOSYST ENVIRON","ISI000366539900012","IDENTIFICATION AND APPORTIONMENT OF THE DRIVERS OF LAND USE CHANGE ON A REGIONAL SCALE: UNBIASED RECURSIVE PARTITIONING-BASED STOCHASTIC MODEL APPLICATION","LAND-SYSTEM SCIENCE PLACES INCREASING EMPHASIS ON THE COMPLEX, TELECOUPLED AND OFTEN NONLINEAR NATURE OF LAND-SYSTEM CHANGES. CATEGORICAL DIVERSITY, SPATIAL-TEMPORAL HETEROGENEITY AND THE RAPID CHANGE RATE OF LAND USE DRIVERS CHALLENGED RESEARCHERS TO DETERMINE THIS SOPHISTICATED NATURE OF LANDSCAPE CHANGES AT THE REGIONAL SCALE. THIS STUDY AIMS TO DEVELOP A NEW FRAMEWORK, INVOLVING REMOTE SENSING, GIS AND MACHINE LEARNING, TO IDENTIFY AND APPORTION THE IMPORTANT FACTORS RESPONSIBLE FOR LAND USE CHANGE AT THE REGIONAL SCALE. THE JIANGXI PROVINCE IN CHINA WAS USED AS A CASE STUDY. THE DRIVERS OF LAND USE CHANGE WERE IDENTIFIED AND APPORTIONED USING STOCHASTIC MODELS BASED ON UNBIASED RECURSIVE PARTITIONING METHOD EMBRACING THE CONDITIONAL INFERENCE TREE (CIT) AND RANDOM FOREST (RF) WITH A FOCUS ON CROPLAND AND URBAN LAND. REGRESSION TREES FOR DETERMINING THE MAJOR DRIVERS OF CROPLAND AND URBAN LAND CHANGE WERE ESTABLISHED. PARTIAL DEPENDENCE PLOTS AND TWO-VARIABLE INTERACTION PLOTS FROM THE RESULTING RF MODELS FOR EXPLAINING THE CONTRIBUTIONS OF THE DRIVERS OF CROPLAND AND URBAN LAND CHANGE WERE DEVELOPED. A SPATIAL AUTOREGRESSIVE MODEL WAS IMPLEMENTED AS A SUPPLEMENT TOOL TO HELP EXPLAIN THE CAUSES OF LAND USE CHANGE. THE DETERMINANTS OF CROPLAND AND URBAN LAND CHANGE WERE QUANTITATIVELY ASSESSED BY CIT AND RF ALONG WITH THE INTERACTIONS OF MULTIPLE DRIVERS. THE MODELS WERE VERIFIED USING RIGOROUS OUT-OF-SAMPLE AND ACTUAL-VERSUS-PREDICTED TESTING. THE RESULTS SHOW STRONG SUITABILITY OF UNBIASED RECURSIVE PARTITIONING-BASED MODELS TO THE ASSESSMENT OF THE COMPLEX DRIVERS OF LAND USE CHANGE AT A REGIONAL SCALE CROWN COPYRIGHT (C) 2015 PUBLISHED BY ELSEVIER B.V. ALL RIGHTS RESERVED.",""
"178","Land","IGNACIO GASPARRI N, 2016, CONSERV LETT","ISI000371241200004","THE EMERGING SOYBEAN PRODUCTION FRONTIER IN SOUTHERN AFRICA: CONSERVATION CHALLENGES AND THE ROLE OF SOUTH-SOUTH TELECOUPLINGS","SOYBEAN EXPANSION HAS BEEN A STRONG DRIVER OF DEFORESTATION AND BIODIVERSITY LOSS IN SOUTH AMERICA (SAM). HERE, WE HIGHLIGHT STRONG SIMILARITIES IN ENVIRONMENTAL, INSTITUTIONAL, AND OTHER CONTEXTUAL CONDITIONS AMONG SAM AND SOUTHERN AFRICAN (SAFR) DRY FOREST AND SAVANNA REGIONS, AND COMPILE EVIDENCE FOR AN EMERGING SOYBEAN PRODUCTION FRONTIER IN SAFR. KNOWLEDGE TRANSFER, COOPERATION, AND DIRECT INVESTMENT BETWEEN SAM AND SAFR COUNTRIES CONSTITUTE CRUCIAL ELEMENTS OF SOYBEAN EXPANSION IN AFRICA. COMPARING MAPS OF SOYBEAN SUITABILITY, BIODIVERSITY, AND CARBON REVEALED SUBSTANTIAL AND SPATIALLY DIVERSE TRADE-OFFS, SUGGESTING THAT THE EMERGING SOYBEAN FRONTIER IN SAFR MAY POSES MAJOR CHALLENGES FOR CONSERVATION. AN INCREASED FOCUS OF CONSERVATION SCIENCE ON AGRICULTURAL EXPANSION AND INTENSIFICATION IN SAFR, AS WELL AS STRONG ENVIRONMENTAL POLICIES FOR BALANCING AGRICULTURAL PRODUCTION AND CONSERVATION GOALS, ARE NEEDED TO MITIGATE POTENTIALLY LARGE TRADE-OFFS. THE COUPLING OF PRODUCTION FRONTIERS SHOULD BE A VEHICLE FOR THE TRANSFER NOT ONLY OF AGRICULTURAL TECHNOLOGY AND PRODUCTION MODELS, BUT ALSO OF EXPERIENCES IN ENVIRONMENTAL GOVERNANCE ON EMERGING AGRICULTURAL FRONTIERS.",""
"179","Land","MANIKOWSKI S, 2016, FRONT ENVIRON SCI","ISI000458351000018","SUSTAINABILITY ASSESSMENT OF LARGE IRRIGATION DAMS IN SENEGAL: A COST-BENEFIT ANALYSIS FOR THE SENEGAL RIVER VALLEY","STARTING IN THE 1970S, THE SENEGALESE GOVERNMENT INVESTED IN THE DEVELOPMENT OF IRRIGATED SCHEMES IN THE SENEGALESE PART OF THE SENEGAL RIVER VALLEY (S-SRV). FROM THAT TIME TO 2012, THE IRRIGATED SCHEMES INCREASED FROM 10,000 TO MORE THAN 110,000 HA. IN THE MEANTIME, THE ECONOMIC VIABILITY OF THESE SCHEMES STARTED TO BE QUESTIONED. IT ALSO APPEARED THAT THE ENVIRONMENTAL HEALTH AND SOCIAL COSTS MIGHT OUTWEIGH THE BENEFITS OF IRRIGATION. USING A LIFE CYCLE ASSESSMENT (LCA) APPROACH AND PROJECT COST-BENEFITS MODELING, THIS STUDY (I) QUANTIFIED THE COSTS AND BENEFITS OF THE S-SRV IRRIGATED RICE PRODUCTION, (II) EVALUATED THE COSTS AND BENEFITS OF ITS EXTERNALITIES, AND (III) DISCUSSED THE IRRIGATED RICE SUPPORT POLICY. THE NET FINANCIAL REVENUES FROM THE IRRIGATED SCHEMES WERE POSITIVE, BUT NOT THEIR ECONOMIC EQUIVALENCES. THE ECONOMIC RETURN RATE (EER) WAS BELOW THE EXPECTED 12\% AND THE NET PRESENT VALUE (NPV) OVER 20 YEARS OF THE PROJECT REPRESENTED A LOSS OF ABOUT US\$-19.6 MILLION. HOWEVER, IF WE ALSO INCLUDE THE PROJECT'S NEGATIVE EXTERNALITIES, SUCH AS THE REDUCED PRODUCTIVITY OF THE VALLEY ECOSYSTEMS, PROTECTION COST OF HUMAN HEALTH, ENVIRONMENTAL DEGRADATION, AND SOCIAL IMPACTS, THEN THE NPV WOULD BE MUCH WORSE, APPROXIMATELY US\$-572.1 MILLION. THEREFORE, THE RESULTS SHOW THAT TO STOP THE ECONOMIC LOSS AND ALLEVIATE THE HUMAN SUFFERING, THE S-SRV DEVELOPMENT POLICY SHOULD BE REVISED USING AN INTEGRATED APPROACH AND THE EXPLOITATION TECHNOLOGY SHOULD AIM AT ENVIRONMENTAL SUSTAINABILITY. THIS PAPER MAY OFFER USEFUL INSIGHTS FOR REVIEWING THE CURRENT SENEGALESE POLICIES FOR THE VALLEY, AS WELL AS FOR ASSESSING OTHER SIMILAR CASES OR FUTURE PROJECTS WORLDWIDE, PARTICULARLY IN CRITICAL ZONES OF DEVELOPING COUNTRIES.",""
"180","Land","FRIIS C, 2016, J LAND USE SCI","ISI000404054800001","FROM TELECONNECTION TO TELECOUPLING: TAKING STOCK OF AN EMERGING FRAMEWORK IN LAND SYSTEM SCIENCE","LAND USE CHANGE IS INFLUENCED BY A COMPLEXITY OF DRIVERS THAT TRANSCEND SPATIAL, INSTITUTIONAL AND TEMPORAL SCALES. THE ANALYTICAL FRAMEWORK OF TELECOUPLING HAS RECENTLY BEEN PROPOSED IN LAND SYSTEM SCIENCE TO ADDRESS THIS COMPLEXITY, PARTICULARLY THE INCREASING IMPORTANCE OF DISTAL CONNECTIONS, FLOWS AND FEEDBACKS CHARACTERISING CHANGE IN LAND SYSTEMS. THIS FRAMEWORK HOLDS IMPORTANT POTENTIAL FOR ADVANCING THE ANALYSIS OF LAND SYSTEM CHANGE. IN THIS ARTICLE, WE REVIEW THE STATE OF THE ART OF THE TELECOUPLING FRAMEWORK IN THE LAND SYSTEM SCIENCE LITERATURE. THE ARTICLE TRACES THE DEVELOPMENT OF THE FRAMEWORK FROM TELECONNECTION TO TELECOUPLING AND PRESENTS TWO APPROACHES TO TELECOUPLING ANALYSIS CURRENTLY PROPOSED IN THE LITERATURE. SUBSEQUENTLY, WE DISCUSS A NUMBER OF ANALYTICAL CHALLENGES RELATED TO CATEGORISATION OF SYSTEMS, SYSTEM BOUNDARIES, HIERARCHY AND SCALE. FINALLY, WE PROPOSE APPROACHES TO ADDRESS THESE CHALLENGES BY LOOKING BEYOND LAND SYSTEM SCIENCE TO THEORETICAL PERSPECTIVES FROM ECONOMIC GEOGRAPHY, SOCIAL METABOLISM STUDIES, POLITICAL ECOLOGY AND CULTURAL ANTHROPOLOGY.",""
"181","Land","O'SULLIVAN D, 2016, J LAND USE SCI","ISI000404054800003","STRATEGIC DIRECTIONS FOR AGENT-BASED MODELING: AVOIDING THE YAAWN SYNDROME","IN THIS SHORT COMMUNICATION, WE EXAMINE HOW AGENT-BASED MODELING HAS BECOME COMMON IN LAND CHANGE SCIENCE AND IS INCREASINGLY USED TO DEVELOP CASE STUDIES FOR PARTICULAR TIMES AND PLACES. THERE IS A DANGER THAT THE RESEARCH COMMUNITY IS MISSING A PRIME OPPORTUNITY TO LEARN BROADER LESSONS FROM THE USE OF AGENT-BASED MODELING (ABM), OR AT THE VERY LEAST NOT SHARING THESE LESSONS MORE WIDELY. HOW DO WE FIND AN APPROPRIATE BALANCE BETWEEN EMPIRICALLY RICH, REALISTIC MODELS AND SIMPLER THEORETICALLY GROUNDED MODELS? WHAT ARE APPROPRIATE AND EFFECTIVE APPROACHES TO MODEL EVALUATION IN LIGHT OF UNCERTAINTIES NOT ONLY IN MODEL PARAMETERS BUT ALSO IN MODEL STRUCTURE? HOW CAN WE BEST EXPLORE HYBRID MODEL STRUCTURES THAT ENABLE US TO BETTER UNDERSTAND THE DYNAMICS OF THE SYSTEMS UNDER STUDY, RECOGNIZING THAT NO SINGLE APPROACH IS BEST SUITED TO THIS TASK? UNDER WHAT CIRCUMSTANCES - IN TERMS OF MODEL COMPLEXITY, MODEL EVALUATION, AND MODEL STRUCTURE - CAN ABMS BE USED MOST EFFECTIVELY TO LEAD TO NEW INSIGHT FOR STAKEHOLDERS? WE EXPLORE THESE QUESTIONS IN THE HOPE OF HELPING THE GROWING COMMUNITY OF LAND CHANGE SCIENTISTS USING MODELS IN THEIR RESEARCH TO MOVE FROM `YET ANOTHER MODEL' TO DOING BETTER SCIENCE WITH MODELS.",""
"182","Land","MAGLIOCCA NR, 2016, J LAND USE SCI","ISI000399047700003","EVOLVING HUMAN LANDSCAPES: A VIRTUAL LABORATORY APPROACH","DIFFERENT HUMAN SOCIETIES SHAPE LANDSCAPES DIFFERENTLY. ANTHROECOLOGY THEORY EXPLAINS THIS LONG-TERM DIFFERENTIAL SHAPING OF LANDSCAPES AS THE PRODUCT OF SOCIOCULTURAL NICHE CONSTRUCTION (SNC): AN EVOLUTIONARY THEORY COUPLING SOCIAL CHANGE WITH ECOSYSTEM ENGINEERING. THE EVOLUTIONARY MECHANISMS UNDERPINNING THIS THEORY CANNOT BE TESTED WITHOUT EXPERIMENTAL APPROACHES CAPABLE OF REPRODUCING EMERGENT SELECTION PROCESSES ACTING ON THE COMBINED SUITE OF CULTURAL, MATERIAL, AND ECOLOGICAL INHERITANCES THAT DETERMINE THE ADAPTIVE FITNESS OF HUMAN INDIVIDUALS, GROUPS, AND SOCIETIES. AGENT-BASED MODELING, AS A ` GENERATIVE SOCIAL SCIENCE' TOOL, APPEARS IDEAL FOR THIS. HERE WE PROPOSE AN AGENTBASED VIRTUAL LABORATORY (ABVL) APPROACH TO GENERATING AND TESTING BASIC HYPOTHESES ON SNC AS A GENERAL MECHANISM CAPABLE OF PRODUCING THE BROADLY VARIED ANTHROECOLOGICAL FORMS AND DYNAMICS OF HUMAN LANDSCAPES FROM PREHISTORY TO PRESENT. WHILE MAJOR CHALLENGES MUST STILL BE OVERCOME, A PROSPECTIVE MODELING FRAMEWORK SPECIFICATION, GUIDING QUESTIONS, AND ILLUSTRATIVE EXAMPLES DEMONSTRATE CLEAR POTENTIAL FOR AN ABVL TO TEST PREDICTIONS OF ANTHROECOLOGY THEORY THROUGH GENERATIVE SOCIAL SIMULATION.",""
"183","Land","BAUMANN M, 2016, J LAND USE SCI","ISI000399047700004","THE IMPACTS OF WARFARE AND ARMED CONFLICT ON LAND SYSTEMS","LAND-USE DECISIONS CAN CHANGE ABRUPTLY IN RESPONSE TO SHOCKS, AND WARFARE AND ARMED CONFLICTS ARE AMONG THE MOST DRASTIC AND GLOBALLY FREQUENT SHOCKS. YET, OUR UNDERSTANDING OF WHERE ARMED CONFLICT AFFECTS LAND SYSTEMS, HOW LAND-USE PATTERNS ARE IMPACTED, AND HOW FAR-REACHING AND PERSISTENT THESE CHANGES ARE, IS PARTIAL. WE USED A SPATIALLY DETAILED DATASET ON ARMED CONFLICT AND A LITERATURE REVIEW TO EXPLORE THESE QUESTIONS. A NUMBER OF KEY INSIGHTS EMERGED FROM OUR STUDY: (1) WARFARE AND ARMED CONFLICT AFFECT LAND SYSTEMS MAINLY IN MORE DENSELY POPULATED AREAS, REGARDLESS OF THE DOMINATING LAND USE; (2) WARFARE AND ARMED CONFLICT CAN IMPACT LAND SYSTEMS IN MAJOR WAYS, BUT THESE EFFECTS ARE DIVERSE AND NOT UNIDIRECTIONAL; (3) WARFARE AND ARMED CONFLICT PRIMARILY AFFECTS LAND SYSTEMS LOCALLY, BUT CAN FORGE TELECOUPLINGS; AND (4) ALTHOUGH THE IMPACT OF WARFARE AND ARMED CONFLICT IS OFTEN IMMEDIATE, IT CAN INSTIGATE LONG-LASTING LAND-USE LEGACIES.",""
"184","Land","TURNER BL, 2016, J LAND USE SCI","ISI000399047700005","LAND SYSTEM ARCHITECTURE FOR URBAN SUSTAINABILITY: NEW DIRECTIONS FOR LAND SYSTEM SCIENCE ILLUSTRATED BY APPLICATION TO THE URBAN HEAT ISLAND PROBLEM","LAND SYSTEM SCIENCE (LSS) HAS EXPANDED ITS RESEARCH FOCUS FROM THE DRIVERS OF LAND-USE AND -COVER CHANGE PRIMARILY IN RURAL WILDLANDS TO INCLUDE THE SOCIAL-ENVIRONMENTAL CONSEQUENCES OF THIS CHANGE, URBAN AREAS, AND SUSTAINABILITY PRACTICE. LAND SYSTEM ARCHITECTURE, INTERACTING WITH THE LANDSCAPE MOSAIC APPROACH IN ECOLOGY, OFFERS A SPECIAL NICHE FOR THE ENTRY OF RURAL AREAS AND WILDLANDS INTO URBAN SUSTAINABILITY RESEARCH THROUGH EXAMINATIONS OF THE COMPOSITION AND CONFIGURATION OF ` CITYSCAPES'. GIVEN THE FINE-GRAIN DATA REQUIREMENTS OF HETEROGENEOUS CITYSCAPES, EMERGENT LAND ARCHITECTURE-MOSAIC APPROACHES HAVE LARGELY EXPLORED THE URBAN HEAT ISLAND (UHI) PROBLEM, A TOPIC THAT LINKS LSS WITH THE INTERESTS OF URBAN CLIMATOLOGY, ENGINEERING, AND PLANNING IN CITY MORPHOLOGY OR GEOMETRY. THE SUBTLE DISTINCTIONS IN THE TREATMENT OF LAND CONFIGURATION BETWEEN LAND ARCHITECTURE-MOSAIC APPROACHES AND URBAN MORPHOLOGY-GEOMETRY APPROACHES ARE IDENTIFIED. SEVERAL EXAMPLES OF THE LAND ARCHITECTURE-MOSAIC APPROACH ILLUSTRATE THE UNDERSTANDING GAINED ABOUT THE UHI PROBLEM AS WELL AS ITS COMPLEMENTARITY WITH MORPHOLOGY-GEOMETRY APPROACHES. THIS UNDERSTANDING PROVIDES INSIGHTS ABOUT THE DESIGN OF URBAN AREAS AT THE PARCEL TO NEIGHBORHOOD SCALES TO AMELIORATE EXTREME TEMPERATURES, AN ISSUE OF INCREASING CONCERN FOR URBAN AREAS WORLDWIDE AND CONSISTENT WITH THE SUSTAINABILITY PROBLEMS IDENTIFIED BY SUCH INTERNATIONAL PROGRAMS AS FUTURE EARTH.",""
"185","Land","HUBACEK K, 2016, LAND USE POL","ISI000367755700018","COMPARING APPLES AND ORANGES: SOME CONFUSION ABOUT USING AND INTERPRETING PHYSICAL TRADE MATRICES VERSUS MULTI-REGIONAL INPUT-OUTPUT ANALYSIS","THE QUESTIONS OF HOW TO ACCOUNT FOR UPSTREAM LAND REQUIREMENTS IS HIGHLY RELEVANT FOR ASSIGNING RESPONSIBILITY FOR GLOBAL LAND USE. TWO APPROACHES, PHYSICAL TRADE FLOW ANALYSIS AND MULTI-REGIONAL INPUT-OUTPUT ANALYSIS HAVE BEEN FREQUENTLY USED FOR LAND ACCOUNTING OF INTERNATIONAL TRADE LEADING TO DIAMETRICALLY OPPOSED RESULTS FOR COUNTRIES SUCH AS CHINA. IN THIS STUDY, WE INVESTIGATE AND EXPLAIN THE DIFFERENCES BY COMPARING THE ESTIMATES OF CROPLAND EMBODIED IN INTERNATIONAL TRADE FOR CHINA FROM STUDIES USING PHYSICAL TRADE FLOWS (PTF) AND MULTI-REGIONAL INPUT-OUTPUT (MRIO) ANALYSIS AND PROVIDE A STEP-WISE CALCULATION TO EXPLAIN THE GAP BETWEEN ESTIMATES FROM THESE DIFFERENT APPROACHES AND THEIR INTERPRETATION. OUR RESULTS SHOW THAT THE GAP BETWEEN PTF AND MRIO IS LARGELY DUE TO THE SYSTEM BOUNDARY SELECTION AND TRUNCATION ERRORS FROM THE BOUNDARY CUT-OFF. THESE TWO APPROACHES SHOULD BE USED FOR DIFFERENT RESEARCH PURPOSES. IF FOCUSING ON THE FLOWS OF A PARTICULAR PRODUCT, IN PARTICULAR PRIMARY PRODUCTS SUCH AS RICE, WHEAT OR OTHER GRAINS, AMONG COUNTRIES THE HIGHER LEVEL OF DETAIL OF PHYSICAL FLOW MODEL IS MORE SUITED. WHEREAS WHEN ACCOUNTING FOR THE TOTAL EMBODIED LAND IN TRADE AND CONSUMPTION-BASED LAND USE BY RECIPIENT COUNTRIES TO ANALYZE DRIVERS OF LAND USE, MRIO IS MORE SUITABLE FOR TRACKING ENTIRE GLOBAL SUPPLY CHAINS. (C) 2015 ELSEVIER LTD. ALL RIGHTS RESERVED.",""
"186","Land","VERBURG PH, 2015, ANTHROPOCENE","ISI000381903600004","LAND SYSTEM SCIENCE AND SUSTAINABLE DEVELOPMENT OF THE EARTH SYSTEM: A GLOBAL LAND PROJECT PERSPECTIVE","LAND SYSTEMS ARE THE RESULT OF HUMAN INTERACTIONS WITH THE NATURAL ENVIRONMENT. UNDERSTANDING THE DRIVERS, STATE, TRENDS AND IMPACTS OF DIFFERENT LAND SYSTEMS ON SOCIAL AND NATURAL PROCESSES HELPS TO REVEAL HOW CHANGES IN THE LAND SYSTEM AFFECT THE FUNCTIONING OF THE SOCIO-ECOLOGICAL SYSTEM AS A WHOLE AND THE TRADEOFF THESE CHANGES MAY REPRESENT. THE GLOBAL LAND PROJECT HAS LED ADVANCES BY SYNTHESIZING LAND SYSTEMS RESEARCH ACROSS DIFFERENT SCALES AND PROVIDING CONCEPTS TO FURTHER UNDERSTAND THE FEEDBACKS BETWEEN SOCIAL-AND ENVIRONMENTAL SYSTEMS, BETWEEN URBAN AND RURAL ENVIRONMENTS AND BETWEEN DISTANT WORLD REGIONS. LAND SYSTEM SCIENCE HAS MOVED FROM A FOCUS ON OBSERVATION OF CHANGE AND UNDERSTANDING THE DRIVERS OF THESE CHANGES TO A FOCUS ON USING THIS UNDERSTANDING TO DESIGN SUSTAINABLE TRANSFORMATIONS THROUGH STAKEHOLDER ENGAGEMENT AND THROUGH THE CONCEPT OF LAND GOVERNANCE. AS LAND USE CAN BE SEEN AS THE LARGEST GEO-ENGINEERING PROJECT IN WHICH MANKIND HAS ENGAGED, LAND SYSTEM SCIENCE CAN ACT AS A PLATFORM FOR INTEGRATION OF INSIGHTS FROM DIFFERENT DISCIPLINES AND FOR TRANSLATION OF KNOWLEDGE INTO ACTION. (C) 2015 THE AUTHORS. PUBLISHED BY ELSEVIER LTD.",""
"187","Land","RAMESH R, 2015, ANTHROPOCENE","ISI000381903600008","LAND-OCEAN INTERACTIONS IN THE COASTAL ZONE: PAST, PRESENT \& FUTURE","THE LAND-OCEAN INTERACTIONS IN THE COASTAL ZONE (LOICZ) PROJECT WAS ESTABLISHED IN 1993 AS A CORE PROJECT OF THE INTERNATIONAL GEOSPHERE-BIOSPHERE PROGRAMME (IGBP) TO PROVIDE THE SCIENCE KNOWLEDGE TO ANSWER ``HOW WILL CHANGES IN LAND USE, SEA LEVEL AND CLIMATE ALTER COASTAL SYSTEMS, AND WHAT ARE THE WIDER CONSEQUENCES?'' IN ITS FIRST PHASE OF OPERATION (1993-2003) LOICZ BEGAN A FUNDAMENTAL INVESTIGATION FOCUSED ON BIOPHYSICAL DIMENSIONS, INCLUDING SEMINAL ASSESSMENTS OF COASTAL SEAS AS NET SOURCES OR SINKS OF ATMOSPHERIC CO2, RIVER DISCHARGE TO THE OCEANS, AND BIOGEOCHEMICAL MODELLING. IN THE SECOND GENERATION OF LOICZ (2004-2014), INCREASED ATTENTION WAS PAID TO THE HUMAN DIMENSIONS OF THE COAST, INVOLVING THE INCLUSION OF CROSS-CUTTING THEMES SUCH AS COASTAL GOVERNANCE, SOCIAL-ECOLOGICAL SYSTEMS, ECOLOGICAL ECONOMICS AND ACTIVITIES AROUND CAPACITY BUILDING AND THE PROMOTION OF EARLY CAREER SCIENTISTS. THIS PAPER PROVIDES A SYNTHESIS OF THIS WORK AND LOOKS FORWARD TO THE FUTURE CHALLENGES FOR THE PROJECT. WITH THE TRANSITION TO FUTURE EARTH, THERE IS A PARADIGM SHIFT EMERGING. THE NEW VISION IS TO SUPPORT TRANSFORMATION TO A SUSTAINABLE AND RESILIENT FUTURE FOR SOCIETY AND NATURE ON THE COAST, BY FACILITATING INNOVATIVE, INTEGRATED AND SOLUTIONS-ORIENTED SCIENCE. REALISING THIS VISION TAKES LOICZ INTO A THIRD GENERATION: TO BE AT THE FOREFRONT OF CO-DESIGNING, CO-PRODUCING AND CO-IMPLEMENTING KNOWLEDGE FOR COASTAL RESILIENCE AND SUSTAINABILITY. LOICZ AS FUTURE EARTH COASTS WILL CONTINUE TO ADDRESS `HOTSPOTS' OF COASTAL VULNERABILITY, FOCUSING ON THEMES OF DYNAMIC COASTS, HUMAN DEVELOPMENT AND THE COAST, AND PATHWAYS TO GLOBAL COASTAL SUSTAINABILITY AND CONSTRAINTS THEREOF. (C) 2016 THE AUTHORS. PUBLISHED BY ELSEVIER LTD.",""
"188","Land","CHEN GQ, 2015, LAND USE POL","ISI000367105800012","GLOBAL SUPPLY CHAIN OF ARABLE LAND USE: PRODUCTION-BASED AND CONSUMPTION-BASED TRADE IMBALANCE","CLOSELY RELATED TO FOOD SUPPLY, ARABLE LAND USE HAS BEEN EXTENSIVELY STUDIED, ESPECIALLY REGARDING BOOMING GLOBAL TRADE ACTIVITIES. HOWEVER, THE ANALYSIS ON TRADE PATTERNS OF ARABLE LAND USE, PARTICULARLY IN TERMS OF INTERMEDIATE USE AND FINAL DEMAND, IS STILL LACKING. TO SHED LIGHT ON THE COMPLEX ARABLE LAND USE RELATIONSHIPS AMONG ECONOMIES, THE GLOBAL SUPPLY CHAIN OF ARABLE LAND USE IS INTENSIVELY EXPLORED IN THE PRESENT WORK BY A SYSTEMS MULTI-REGIONAL INPUT-OUTPUT ANALYSIS FOR THE YEAR OF 2010, WITH FOCUS ON THE TRADE PATTERNS FROM THE PERSPECTIVE OF PRODUCTION AND CONSUMPTION. GLOBAL ARABLE LAND USE EMBODIED IN INTERNATIONAL TRADE IS ESTIMATED NEAR ONE THIRD THE GLOBAL ARABLE LAND USE, AND THAT EMBODIED IN INTERMEDIATE USE IS ALMOST TWICE THAT EMBODIED IN FINAL DEMAND. ARABLE LAND USE TRADE PATTERNS ARE NOTED IN TERMS OF PRODUCTION-BASED IMPORTS/EXPORTS AND CONSUMPTION-BASED IMPORTS/EXPORTS. MOST NOTABLY, MAINLAND CHINA IS SHOWN AS THE LEADING PRODUCTION-DOMINATED IMPORTER. WITH REGARD TO OTHER LARGE ECONOMIES, CANADA IS FOUND AS A PRODUCTION-ORIENTED EXPORTER, IN CONTRAST TO AUSTRALIA AS A CONSUMPTION-ORIENTED EXPORTER. JAPAN IS IDENTIFIED AS A PRODUCTION-ORIENTED IMPORTER, WHILE THE UNITED STATES IS A CONSUMPTION-ORIENTED IMPORTER. AS HEAVY TRADE IMBALANCE IS REVEALED PREVAILING NOT ONLY BETWEEN COUNTRIES AND REGIONS BUT ALSO BETWEEN INTERMEDIATE PRODUCTS AND FINAL GOODS, THE STUDY TO EXPLORE GLOBAL SUPPLY CHAINS OF ARABLE LAND USE CAN PROVIDE ESSENTIAL POLICY MAKING IMPLICATIONS FOR SECURITY AND SUSTAINABILITY IN ARABLE LAND USE AND FOOD SUPPLY ON BOTH GLOBAL AND REGIONAL SCALES. (C) 2015 ELSEVIER LTD. ALL RIGHTS RESERVED.",""
