"","TOPIC","AUTHOR","UID","TITLE","ABSTRACT","NOTES"
"16","Metric","UKIDWE NU, 2007, ENERGY","ISI000248679600002","INDUSTRIAL AND ECOLOGICAL CUMULATIVE EXERGY CONSUMPTION OF THE UNITED STATES VIA THE 1997 INPUT-OUTPUT BENCHMARK MODEL","THIS PAPER DEVELOPS A THERMODYNAMIC INPUT-OUTPUT (TIO) MODEL OF THE 1997 UNITED STATES ECONOMY THAT ACCOUNTS FOR THE FLOW OF CUMULATIVE EXERGY IN THE 488-SECTOR BENCHMARK ECONOMIC INPUT-OUTPUT MODEL IN TWO DIFFERENT WAYS. INDUSTRIAL CUMULATIVE EXERGY CONSUMPTION (ICEC) CAPTURES THE EXERGY OF ALL NATURAL RESOURCES CONSUMED DIRECTLY AND INDIRECTLY BY EACH ECONOMIC SECTOR, WHILE ECOLOGICAL CUMULATIVE EXERGY CONSUMPTION (ECEC) ALSO ACCOUNTS FOR THE EXERGY CONSUMED IN ECOLOGICAL SYSTEMS FOR PRODUCING EACH NATURAL RESOURCE. INFORMATION ABOUT EXERGY CONSUMED IN NATURE IS OBTAINED FROM THE THERMODYNAMICS OF BIOGEOCHEMICAL CYCLES. AS USED IN THIS WORK, ECEC IS ANALOGOUS TO THE CONCEPT OF EMERGY, BUT DOES NOT RELY ON ANY OF ITS CONTROVERSIAL CLAIMS. THE TIO MODEL CAN ALSO ACCOUNT FOR EMISSIONS FROM EACH SECTOR AND THEIR IMPACT AND THE ROLE OF LABOR. THE USE OF CONSISTENT EXERGETIC UNITS PERMITS THE COMBINATION OF VARIOUS STREAMS TO DEFINE AGGREGATE METRICS THAT MAY PROVIDE INSIGHT INTO ASPECTS RELATED TO THE IMPACT OF ECONOMIC SECTORS ON THE ENVIRONMENT. ACCOUNTING FOR THE CONTRIBUTION OF NATURAL CAPITAL BY ECEC HAS BEEN CLAIMED TO PERMIT BETTER REPRESENTATION OF THE QUALITY OF ECOSYSTEM GOODS AND SERVICES THAN ICEC. THE RESULTS OF THIS WORK ARE EXPECTED TO PERMIT EVALUATION OF THESE CLAIMS. IF VALIDATED, THIS WORK IS EXPECTED TO LAY THE FOUNDATION FOR THERMODYNAMIC LIFE CYCLE ASSESSMENT, PARTICULARLY OF EMERGING TECHNOLOGIES AND WITH LIMITED INFORMATION. (C) 2006 ELSEVIER LTD. ALL RIGHTS RESERVED.",""
"17","Metric","STRAUSS CH, 1992, SOL ENERGY","ISIA1992GX52200006","INPUT-OUTPUT-ANALYSIS OF ENERGY-REQUIREMENTS FOR SHORT ROTATION, INTENSIVE CULTURE, WOODY BIOMASS","A PRODUCTION MODEL FOR SHORT ROTATION, INTENSIVE CULTURE (SRIC) PLANTATIONS WAS DEVELOPED TO DETERMINE THE ENERGY AND FINANCIAL COSTS OF WOODY BIOMASS. THE MODEL WAS BASED ON HYBRID POPLARS PLANTED ON GOOD QUALITY AGRICULTURAL SITES AT A DENSITY OF 2100 CUTTINGS HA-1, WITH AVERAGE ANNUAL GROWTH FORECAST AT 16 METRIC TONNE, OVEN DRY (MG(OD)). ENERGY AND FINANCIAL ANALYSES SHOWED PREHARVEST COSTS OF 4381 MEGAJOULES (MJ) MG-1 (OD) AND \$16 (U.S.) MG-1 (OD). HARVESTING AND TRANSPORTATION REQUIREMENTS INCREASED THE TOTAL COSTS TO 6130 MJ MG-1 (OD) AND \$39 MG-1 (OD) FOR THE DELIVERED MATERIAL. ON AN ENERGY COST BASIS, THE PRINCIPAL INPUT WAS LAND, WHEREAS ON A FINANCIAL BASIS, COSTS WERE MORE UNIFORMLY DISTRIBUTED AMONG EQUIPMENT, LAND, LABOR, AND MATERIALS AND FUEL.",""
"18","Metric","KUCUKVAR M, 2019, RESOUR CONSERV RECYCL","ISI000461534800020","ASSESSING REGIONAL AND GLOBAL ENVIRONMENTAL FOOTPRINTS AND VALUE ADDED OF THE LARGEST FOOD PRODUCERS IN THE WORLD","THIS RESEARCH AIMS TO PROVIDE IMPORTANT INSIGHTS REGARDING THE ENVIRONMENTAL AND SOCIOECONOMIC IMPACTS OF THE WORLD'S LARGEST FOOD PRODUCING COUNTRIES BASED ON FOUR SUSTAINABILITY METRICS: ENERGY USE, CARBON FOOTPRINT, VALUE-ADDED AND COMPENSATION OF EMPLOYEES BY LOW, MEDIUM AND HIGH-SKILL GROUPS. WORLD INPUT-OUTPUT DATABASE IS USED AS A DETAILED AND INTERCOUNTRY AND SECTOR ECONOMIC DATABASE. TO COMPARE THE RESULTS BETWEEN GLOBAL DATABASES, EORA AND EXIOBASE ARE ALSO USED FOR COMPARATIVE ANALYSIS. THREE STATISTICAL ANALYSIS TECHNIQUES SUCH AS MANN-KENDAL TREND TEST, MATCHING INDEX AND K-MEANS CLUSTERING ALGORITHM ARE APPLIED TO PROVIDE A FURTHER INSIGHT FROM THE ANALYSIS. THE RESULTS ARE PRESENTED FOR THREE CATEGORIES: REGIONAL ON-SITE, REGIONAL SUPPLY CHAIN, AND GLOBAL SUPPLY CHAIN. THE AGRICULTURE INDUSTRY HAS THE LARGEST ENVIRONMENTAL FOOTPRINTS IN FOOD SUPPLY CHAINS. BASED ON THE MANN-KENDALL TREND TEST, THERE IS A STATISTICALLY SIGNIFICANT TREND IN CARBON, ENERGY, AND EMPLOYMENT INDICATORS. THE MAXIMUM VALUE OF THE MATCHING-INDEX OF THE OVERALL IMPACT (0.92) IS ACHIEVED BETWEEN THE EXIOBASE AND WIOD DATABASES. CHINA AND USA ARE POSITIONED IN DIFFERENT CLUSTERS BASED ON TOTAL SUSTAINABILITY PERFORMANCE WHEN USING DIFFERENT MRIO DATABASES.",""
"19","Metric","RICHTER JS, 2019, J CLEAN PROD","ISI000457952500024","A METHOD FOR ECONOMIC INPUT-OUTPUT SOCIAL IMPACT ANALYSIS WITH APPLICATION TO US ADVANCED MANUFACTURING","INDUSTRIAL SUSTAINABILITY PERFORMANCE HAS, UP UNTIL RECENTLY, BEEN MAINLY BASED ON A COMBINATION OF ECONOMIC AND ENVIRONMENTAL MEASURES. THE SOCIAL DIMENSION OF SUSTAINABILITY PERFORMANCE REMAINS LARGELY UNKNOWN. THE LACK OF UNDERSTANDING OF SOCIAL PERFORMANCE, I.E., HOW STAKEHOLDER NEEDS ARE IMPACTED BY INDUSTRIAL PRODUCTION, LIMITS THE CAPACITY OF DECISION MAKERS TO PURSUE FULLY INFORMED CHOICES. FORTUNATELY, LARGE QUANTITIES OF ECONOMIC AND SOCIAL DATA EXIST IN THE PUBLIC DOMAIN. THE VAST ECONOMIC AND SOCIAL DATA ENABLE THE CREATION OF INDUSTRY-RELATED SOCIAL IMPACT METRICS THAT CAN DESCRIBE HOW INDUSTRY DIRECTLY AFFECTS SOCIETY. HOWEVER, ASSESSING SOCIAL IMPACTS IN AN ECONOMY REQUIRES A MULTIDISCIPLINARY MODELING APPROACH. THE PROPOSED METHOD, ECONOMIC INPUT-OUTPUT SOCIAL IMPACT ASSESSMENT, IS DEVELOPED TO INTEGRATE ECONOMIC PRODUCTION WITH TWO NEW SOCIAL IMPACT METRICS BASED ON EMPLOYEE/WORKER-NEEDS: COST OF INJURIES IDENTIFIES EMPLOYEE SAFETY/SECURITY NEEDS, AND EMPLOYEES BELOW A LIVING WAGE IDENTIFIES WORKER BASIC NEEDS. THE MODEL IS APPLIED USING A CASE STUDY THAT INTRODUCES THE ECONOMICALLY IMPORTANT AND TECHNOLOGICALLY INNOVATIVE ADVANCED MANUFACTURING CLUSTER OF INDUSTRIES IN THE UNITED STATES. IN 2012, ADVANCED MANUFACTURING REPRESENTED OVER 39\% OF U.S. MANUFACTURING OUTPUT AND 7.8\%, OR \$2.25 TRILLION. OF THE U.S. TOTAL ECONOMIC OUTPUT RANKING 6TH IN THE TOTAL ECONOMY. AS A RESULT OF THE MODEL, ADVANCED MANUFACTURING WAS ATTRIBUTED 8.5\%, OR \$13 BILLION, FOR THE TOTAL NATIONAL SOCIAL IMPACTS OF COST OF INJURIES, RANKING 5TH IN THE U.S. ECONOMY. ADVANCED MANUFACTURING WAS ALSO ATTRIBUTED 3.5\%, OR 3 MILLION EMPLOYEES, FOR THE TOTAL NATIONAL SOCIAL IMPACTS OF EMPLOYEES BELOW A LIVING WAGE, RANKING 12TH OUT OF THE 16 ECONOMIC SECTORS STUDIED. THE ECONOMIC INPUT-OUTPUT SOCIAL IMPACT ASSESSMENT METHOD IS DEMONSTRATED TO PROVIDE A MEASURABLE PATH FORWARD TO EVALUATE THE SOCIAL PERFORMANCE OF INDUSTRIES. (C) 2018 ELSEVIER LTD. ALL RIGHTS RESERVED.",""
"20","Metric","ZHANG Y, 2018, J ENVIRON MANAGE","ISI000448224900031","OUTSOURCING NATURAL RESOURCE REQUIREMENTS WITHIN CHINA","CONSUMPTION DEMANDS ARE FINAL DRIVERS FOR THE EXTRACTION AND ALLOCATION OF NATURAL RESOURCES. THIS PAPER INVESTIGATES DEMAND-DRIVEN NATURAL RESOURCE REQUIREMENTS AND SPATIAL OUTSOURCING WITHIN CHINA IN 2012 BY USING THE LATEST MULTI-REGIONAL INPUT-OUTPUT MODEL. EXERGY IS ADOPTED AS A COMMON METRIC FOR NATURAL RESOURCES INPUT. THE TOTAL DOMESTIC RESOURCE EXERGY REQUIREMENTS AMOUNTED TO 125.5 EJ, OF WHICH THE EASTERN AREA CONTRIBUTED THE LARGEST SHARE OF 44.5\%, FOLLOWED BY THE WESTERN AREA (23.9\%), THE CENTRAL AREA (23.0\%) AND THE NORTHEASTERN AREA (8.6\%). INVESTMENT WAS THE LEADING FINAL DEMAND CATEGORY, ACCOUNTING FOR 52.9\% (66.4 EJ) OF NATIONAL TOTAL EMBODIED RESOURCE USE (ERU). THE TOTAL TRADE VOLUMES OF EMBODIED RESOURCE WERE EQUIVALENT TO 69.6\% OF THE TOTAL DIRECT RESOURCE INPUT (DRI), MOSTLY TRANSFERRED FROM THE CENTRAL AND WESTERN REGIONS SUCH AS INNER MONGOLIA, SHANXI, SHAANXI AND XINJIANG TO THE EASTERN REGIONS SUCH AS JIANGSU, ZHEJIANG, GUANGDONG AND SHANGHAI. THE NORTHEASTERN AND EASTERN AREAS HAD PHYSICAL NET IMPORTS OF 1213.5 PJ AND 38452.6 PJ, WHILE THE CENTRAL AND WESTERN INLAND AREAS HAD PHYSICAL NET EXPORTS OF 6364.5 PJ AND 33301.5 PJ, RESPECTIVELY. SHANGHAI, BEIJING, ZHEJIANG, JIANGSU AND GUANGDONG HAD PROMINENT ERUS WHICH RESPECTIVELY WERE 101.6, 12.6, 11.7, 8.4 AND 4.3 TIMES OF THEIR DRIS. THE ERUS OF INNER MONGOLIA, SHAANXI, SHANXI, NINGXIA AND GUIZHOU WERE EQUAL TO ONLY 17.6\%, 25.3\%, 27.9\%, 46.0\% AND 50.2\% OF THEIR DRIS, RESPECTIVELY. REGIONAL UNEVEN DEVELOPMENT RESULTED IN IMBALANCED RESOURCE REQUIREMENTS ACROSS CHINA. THE FINDINGS CAN PROVIDE A DEEP UNDERSTANDING OF CHINA'S RESOURCE-DRIVEN ECONOMIC DEVELOPMENT MODE, AND CONTRIBUTE TO REDUCING REGIONAL RESOURCE FOOTPRINTS AND THEIR ENVIRONMENT OUTCOMES UNDER THE ``NEW NORMAL ECONOMY''.",""
"21","Metric","VIVANCO DF, 2018, J IND ECOL","ISI000447649500017","NEXUS STRENGTH: A NOVEL METRIC FOR ASSESSING THE GLOBAL RESOURCE NEXUS","THE LIMITED ACCESS TO NATURAL RESOURCES IS A MAJOR CONSTRAINT FOR SUSTAINABILITY AT VARIOUS SPATIAL SCALES. THIS CHALLENGE HAS SPARKED SCHOLARLY INTEREST IN THE LINKAGES OR NEXUS BETWEEN RESOURCES, WITH A VIEW TO HELPING ANTICIPATE UNFORESEEN CONSEQUENCES, IDENTIFY TRADE-OFFS AND CO-BENEFITS, AND FIND OPTIMAL SOLUTIONS. YET, DESPITE DECADES OF RESEARCH, LIMITATIONS IN THE SCOPE AND FOCUS OF STUDIES REMAIN. RECENTLY CONSTRUCTED MULTIREGIONAL INPUT-OUTPUT (MRIO) DATABASES, WHICH COVER THE GLOBAL ECONOMY AND ITS USE OF RESOURCES IN UNPRECEDENTED DETAIL, ALLOW SYSTEMATICALLY INVESTIGATION OF RESOURCE USE BY PRODUCTION AS WELL AS CONSUMPTION PROCESSES AT VARIOUS LEVELS AND GARNER NEW INSIGHTS INTO GLOBAL RESOURCE NEXUS (GRN) ISSUES. THIS ARTICLE ADDRESSES THE QUESTION OF HOW TO PRIORITIZE SUCH ISSUES. USING THE MRIO DATABASE, EXIOBASE, WE ADDRESS THE GRN CONSIDERING FIVE KEY RESOURCES: BLUE WATER, PRIMARY ENERGY, LAND, METAL ORES, AND MINERALS. WE PROPOSE A METRIC OF NEXUS STRENGTH, WHICH RELIES ON LINEAR GOAL PROGRAMMING TO RANK INDUSTRIES AND PRODUCTS BASED ON ITS ASSOCIATED COMBINED RESOURCE USE AND VARIOUS WEIGHTING SCHEMES. OUR RESULTS VALIDATE CURRENT RESEARCH EFFORTS BY IDENTIFYING WATER, ENERGY, AND LAND AS THE STRONGEST LINKAGES GLOBALLY AND AT ALL SCALES AND, AT THE SAME TIME, LEAD TO NOVEL FINDINGS INTO THE GRN, IN THAT (1) IT APPEARS STRONGER AND MORE COMPLEX FROM THE CONSUMPTION PERSPECTIVE, (2) METALS AND MINERALS EMERGE AS CRITICAL, YET UNDERVALUED, COMPONENTS, AND (3) IT MANIFESTS WITH A CONSIDERABLE DIVERSITY ACROSS COUNTRIES OWING TO DIFFERENCES IN THE ECONOMIC STRUCTURE, DOMESTIC POLICY, TECHNOLOGY, AND RESOURCE ENDOWMENTS.",""
"22","Metric","ZHANG B, 2018, J CLEAN PROD","ISI000444364400076","TRACING NATURAL RESOURCE USES VIA CHINA'S SUPPLY CHAINS","THIS PAPER MAKES AN IN-DEPTH ANALYSIS ON DEMAND-DRIVEN NATURAL RESOURCE REQUIREMENTS IN CHINA VIA THE METHODS OF THERMODYNAMIC INPUT-OUTPUT ANALYSIS AND STRUCTURAL PATH ANALYSIS, IN ORDER TO REVEAL THE CONNECTIONS BETWEEN THE COUNTRY'S RAPID ECONOMIC DEVELOPMENT AND ITS INTENSIVE USE OF NATURAL RESOURCES. THE MAIN NATURAL RESOURCES INVESTIGATED INCLUDE CROPS, FORESTRY, RANGELAND, AQUATIC PRODUCTS, COAL, CRUDE OIL \& NATURAL GAS, FERROUS METAL ORES, NONFERROUS METAL ORES, NONMETALLIC MINERALS AND OTHER PRIMARY ENERGY, AND EXERGY IS ADOPTED AS A COMMON METRIC FOR THE RESOURCE ACCOUNTING. IN 2012, THE TOTAL DOMESTIC RESOURCE EXERGY INPUT INTO CHINESE ECONOMIC SYSTEM AMOUNTED TO 130.1 EJ, OF WHICH 44.6\% WAS INDUCED BY INVESTMENT DEMANDS. THE EMBODIED RESOURCE USE (ERU) IN CHINA'S EXPORTS WAS EQUIVALENT TO OVER ONE FIFTH OF ITS DOMESTIC RESOURCE SUPPLY. THE TWO INTEGRATIVE SECTORS OF MANUFACTURING AND CONSTRUCTION ACCOUNTED FOR 44.1\% AND 28.7\% OF THE NATIONAL TOTAL ERU, RESPECTIVELY. WE IDENTIFIED CRITICAL SUPPLY CHAIN PATHS STARTING FROM RESOURCE EXTRACTION TO FINAL DEMAND, AS WELL AS KEY INDUSTRIAL SECTORS IN DRIVING THE EXTRACTION, TRANSMISSION AND FINAL USE OF EMBODIED RESOURCES. THE TOP 50 PATHS WERE RESPONSIBLE FOR 30.4 EJ OF THE ERU. THE IDENTIFICATION OF RESOURCE SUPPLY CHAINS FROM A SYSTEMIC PERSPECTIVE IS OF GREAT IMPORTANCE WHEN RESOURCE AND ENVIRONMENTAL POLICIES ARE TO BE APPLIED TO CONCRETE INDUSTRIAL SECTORS AND OTHER ECONOMIC AGENTS. INTEGRATED APPROACHES THAT TAKE ACCOUNT OF CONSUMPTION-BASED RESOURCE INDICATORS SHOULD BE DEVELOPED FOR RESOURCE CONSERVATION AND CLEANER PRODUCTION, PARTICULARLY FOR THE ECONOMIC SYSTEM WITH A COMPLEX SUPPLY NETWORK. (C) 2018 ELSEVIER LTD. ALL RIGHTS RESERVED.",""
"23","Metric","TAN RR, 2018, J CLEAN PROD","ISI000428826300078","CARBON EMISSIONS PINCH ANALYSIS OF ECONOMIC SYSTEMS","CARBON EMISSIONS PINCH ANALYSIS IS A VARIANT OF PINCH ANALYSIS THAT WAS DEVELOPED FOR MACROSCALE CARBON CONSTRAINED ENERGY PLANNING PROBLEMS. IT USES CARBON INTENSITY AS THE MEASURE OF QUALITY OF ENERGY STREAMS TO BE ALLOCATED WITHIN A LARGE-SCALE SYSTEM. SINCE ITS INCEPTION, THIS METHOD HAS BEEN APPLIED TO VARIOUS SYSTEMS AT DIFFERENT SCALES, UTILIZED IN DIFFERENT GEOGRAPHIC CONTEXTS, AND ALSO EXTENDED TO ALLOW DIFFERENT SUSTAINABILITY METRICS, SUCH AS LAND AND WATER FOOTPRINTS, TO BE CONSIDERED. IN THIS PAPER, CARBON EMISSIONS PINCH ANALYSIS IS FURTHER EXTENDED BY COMBINING IT WITH INPUT-OUTPUT ANALYSIS. THIS HYBRID APPROACH IS CAPABLE OF ECONOMY-WIDE ANALYSIS, WHERE THE SEGMENTS OF COMPOSITE CURVES ARE COMPRISED OF THE SECTORS IN AN ECONOMIC SYSTEM; FLOW QUANTITIES ARE MEASURES IN TERMS OF ECONOMIC VALUE, WHILE QUALITY IS INDICATED BY CARBON INTENSITY. AFTER FIRST ILLUSTRATING THIS APPROACH TO A SMALL PEDAGOGICAL CASE STUDY, THE METHODOLOGY IS THEN APPLIED TO A CASE STUDY ON THE CARBON-CONSTRAINED ECONOMIC GROWTH OF THE PHILIPPINES. PROSPECTS AND LIMITATIONS OF THE POTENTIAL APPLICATION OF THIS METHODOLOGY TO OTHER CASES ARE ALSO DISCUSSED. (C) 2018 ELSEVIER LTD. ALL RIGHTS RESERVED.",""
"24","Metric","OPPON E, 2018, ECOL ECON","ISI000428008000037","MODELLING MULTI-REGIONAL ECOLOGICAL EXCHANGES: THE CASE OF UK AND AFRICA","AS ENVIRONMENTAL IMPACTS CONTINUE TO RISE, THE NEED TO IDENTIFY AND QUANTIFY THE UNDERLYING CAUSES OF THESE IMPACTS HAS PROMPTED IMPORTANT RESEARCH QUESTIONS. THIS IS HEIGHTENED BY THE FACT THAT THE PRODUCTION OF GOODS AND SERVICES IS BECOMING INCREASINGLY GLOBAL WITH COUNTRIES RELYING ON EACH OTHER THROUGH TRADE. AS SUCH, IT IS IMPORTANT TO HAVE A MECHANISM IN PLACE TO UNDERSTAND THE ENVIRONMENTAL BURDEN SHIFTS FROM ONE COUNTRY TO ANOTHER. TO THIS END, THIS PAPER EXPLOITS A PARADOX IN GLOBAL ENVIRONMENTAL ANALYSIS, WHICH STEMS FROM A FALSE DECOUPLING BETWEEN ECONOMIC AND PRODUCTION SYSTEMS AS OBSERVED IN MOST DEVELOPED NATIONS, WHICH RESULTS IN IMPROVED TERRITORIAL EMISSIONS OF THESE DEVELOPED COUNTRIES AT THE EXPENSE OF DEVELOPING COUNTRIES. ECOLOGICAL UNEQUAL EXCHANGE IS ONE SUCH CONTEMPORARY ECOLOGICAL ECONOMIC CONCEPT THAT IS USED TO HIGHLIGHT SUCH ASYMMETRIC TRANSFER OF EMBODIED NATURAL RESOURCES AND BIOPHYSICAL INDICATORS BETWEEN COUNTRIES. ATTEMPTS AT ENVIRONMENTAL IMPACTS REDUCTION EFFORTS HAS LARGELY FOCUSED ON CARBON EMISSIONS BUT GIVEN THE COMPLEX SUPPLY CHAIN CREATED THROUGH GLOBALISATION AND INTERNATIONAL TRADE, IT IS IMPORTANT TO CONSIDER OTHER IMPORTANT METRICS SUCH AS LAND AND WATER USE ALONGSIDE CARBON EMISSIONS TO DRIVE ENVIRONMENTAL POLICIES THAT WILL HOLISTICALLY ADDRESS ECOLOGICALLY UNEQUAL EXCHANGES. FOR DEVELOPING COUNTRIES IN AFRICA WHERE THE DEPENDENCE ON LAND USE AND WATER USE FOR AGRICULTURAL ACTIVITIES ARE CRUCIAL TO THE DEVELOPMENT OF NATIONAL ECONOMIES AND IN COMBATING POVERTY, AN ASSESSMENT OF THESE METRICS HAS BECOME EVEN MORE PARAMOUNT. AGAINST THIS BACKDROP, THE CURRENT WORK DRAWS UPON THE THEORETICAL CONSTRUCTS OF MULTI-REGIONAL INPUT-OUTPUT (MRIO) FRAMEWORK TO TRACE COUNTRY SPECIFIC SECTORIAL-LEVEL FLOWS OF THE AFOREMENTIONED METRICS BETWEEN A REPRESENTATIVE DEVELOPED NATION, UK, AND 27 AFRICAN REGIONS IN ORDER TO FULLY EXAMINE THEIR ECOLOGICAL EXCHANGES. KEY FINDINGS IN THE STUDY SUGGEST THAT FOR WATER CONSUMPTION AND LAND USE, THERE IS A NET EXTERNALISATION OF THESE IMPACTS FOR ALL THE 27 AFRICAN REGIONS BY THE UK. IT WAS ALSO DETERMINED THAT THE EXTENT OF THE IMBALANCE BETWEEN THE UK AND THE AFRICAN REGION IS EXCEEDINGLY FAR GREATER FOR WATER CONSUMPTION. IT IS RECOMMENDED THAT IN FORMULATING A ROBUST MULTI-NATIONAL ENVIRONMENTAL POLICY WHERE SO MANY FACTORS ARE AT PLAY, COUNTRY SPECIFIC AND INDUSTRY TARGETED APPROACH TO ECOLOGICAL UNEQUAL EXCHANGE BETWEEN NATIONS PROVIDES BETTER AND IMPROVED INSIGHT INTO ADDRESSING ENSUING ENVIRONMENTAL ISSUES.",""
"25","Metric","SIMONEN K, 2018, ENERGY BUILD","ISI000428492700012","EMBODIED CARBON AS A PROXY FOR THE ENVIRONMENTAL IMPACT OF EARTHQUAKE DAMAGE REPAIR","IN EVALUATING THE LIFE CYCLE ENVIRONMENTAL IMPACTS OF BUILDINGS, THE CONTRIBUTIONS OF SEISMIC DAMAGE ARE RARELY CONSIDERED. IN ORDER TO ENABLE A MORE COMPREHENSIVE ASSESSMENT OF A BUILDING'S ENVIRONMENTAL IMPACT BY ACCOUNTING FOR SEISMIC EVENTS, THIS PROJECT DEVELOPED AN ENVIRONMENTAL IMPACT DATABASE OF BUILDING COMPONENT SEISMIC DAMAGE - THE LARGEST OF ITS KIND KNOWN TO DATE - BY COMBINING DATA FROM CARNEGIE MELLON UNIVERSITY'S ECONOMIC INPUT-OUTPUT LIFE CYCLE ANALYSIS (LCA) DATABASE WITH COST ESTIMATES OF REPAIR PREVIOUSLY DEVELOPED FOR FEMA'S PERFORMANCE ASSESSMENT CALCULATION TOOL (PACT), A SOFTWARE THAT MODELS PROBABILISTIC SEISMIC DAMAGE IN BUILDINGS. FIFTEEN INDICATORS OF ENVIRONMENTAL IMPACTS WERE CALCULATED FOR THE REPAIR OF APPROXIMATELY 800 BUILDING COMPONENTS FOR UP TO FIVE LEVELS OF SEISMIC DAMAGE, CAPTURING `EMBODIED' IMPACTS RELATED TO CRADLE-TO-GATE MANUFACTURING OF BUILDING MATERIALS, PRODUCTS, AND EQUIPMENT. ANALYSIS OF THE DATA REVEALED THAT NON-STRUCTURAL AND ARCHITECTURAL FINISHES OFTEN DOMINATED THE ENVIRONMENTAL IMPACTS OF SEISMIC DAMAGE PER DOLLAR SPENT IN REPAIR. A STATISTICAL ANALYSIS WAS PERFORMED ON THE DATA USING PRINCIPAL COMPONENT ANALYSIS, CONFIRMING THAT EMBODIED CARBON, A POPULAR METRIC FOR EVALUATING ENVIRONMENTAL IMPACTS IN BUILDING LCAS, IS A SUITABLE PROXY FOR OTHER RELEVANT ENVIRONMENTAL IMPACT METRICS WHEN ASSESSING THE IMPACT OF REPAIRING EARTHQUAKE DAMAGE OF BUILDINGS. (C) 2018 ELSEVIER B.V. ALL RIGHTS RESERVED.",""
"26","Metric","WU F, 2018, RESOUR CONSERV RECYCL","ISI000426411700027","IDENTIFICATION OF THE CRITICAL TRANSMISSION SECTORS AND TYPOLOGY OF INDUSTRIAL WATER USE FOR SUPPLY-CHAIN WATER PRESSURE MITIGATION","THE INDUSTRIAL SYSTEM PRODUCES PRESSURE ON WATER RESOURCES BY DIRECTLY CONSUMING THE WATER NEEDED FOR INDUSTRIAL PRODUCTION AND BY INDIRECTLY CONSUMING WATER THROUGH INTERMEDIATE INPUTS. TO DATE, IDENTIFYING THE CRITICAL TRANSMISSION SECTORS FOR SUPPLY-CHAIN WATER RESOURCES PRESSURE MITIGATION HAS BEEN UNDER-EXAMINED. TO FILL THIS GAP IN KNOWLEDGE, WE USE A BETWEENNESS-BASED METHOD IN COMBINATION WITH THE STANDARD INPUT OUTPUT TABLE EXTENDED WITH WATER-RESOURCE SECTOR ACCOUNTS TO IDENTIFY THE KEY TRANSMISSION SECTORS USING ZHANGYE CITY IN THE HEIHE RIVER BASIN, CHINA AS AN EXAMPLE. THE RESULTS SHOW THAT THE SECTORS WITH LOW RANKINGS OF THE PRODUCTION-BASED INDICATOR DO NOT CONSUME LARGE AMOUNTS OF WATER RESOURCES TO DIRECTLY GENERATE PRODUCTS, WHICH DEMONSTRATES THAT THESE SECTORS HAVE LIMITED SCOPE FOR REDUCING WATER-RESOURCE CONSUMPTION. THE RESULTS ALSO INDICATE THAT THOSE SECTORS HAVING HIGHER BETWEENNESS-BASED WATER USE BUT LOWER CONSUMPTION-BASED AND PRODUCTION-BASED WATER USE MERIT CLOSE ATTENTION BECAUSE THESE SECTORS TRANSMIT RELATIVELY LARGE AMOUNTS OF WATER RESOURCES EMBODIED IN THEIR INTERMEDIATE INPUTS FROM WATER-INTENSIVE UPSTREAM INDUSTRIAL SECTORS. CONSEQUENTLY, IMPROVING PRODUCTION EFFICIENCY IN THESE SECTORS HAS AN INDIRECT EFFECT BY LOWERING THE CONSUMPTION OF UPSTREAM WATER RESOURCES. THIS STUDY ALSO SHOWS THAT THE BETWEENNESS-BASED INDICATOR IS ABLE TO PROVIDE ADDITIONAL INFORMATION BEYOND THAT GIVEN BY THE USUAL METRICS DERIVED FROM THE PRODUCTION AND DEMAND SIDES. MOREOVER, THE TYPOLOGY OF WATER USE THAT WE INNOVATIVELY GENERATE IS ABLE TO INFORM CORRESPONDING AND TARGETED SECTOR-SPECIFIC POLICIES AND STRATEGIES FOR MITIGATING WATER RESOURCES PRESSURE.",""
"27","Metric","SOUZA A, 2018, INT J LIFE CYCLE ASSESS","ISI000424920100020","SOCIAL LIFE CYCLE ASSESSMENT OF FIRST AND SECOND-GENERATION ETHANOL PRODUCTION TECHNOLOGIES IN BRAZIL","THE MAIN GOAL OF THIS STUDY IS TO SUGGEST QUANTITATIVE SOCIAL METRICS TO EVALUATE DIFFERENT SUGARCANE BIOREFINERY SYSTEMS IN BRAZIL BY EXPLORING A NOVEL HYBRID APPROACH INTEGRATING SOCIAL LIFE CYCLE ASSESSMENT AND INPUT-OUTPUT ANALYSIS. SOCIAL LIFE CYCLE ASSESSMENT IS THE MAIN METHODOLOGY FOR EVALUATING SOCIAL ASPECTS BASED ON A LIFE-CYCLE APPROACH. USING THIS FRAMEWORK, A HYBRID MODEL INTEGRATING SOCIAL LIFE CYCLE ASSESSMENT AND INPUT-OUTPUT ANALYSIS WAS INTRODUCED TO EVALUATE DIFFERENT SOCIAL EFFECTS OF BIOREFINERY SCENARIOS CONSIDERING WORKERS AS THE STAKEHOLDER CATEGORY. JOB CREATION, OCCUPATIONAL ACCIDENTS, WAGE PROFILE, EDUCATION PROFILE, AND GENDER PROFILE WERE SELECTED AS THE MAIN INVENTORY INDICATORS. A CASE STUDY OF THREE SCENARIOS CONSIDERING VARIATIONS IN AGRICULTURAL AND INDUSTRIAL TECHNOLOGIES (INCLUDING SUGARCANE STRAW RECOVERY AND SECOND-GENERATION ETHANOL PRODUCTION, FOR INSTANCE) WAS CARRIED OUT FOR EVALUATING PRESENT FIRST-GENERATION (1G-BASIC, 1G-OPTIMIZED) AND FUTURE FIRST- AND SECOND-GENERATION ETHANOL PRODUCTION (1G2G). THE 1G-BASIC SCENARIO LEADS TO HIGHER JOB CREATION LEVELS OVER THE SUPPLY CHAIN MAINLY BECAUSE OF THE INFLUENCE OF AGRICULTURAL STAGE WHOSE WORKERS ARE MOSTLY EMPLOYED IN SUGARCANE MANUAL OPERATIONS. ON THE OTHER HAND, 1G-OPTIMIZED AND 1G2G PRESENT SUPPLY CHAINS ARE MORE RELIANT ON THE MANUFACTURING, TRADE, AND SERVICES SECTORS WHOSE WORKERS ARE ASSOCIATED WITH A LOWER LEVEL OF OCCUPATIONAL ACCIDENTS, HIGHER AVERAGE WAGES, HIGHER EDUCATION LEVEL, AND MORE PARTICIPATION OF WOMEN IN THE WORK FORCE. THE USE OF A NOVEL HYBRID APPROACH INTEGRATING SOCIAL LIFE CYCLE ASSESSMENT (SLCA) AND INPUT-OUTPUT ANALYSIS (IOA) WAS USEFUL TO QUANTITATIVELY DISTINGUISH THE SOCIAL EFFECTS OVER DIFFERENT PRESENT AND FUTURE SUGARCANE BIOREFINERY SUPPLY CHAINS. AS A CONSEQUENCE, THIS APPROACH IS VERY USEFUL TO SUPPORT DECISION-MAKING PROCESSES AIMING TO IMPROVE THE SUSTAINABILITY OF SUGARCANE BIOREFINERIES TAKING SOCIAL ASPECTS INTO ACCOUNT.",""
"28","Metric","WHITE DJ, 2018, APPL ENERGY","ISI000419813100043","THE WATER-ENERGY-FOOD NEXUS IN EAST ASIA: A TELE-CONNECTED VALUE CHAIN ANALYSIS USING INTER-REGIONAL INPUT-OUTPUT ANALYSIS","POPULATION AND ECONOMIC GROWTH POSE UNIQUE CHALLENGES IN SECURING SUFFICIENT WATER, ENERGY, AND FOOD TO MEET DEMAND AT THE SUB-NATIONAL (REGIONAL), NATIONAL, AND SUPRA-NATIONAL LEVEL. AN INCREASING SHARE OF THIS DEMAND IS MET THROUGH TRADE AND IMPORTS. THE UNPRECEDENTED RAPID GROWTH, EXTENT, AND COMPLEXITY OF GLOBAL VALUE CHAINS (GVCS) SINCE THE 1980S HAVE RESHAPED GLOBAL TRADE. THE GVCS - AND NEW ECONOMIC PATTERNS OF REGIONALIZATION - AFFECT THE DEMANDS ON WATER, ENERGY, AND FOOD WITHIN COUNTRIES AND ACROSS GLOBAL SUPPLY CHAINS. EAST ASIA IS OF PARTICULAR INTEREST DUE TO THE REGION'S RAPID ECONOMIC GROWTH, SUBSTANTIAL POPULATION SIZE, HIGH INTERDEPENDENCE OF THE REGION'S ECONOMIES, AND VARYING DEGREE OF RESOURCE AVAILABILITY. WHILE GREATER INTERDEPENDENCE ACROSS THE REGION HAS INCREASED THE EFFICIENCY OF PRODUCTION AND TRADE, THESE ACTIVITIES REQUIRE THE INPUT OF WATER-ENERGY-FOOD AND GENERATE DISTURBANCES IN THE ENVIRONMENT. THE TRANSNATIONAL INTER-REGIONAL INPUT-OUTPUT APPROACH IS UTILIZED IN A TELE-CONNECTED WATER ENERGY-FOOD NEXUS (WEFN) ANALYSIS OF THE EAST ASIA GVC TO ASSESS COMPETING DEMANDS FOR THESE RESOURCES AND ENVIRONMENTAL OUTCOMES. THIS ANALYSIS DEMONSTRATES THE HIDDEN VIRTUAL FLOWS OF WATER, ENERGY, AND FOOD EMBODIED IN INTRA-REGIONAL AND TRANSNATIONAL INTER-REGIONAL TRADE. CHINA'S CURRENT NATIONAL EXPORT ORIENTED ECONOMIC GROWTH STRATEGY IN EAST ASIA IS NOT SUSTAINABLE FROM THE WEFN PERSPECTIVE. CHINA IS A NET VIRTUAL EXPORTER OF NEXUS RESOURCES TO JAPAN AND SOUTH KOREA. CHINA'S PRIORITIZATION OF ECONOMIC GROWTH AND TRADE IN LOW VALUE ADDED AND POLLUTION INTENSIVE SECTORS CONSUMES A GREAT AMOUNT OF NEXUS RESOURCES WITHIN ITS TERRITORY TO SATISFY CONSUMERS' DEMANDS IN JAPAN AND SOUTH KOREA. JAPAN'S KANTO AND KINKI REGIONS AND SOUTH KOREA'S SUDOKWON REGION WERE THE MAJOR BENEFICIARIES WHILE CHINA BORE THE ENVIRONMENTAL BURDEN ASSOCIATED WITH THE PRODUCTION OF EXPORTS. FOR EXAMPLE, NET VIRTUAL EXPORTS FROM CHINA'S EAST REGION INCLUDED OVER 1.2 BILLION M(3) OF SCARCE WATER AND 61.3 MILLION METRIC (CO2 EQUIVALENT) TONS OF GREENHOUSE GASES (I.E. CO2, NH4, AND N2O) AND 2 MILLION METRIC TONS OF SOX EMISSIONS. TRADE IS AN IMPORTANT MECHANISM FOR OVERCOMING RESOURCE BOTTLENECKS, BUT, TAKING INTO ACCOUNT ENVIRONMENTAL LINKAGES, REGIONAL SPECIALIZATION IS NOT NECESSARILY MUTUALLY BENEFICIAL. THIS ANALYSIS DEMONSTRATES A MISMATCH BETWEEN REGIONAL WATER-ENERGY-FOOD AVAILABILITY AND FINAL RESOURCE CONSUMPTION AND THE LACK OF ATTENTION FOR ENVIRONMENTAL IMPACTS IN NATIONAL ECONOMIC GROWTH STRATEGIES. RESOURCE SCARCE COUNTRIES LIKE CHINA MUST, THEREFORE, INCORPORATE TRADE-OFF DECISIONS BETWEEN PURSUING NATIONAL ECONOMIC GROWTH, INCURRING ENVIRONMENTAL DEGRADATION, AND FOOD SECURITY INTO STRATEGIC REGIONAL DEVELOPMENT POLICIES. (C) 2017 ELSEVIER LTD. ALL RIGHTS RESERVED.",""
